{"full-text-retrieval-response": {
    "scopus-eid": "2-s2.0-84925304391",
    "originalText": "serial JL 271509 291210 291788 291885 31 Cement and Concrete Research CEMENTCONCRETERESEARCH 2015-03-22 2015-03-22 2015-05-12T20:51:43 1-s2.0-S0008884615000502 S0008-8846(15)00050-2 S0008884615000502 10.1016/j.cemconres.2015.02.008 S300 S300.1 FULL-TEXT 1-s2.0-S0008884615X00056 2015-05-13T23:54:47.920002-04:00 0 0 20150701 20150731 2015 2015-03-22T02:47:21.525303Z articleinfo articletitlenorm authfirstinitialnorm authfirstsurnamenorm cid cids contenttype copyright crossmark dateloaded dateloadedtxt datesearch datesort dateupdated dco docsubtype doctype doi eid ewtransactionid hubeid indexeddate issn issnnorm itemstage itemtransactionid itemweight openaccess openarchive pg pgfirst pglast pii piinorm pubdateend pubdatestart pubdatetxt pubyr sectiontitle sortorder srctitle srctitlenorm srctype ssids alllist content subj subheadings suppl tomb volfirst volissue volumelist webpdf webpdfpagecount yearnav figure table body acknowledge affil appendices articletitle auth authfirstini authfull authkeywords authlast grantsponsor primabst ref 0008-8846 00088846 true 73 73 C Volume 73 11 111 122 111 122 201507 July 2015 2015-07-01 2015-07-31 2015 Research articles article fla Copyright © 2015 Elsevier Ltd. All rights reserved. ANEWQUANTIFICATIONMETHODBASEDSEMEDSASSESSFLYASHCOMPOSITIONSTUDYREACTIONINDIVIDUALCOMPONENTSINHYDRATINGCEMENTPASTE DURDZINSKI P 1 Introduction 1.1 Characterization of raw fly ash 1.2 Measuring the degree of reaction of fly ash 2 Materials 3 Experimental 3.1 Sample preparation 3.2 Microscope setup 3.3 Data treatment 4 Results and discussion 4.1 Characterization of a calcareous fly ash 4.2 Application of the method to different fly ashes 4.3 Quantification of the degree of reaction of fly ash 5 Conclusions Acknowledgements Appendix 1 Quality of EDS data Appendix 2 Error analysis References USGEOLOGICALSURVEY 2013 MINERALCOMMODITYSUMMARIES2013 ANDERSON 2008 1 12 J ECOCITYWORLDSUMMIT2008PROC SUSTAINABLECEMENTUSINGFLYASHEXAMINATIONNETROLEHIGHVOLUMEFLYASHCEMENTCARBONDIOXIDEEMISSIONS KOUKOUZAS 2007 2186 2193 N ERDOGDU 1998 1217 1222 K VASSILEV 2003 1793 1811 S WARD 2006 2268 2277 C EN 2011 2011CEMENTPART1COMPOSITIONSPECIFICATIONSCONFORMITYCRITERIAFORCOMMONCEMENT ASTM 2012 STANDARDC618STANDARDSPECIFICATIONFORCOALFLYASHRAWCALCINEDNATURALPOZZOLANFORUSEINCONCRETE WINBURN 2000 163 172 R NATHAN 1999 205 213 Y PIETERSEN 1993 H REACTIVITYFLYASHSLAGINCEMENT LAUF 1981 R APPLICATIONMATERIALSCHARACTERIZATIONTECHNIQUESCOALCOALWASTES DHOLE 2013 159 168 R JOHNSON 2010 3042 3050 A KUTCHKO 2006 2537 2544 B STEVENSON 1984 485 490 R STEVENSON 2011 87 R LYDON 2005 J MEASUREMENTMODALMINERALOGYROCKSSEMIMAGERYUSEMULTISPECIMAGEJFREEWARE CHANCEY 2010 146 156 R BIEHL 2002 1153 1159 L DESCHNER 2012 1389 1400 F BAERT 2008 485 492 G LAM 2000 747 756 L LUKE 1988 495 502 K SAKAI 2005 1135 1140 E OHSAWA 1985 357 366 S SUPRENANT 1991 48 59 B BENHAHA 2010 1620 1629 M SCRIVENER 1986 K KJELLSEN 1992 112 120 K ASH 1993 576 580 J MOURET 1997 109 115 M SCRIVENER 2004 935 945 K FENG 2004 1787 1793 X DESCHNER 2013 188 204 F WILLIAMS 2005 330 P AUGHENBAUGH 2013 869 880 K SNELLINGS 2013 2467 2475 R FLUEGEL 2007 2622 2625 A VOGEL 1977 170 214 W KINGERY 1983 163 171 W WOOD 1980 319 328 M HELMUTH 1987 R FLYASHINCEMENTCONCRETE NGU 2007 3437 3445 L BIBBY 1977 427 431 D MATSCHEI 2007 551 558 T MEHTA 1989 1 44 P POZZOLANICCEMENTITIOUSBYPRODUCTSINCONCRETEANOTHERLOOK DURDZINSKIX2015X111 DURDZINSKIX2015X111X122 DURDZINSKIX2015X111XP DURDZINSKIX2015X111X122XP item S0008-8846(15)00050-2 S0008884615000502 1-s2.0-S0008884615000502 10.1016/j.cemconres.2015.02.008 271509 2015-05-12T17:22:11.483402-04:00 2015-07-01 2015-07-31 1-s2.0-S0008884615000502-main.pdf https://s3.amazonaws.com/prod-ucs-content-store-us-east/content/pii:S0008884615000502/MAIN/application/pdf/d5ec1ae16ef62986b17d951d52f651b7/main.pdf https://s3-eu-west-1.amazonaws.com/prod-ucs-content-store-eu-west/content/pii:S0008884615000502/MAIN/application/pdf/d5ec1ae16ef62986b17d951d52f651b7/main.pdf main.pdf pdf true 2750694 MAIN 12 1-s2.0-S0008884615000502-main_1.png https://s3-eu-west-1.amazonaws.com/prod-ucs-content-store-eu-west/content/pii:S0008884615000502/PREVIEW/image/png/f75605f334cca26ea61a98186fc7dbe8/main_1.png https://s3.amazonaws.com/prod-ucs-content-store-us-east/content/pii:S0008884615000502/PREVIEW/image/png/f75605f334cca26ea61a98186fc7dbe8/main_1.png main_1.png png 61488 849 656 IMAGE-WEB-PDF 1 1-s2.0-S0008884615000502-gr9.jpg https://s3.amazonaws.com/prod-ucs-content-store-us-east/content/pii:S0008884615000502/gr9/DOWNSAMPLED/image/jpeg/19cb2a9d9b8684d017d95049de2c340a/gr9.jpg https://s3-eu-west-1.amazonaws.com/prod-ucs-content-store-eu-west/content/pii:S0008884615000502/gr9/DOWNSAMPLED/image/jpeg/19cb2a9d9b8684d017d95049de2c340a/gr9.jpg gr9 gr9.jpg jpg 20319 242 390 IMAGE-DOWNSAMPLED 1-s2.0-S0008884615000502-gr8.jpg https://s3.amazonaws.com/prod-ucs-content-store-us-east/content/pii:S0008884615000502/gr8/DOWNSAMPLED/image/jpeg/435b6bdbc987371a20e59970afbd4a30/gr8.jpg https://s3-eu-west-1.amazonaws.com/prod-ucs-content-store-eu-west/content/pii:S0008884615000502/gr8/DOWNSAMPLED/image/jpeg/435b6bdbc987371a20e59970afbd4a30/gr8.jpg gr8 gr8.jpg jpg 50905 482 535 IMAGE-DOWNSAMPLED 1-s2.0-S0008884615000502-gr7.jpg https://s3.amazonaws.com/prod-ucs-content-store-us-east/content/pii:S0008884615000502/gr7/DOWNSAMPLED/image/jpeg/2bdc4cc9db9cb20b9d594ae6c97bc835/gr7.jpg https://s3-eu-west-1.amazonaws.com/prod-ucs-content-store-eu-west/content/pii:S0008884615000502/gr7/DOWNSAMPLED/image/jpeg/2bdc4cc9db9cb20b9d594ae6c97bc835/gr7.jpg gr7 gr7.jpg jpg 204391 824 513 IMAGE-DOWNSAMPLED 1-s2.0-S0008884615000502-gr6.jpg https://s3.amazonaws.com/prod-ucs-content-store-us-east/content/pii:S0008884615000502/gr6/DOWNSAMPLED/image/jpeg/223d444972ee82b8d3401610b9d3de08/gr6.jpg https://s3-eu-west-1.amazonaws.com/prod-ucs-content-store-eu-west/content/pii:S0008884615000502/gr6/DOWNSAMPLED/image/jpeg/223d444972ee82b8d3401610b9d3de08/gr6.jpg gr6 gr6.jpg jpg 18217 267 313 IMAGE-DOWNSAMPLED 1-s2.0-S0008884615000502-gr5.jpg https://s3.amazonaws.com/prod-ucs-content-store-us-east/content/pii:S0008884615000502/gr5/DOWNSAMPLED/image/jpeg/b32c6fccc6c437f624bd8912b6eadfbb/gr5.jpg https://s3-eu-west-1.amazonaws.com/prod-ucs-content-store-eu-west/content/pii:S0008884615000502/gr5/DOWNSAMPLED/image/jpeg/b32c6fccc6c437f624bd8912b6eadfbb/gr5.jpg gr5 gr5.jpg jpg 39438 340 491 IMAGE-DOWNSAMPLED 1-s2.0-S0008884615000502-gr4.jpg https://s3.amazonaws.com/prod-ucs-content-store-us-east/content/pii:S0008884615000502/gr4/DOWNSAMPLED/image/jpeg/a5dab0f9695d8554a642eb568bdccbda/gr4.jpg https://s3-eu-west-1.amazonaws.com/prod-ucs-content-store-eu-west/content/pii:S0008884615000502/gr4/DOWNSAMPLED/image/jpeg/a5dab0f9695d8554a642eb568bdccbda/gr4.jpg gr4 gr4.jpg jpg 111542 269 358 IMAGE-DOWNSAMPLED 1-s2.0-S0008884615000502-gr3.jpg https://s3.amazonaws.com/prod-ucs-content-store-us-east/content/pii:S0008884615000502/gr3/DOWNSAMPLED/image/jpeg/35b06c4a93c390848be2cba5596e9afa/gr3.jpg https://s3-eu-west-1.amazonaws.com/prod-ucs-content-store-eu-west/content/pii:S0008884615000502/gr3/DOWNSAMPLED/image/jpeg/35b06c4a93c390848be2cba5596e9afa/gr3.jpg gr3 gr3.jpg jpg 79020 269 358 IMAGE-DOWNSAMPLED 1-s2.0-S0008884615000502-gr2.jpg https://s3.amazonaws.com/prod-ucs-content-store-us-east/content/pii:S0008884615000502/gr2/DOWNSAMPLED/image/jpeg/a7cb69f30eacc395db98d702c098aab2/gr2.jpg https://s3-eu-west-1.amazonaws.com/prod-ucs-content-store-eu-west/content/pii:S0008884615000502/gr2/DOWNSAMPLED/image/jpeg/a7cb69f30eacc395db98d702c098aab2/gr2.jpg gr2 gr2.jpg jpg 93964 270 358 IMAGE-DOWNSAMPLED 1-s2.0-S0008884615000502-gr17.jpg https://s3.amazonaws.com/prod-ucs-content-store-us-east/content/pii:S0008884615000502/gr17/DOWNSAMPLED/image/jpeg/5deffc24f26e7cb62ed33d52b3cba575/gr17.jpg https://s3-eu-west-1.amazonaws.com/prod-ucs-content-store-eu-west/content/pii:S0008884615000502/gr17/DOWNSAMPLED/image/jpeg/5deffc24f26e7cb62ed33d52b3cba575/gr17.jpg gr17 gr17.jpg jpg 18502 233 390 IMAGE-DOWNSAMPLED 1-s2.0-S0008884615000502-gr16.jpg https://s3.amazonaws.com/prod-ucs-content-store-us-east/content/pii:S0008884615000502/gr16/DOWNSAMPLED/image/jpeg/13019ed108b549b2aaf1c9724d32a5f2/gr16.jpg https://s3-eu-west-1.amazonaws.com/prod-ucs-content-store-eu-west/content/pii:S0008884615000502/gr16/DOWNSAMPLED/image/jpeg/13019ed108b549b2aaf1c9724d32a5f2/gr16.jpg gr16 gr16.jpg jpg 18149 319 369 IMAGE-DOWNSAMPLED 1-s2.0-S0008884615000502-gr15.jpg https://s3.amazonaws.com/prod-ucs-content-store-us-east/content/pii:S0008884615000502/gr15/DOWNSAMPLED/image/jpeg/7881a96407e609887a6312c6d4c24314/gr15.jpg https://s3-eu-west-1.amazonaws.com/prod-ucs-content-store-eu-west/content/pii:S0008884615000502/gr15/DOWNSAMPLED/image/jpeg/7881a96407e609887a6312c6d4c24314/gr15.jpg gr15 gr15.jpg jpg 18284 290 349 IMAGE-DOWNSAMPLED 1-s2.0-S0008884615000502-gr14.jpg https://s3.amazonaws.com/prod-ucs-content-store-us-east/content/pii:S0008884615000502/gr14/DOWNSAMPLED/image/jpeg/41c332061a3cbc33fc91f7adcf7050d0/gr14.jpg https://s3-eu-west-1.amazonaws.com/prod-ucs-content-store-eu-west/content/pii:S0008884615000502/gr14/DOWNSAMPLED/image/jpeg/41c332061a3cbc33fc91f7adcf7050d0/gr14.jpg gr14 gr14.jpg jpg 24347 272 391 IMAGE-DOWNSAMPLED 1-s2.0-S0008884615000502-gr13.jpg https://s3.amazonaws.com/prod-ucs-content-store-us-east/content/pii:S0008884615000502/gr13/DOWNSAMPLED/image/jpeg/091c4e8e53c3dfa8261de28edb7ccf35/gr13.jpg https://s3-eu-west-1.amazonaws.com/prod-ucs-content-store-eu-west/content/pii:S0008884615000502/gr13/DOWNSAMPLED/image/jpeg/091c4e8e53c3dfa8261de28edb7ccf35/gr13.jpg gr13 gr13.jpg jpg 18940 324 350 IMAGE-DOWNSAMPLED 1-s2.0-S0008884615000502-gr12.jpg https://s3.amazonaws.com/prod-ucs-content-store-us-east/content/pii:S0008884615000502/gr12/DOWNSAMPLED/image/jpeg/fb88bf16331a954922965a4c24b99bc3/gr12.jpg https://s3-eu-west-1.amazonaws.com/prod-ucs-content-store-eu-west/content/pii:S0008884615000502/gr12/DOWNSAMPLED/image/jpeg/fb88bf16331a954922965a4c24b99bc3/gr12.jpg gr12 gr12.jpg jpg 36754 521 390 IMAGE-DOWNSAMPLED 1-s2.0-S0008884615000502-gr11.jpg https://s3.amazonaws.com/prod-ucs-content-store-us-east/content/pii:S0008884615000502/gr11/DOWNSAMPLED/image/jpeg/479f9644f94277116518feee9e0b9539/gr11.jpg https://s3-eu-west-1.amazonaws.com/prod-ucs-content-store-eu-west/content/pii:S0008884615000502/gr11/DOWNSAMPLED/image/jpeg/479f9644f94277116518feee9e0b9539/gr11.jpg gr11 gr11.jpg jpg 26845 270 358 IMAGE-DOWNSAMPLED 1-s2.0-S0008884615000502-gr10.jpg https://s3.amazonaws.com/prod-ucs-content-store-us-east/content/pii:S0008884615000502/gr10/DOWNSAMPLED/image/jpeg/66a61b4eac6a652910425d40a6bb1d72/gr10.jpg https://s3-eu-west-1.amazonaws.com/prod-ucs-content-store-eu-west/content/pii:S0008884615000502/gr10/DOWNSAMPLED/image/jpeg/66a61b4eac6a652910425d40a6bb1d72/gr10.jpg gr10 gr10.jpg jpg 112630 803 535 IMAGE-DOWNSAMPLED 1-s2.0-S0008884615000502-gr1.jpg https://s3.amazonaws.com/prod-ucs-content-store-us-east/content/pii:S0008884615000502/gr1/DOWNSAMPLED/image/jpeg/e7754e3185b836d6f1dab60d8f38659e/gr1.jpg https://s3-eu-west-1.amazonaws.com/prod-ucs-content-store-eu-west/content/pii:S0008884615000502/gr1/DOWNSAMPLED/image/jpeg/e7754e3185b836d6f1dab60d8f38659e/gr1.jpg gr1 gr1.jpg jpg 33096 309 714 IMAGE-DOWNSAMPLED 1-s2.0-S0008884615000502-gr9.sml https://s3.amazonaws.com/prod-ucs-content-store-us-east/content/pii:S0008884615000502/gr9/THUMBNAIL/image/gif/fd1e4e2a2abe625df6a5334c5b7e6386/gr9.sml https://s3-eu-west-1.amazonaws.com/prod-ucs-content-store-eu-west/content/pii:S0008884615000502/gr9/THUMBNAIL/image/gif/fd1e4e2a2abe625df6a5334c5b7e6386/gr9.sml gr9 gr9.sml sml 5301 136 219 IMAGE-THUMBNAIL 1-s2.0-S0008884615000502-gr8.sml https://s3.amazonaws.com/prod-ucs-content-store-us-east/content/pii:S0008884615000502/gr8/THUMBNAIL/image/gif/9f8625de0579d4dedd6b54c785e18375/gr8.sml https://s3-eu-west-1.amazonaws.com/prod-ucs-content-store-eu-west/content/pii:S0008884615000502/gr8/THUMBNAIL/image/gif/9f8625de0579d4dedd6b54c785e18375/gr8.sml gr8 gr8.sml sml 5396 164 182 IMAGE-THUMBNAIL 1-s2.0-S0008884615000502-gr7.sml https://s3.amazonaws.com/prod-ucs-content-store-us-east/content/pii:S0008884615000502/gr7/THUMBNAIL/image/gif/dfbfb2e69db65abf222e393d5771170d/gr7.sml https://s3-eu-west-1.amazonaws.com/prod-ucs-content-store-eu-west/content/pii:S0008884615000502/gr7/THUMBNAIL/image/gif/dfbfb2e69db65abf222e393d5771170d/gr7.sml gr7 gr7.sml sml 9080 164 102 IMAGE-THUMBNAIL 1-s2.0-S0008884615000502-gr6.sml https://s3.amazonaws.com/prod-ucs-content-store-us-east/content/pii:S0008884615000502/gr6/THUMBNAIL/image/gif/42c555f8c51b2fb691cf681ecf20800f/gr6.sml https://s3-eu-west-1.amazonaws.com/prod-ucs-content-store-eu-west/content/pii:S0008884615000502/gr6/THUMBNAIL/image/gif/42c555f8c51b2fb691cf681ecf20800f/gr6.sml gr6 gr6.sml sml 3470 164 192 IMAGE-THUMBNAIL 1-s2.0-S0008884615000502-gr5.sml https://s3.amazonaws.com/prod-ucs-content-store-us-east/content/pii:S0008884615000502/gr5/THUMBNAIL/image/gif/0b46f15e67e06b4bd95196faf3693d4d/gr5.sml https://s3-eu-west-1.amazonaws.com/prod-ucs-content-store-eu-west/content/pii:S0008884615000502/gr5/THUMBNAIL/image/gif/0b46f15e67e06b4bd95196faf3693d4d/gr5.sml gr5 gr5.sml sml 6933 152 219 IMAGE-THUMBNAIL 1-s2.0-S0008884615000502-gr4.sml https://s3.amazonaws.com/prod-ucs-content-store-us-east/content/pii:S0008884615000502/gr4/THUMBNAIL/image/gif/ba117e2576077aa4e0339158da2891c9/gr4.sml https://s3-eu-west-1.amazonaws.com/prod-ucs-content-store-eu-west/content/pii:S0008884615000502/gr4/THUMBNAIL/image/gif/ba117e2576077aa4e0339158da2891c9/gr4.sml gr4 gr4.sml sml 32573 164 218 IMAGE-THUMBNAIL 1-s2.0-S0008884615000502-gr3.sml https://s3.amazonaws.com/prod-ucs-content-store-us-east/content/pii:S0008884615000502/gr3/THUMBNAIL/image/gif/84909e60e4b68462e0a9b85e2d1c67ea/gr3.sml https://s3-eu-west-1.amazonaws.com/prod-ucs-content-store-eu-west/content/pii:S0008884615000502/gr3/THUMBNAIL/image/gif/84909e60e4b68462e0a9b85e2d1c67ea/gr3.sml gr3 gr3.sml sml 18960 164 218 IMAGE-THUMBNAIL 1-s2.0-S0008884615000502-gr2.sml https://s3.amazonaws.com/prod-ucs-content-store-us-east/content/pii:S0008884615000502/gr2/THUMBNAIL/image/gif/0743d8f8b8db392e6f478d6d4c783b36/gr2.sml https://s3-eu-west-1.amazonaws.com/prod-ucs-content-store-eu-west/content/pii:S0008884615000502/gr2/THUMBNAIL/image/gif/0743d8f8b8db392e6f478d6d4c783b36/gr2.sml gr2 gr2.sml sml 27582 164 218 IMAGE-THUMBNAIL 1-s2.0-S0008884615000502-gr17.sml https://s3.amazonaws.com/prod-ucs-content-store-us-east/content/pii:S0008884615000502/gr17/THUMBNAIL/image/gif/b960e910326280b4bd18b1097672aa08/gr17.sml https://s3-eu-west-1.amazonaws.com/prod-ucs-content-store-eu-west/content/pii:S0008884615000502/gr17/THUMBNAIL/image/gif/b960e910326280b4bd18b1097672aa08/gr17.sml gr17 gr17.sml sml 4879 131 219 IMAGE-THUMBNAIL 1-s2.0-S0008884615000502-gr16.sml https://s3.amazonaws.com/prod-ucs-content-store-us-east/content/pii:S0008884615000502/gr16/THUMBNAIL/image/gif/a58cef7d77143f794bb094c46a07c7ad/gr16.sml https://s3-eu-west-1.amazonaws.com/prod-ucs-content-store-eu-west/content/pii:S0008884615000502/gr16/THUMBNAIL/image/gif/a58cef7d77143f794bb094c46a07c7ad/gr16.sml gr16 gr16.sml sml 3907 163 189 IMAGE-THUMBNAIL 1-s2.0-S0008884615000502-gr15.sml https://s3.amazonaws.com/prod-ucs-content-store-us-east/content/pii:S0008884615000502/gr15/THUMBNAIL/image/gif/459d3d1e76d3b4ce366f6181559fc59d/gr15.sml https://s3-eu-west-1.amazonaws.com/prod-ucs-content-store-eu-west/content/pii:S0008884615000502/gr15/THUMBNAIL/image/gif/459d3d1e76d3b4ce366f6181559fc59d/gr15.sml gr15 gr15.sml sml 3873 164 197 IMAGE-THUMBNAIL 1-s2.0-S0008884615000502-gr14.sml https://s3.amazonaws.com/prod-ucs-content-store-us-east/content/pii:S0008884615000502/gr14/THUMBNAIL/image/gif/766b78764d6fb746cc99a969b739cb40/gr14.sml https://s3-eu-west-1.amazonaws.com/prod-ucs-content-store-eu-west/content/pii:S0008884615000502/gr14/THUMBNAIL/image/gif/766b78764d6fb746cc99a969b739cb40/gr14.sml gr14 gr14.sml sml 9667 152 219 IMAGE-THUMBNAIL 1-s2.0-S0008884615000502-gr13.sml https://s3.amazonaws.com/prod-ucs-content-store-us-east/content/pii:S0008884615000502/gr13/THUMBNAIL/image/gif/36b2e0ccb923590371fdf73019c3b8a0/gr13.sml https://s3-eu-west-1.amazonaws.com/prod-ucs-content-store-eu-west/content/pii:S0008884615000502/gr13/THUMBNAIL/image/gif/36b2e0ccb923590371fdf73019c3b8a0/gr13.sml gr13 gr13.sml sml 2023 164 177 IMAGE-THUMBNAIL 1-s2.0-S0008884615000502-gr12.sml https://s3.amazonaws.com/prod-ucs-content-store-us-east/content/pii:S0008884615000502/gr12/THUMBNAIL/image/gif/80cd9376bf1e746520f14e495dea2b30/gr12.sml https://s3-eu-west-1.amazonaws.com/prod-ucs-content-store-eu-west/content/pii:S0008884615000502/gr12/THUMBNAIL/image/gif/80cd9376bf1e746520f14e495dea2b30/gr12.sml gr12 gr12.sml sml 3696 163 122 IMAGE-THUMBNAIL 1-s2.0-S0008884615000502-gr11.sml https://s3.amazonaws.com/prod-ucs-content-store-us-east/content/pii:S0008884615000502/gr11/THUMBNAIL/image/gif/3f6afb5e9c5f16b7f1a19f48599cec6c/gr11.sml https://s3-eu-west-1.amazonaws.com/prod-ucs-content-store-eu-west/content/pii:S0008884615000502/gr11/THUMBNAIL/image/gif/3f6afb5e9c5f16b7f1a19f48599cec6c/gr11.sml gr11 gr11.sml sml 4020 164 217 IMAGE-THUMBNAIL 1-s2.0-S0008884615000502-gr10.sml https://s3.amazonaws.com/prod-ucs-content-store-us-east/content/pii:S0008884615000502/gr10/THUMBNAIL/image/gif/2447e3e644dba3951eb17272d726154d/gr10.sml https://s3-eu-west-1.amazonaws.com/prod-ucs-content-store-eu-west/content/pii:S0008884615000502/gr10/THUMBNAIL/image/gif/2447e3e644dba3951eb17272d726154d/gr10.sml gr10 gr10.sml sml 6503 164 109 IMAGE-THUMBNAIL 1-s2.0-S0008884615000502-gr1.sml https://s3.amazonaws.com/prod-ucs-content-store-us-east/content/pii:S0008884615000502/gr1/THUMBNAIL/image/gif/894759f4b0ab799dd40a0a907c35d950/gr1.sml https://s3-eu-west-1.amazonaws.com/prod-ucs-content-store-eu-west/content/pii:S0008884615000502/gr1/THUMBNAIL/image/gif/894759f4b0ab799dd40a0a907c35d950/gr1.sml gr1 gr1.sml sml 3563 95 219 IMAGE-THUMBNAIL CEMCON 4902 S0008-8846(15)00050-2 10.1016/j.cemconres.2015.02.008 Elsevier Ltd Fig. 1 A ternary plot (A) and a ternary frequency plot (B) of the Al, Si and Ca atomic-% obtained from the EDS data from the model sample. Many of the points appearing in (A) are actually due to noise and do not appear in (B). Fig. 2 Model sample: (left) BSE image, (centre) EDS map with false-colours attributed to elements: red\u2014Al, green\u2014Si, blue\u2014Ca, (right) the final segmentation of EDS data using compositional ranges determined before in the corresponding ternary frequency plot (Fig. 1 Right). Fig. 3 BSE image of a polished section of an epoxy impregnated raw FA2. Fig. 4 Visual representation of the distribution of elements measured by EDS (FA2). Fig. 5 Al\u2013Si\u2013Ca ternary frequency plot of FA2 chemical composition in atomic-%. Part of the plot>95atomic-% Si contains a high intensity peak and was deliberately truncated from the display to better visualize other phases. White contours show the arbitrary boundaries between the groups used in this study. Fig. 6 Illustration of the segmentation criteria of the four fly ash groups, C3S and C2S. Selected areas are hexagons centred around the points of highest intensity found in the studied fly ashes. The exception is group 2, whose area was extended towards Al (+13atomic-%). Using hexagons for selection leaves some areas unselected. Fig. 7 More detailed investigations provide an insight into chemistry and morphology of the fly ash groups. Ternary plots always show relative amounts, which requires care when comparing different plots. Fig. 8 Al\u2013Si\u2013Ca ternary frequency plots of calcareous fly ashes: FA1, FA2, FA3 and a siliceous fly ash FA4. The triangles were truncated at 95atomic-% to remove from display a high intensity peak related to Si-rich phases. Otherwise, presence of such high intensity peak expands the colour intensity scale of the frequency plot and obscures the view of other less intensive peaks. Fig. 9 Quantitative comparison of the populations illustrated in Fig. 6 obtained for the four studied fly ashes. Fig. 10 The amounts of elements in each pixel known from an EDS map (A) are used to calculate total stoichiometric oxygen (B). Thresholding at 55atomic-% of oxygen (B\u2032) provides a mask (C) that removes the hydrates from the initial EDS map (A) leaving only anhydrous phases (D). Selection criteria for the different groups (D\u2033) are used to obtain the segmented image (E). Fig. 11 Quantification of C3S and C2S by SEM-EDS and XRD showing a close correlation of the two techniques. Typical uncertainty ±0.5wt.%. Fig. 12 The development of the amount of anhydrous fly ash groups in PC-FA1 (top) and PC-FA2 (bottom). Cement phases found in the fly ashes are excluded. Typical absolute error±1vol.%. Fig. 13 The Hamming window used to smooth the EDS data. Fig. 14 The distribution of the X-ray density in the FA2 sample modelled using Casino software. Fig. 15 A comparison of the bulk chemical composition quantification by XRF and EDS. Fig. 16 An example convergence plot showing an absolute error of the quantification of a volume fraction of slag S1 in the model sample. Fig. 17 Particle size distributions by laser diffraction and the range of the particle sizes assessed by the presented technique with the parameters used in this study. Table 1 XRF-analysis [wt.%]. \u204e indicates exact values for a synthetic material. PC FA1 FA2 FA3 FA4 S1 S2 G\u204e Al2O3 5.5 19.8 18.2 18.0 23.3 11.6 16.5 37 SiO2 20.7 42.3 33.6 33.7 59.7 36.7 31.9 43 CaO 65.7 20.7 26.5 27.5 1.6 38.9 35.8 20 Na2O 0.2 0.3 1.9 2.1 0.5 0.2 0.6 \u2013 K2O 0.4 1.5 0.4 0.4 2.0 0.7 \u2013 \u2013 MgO 1.5 2.2 6.4 6.2 1.0 7.8 10.8 \u2013 Fe2O3 2.7 8.2 6.4 5.7 6.5 0.5 0.9 \u2013 SO3 2.6 1.4 2.2 1.9 0.2 2.8 \u2013 \u2013 TiO2 0.3 0.7 1.3 1.5 1.1 0.9 \u2013 \u2013 P2O5 0.2 0.3 0.9 1.3 0.2 \u2013 \u2013 \u2013 Sum 99.8 97.2 97.7 98.2 96.1 100.0 96.4 100.0 Table 2 Mineralogical phase composition by XRD-Rietveld with rutile external standard [wt.%]. PC FA1 FA2 FA3 FA4 S1 S2 G C3S 66.3 \u2013 \u2013 \u2013 \u2013 \u2013 \u2013 \u2013 C2S 8.3 2.5 0.5 2.6 \u2013 \u2013 \u2013 \u2013 C4AF 8.7 2.0 1.5 2.7 \u2013 \u2013 \u2013 \u2013 C3A 7.7 1.0 4.0 8.6 \u2013 \u2013 \u2013 \u2013 Quartz 0.5 1.3 3.5 5.5 13.2 \u2013 \u2013 \u2013 Dolomite 1.1 \u2013 \u2013 \u2013 \u2013 \u2013 \u2013 \u2013 Calcite 1.8 \u2013 \u2013 \u2013 1.1 \u2013 \u2013 \u2013 Periclase \u2013 \u2013 2.0 2.7 \u2013 \u2013 \u2013 \u2013 Gypsum 2.6 \u2013 \u2013 \u2013 \u2013 \u2013 \u2013 \u2013 Anhydrite 3.0 1.8 2.0 1.7 \u2013 \u2013 \u2013 \u2013 Free lime \u2013 1.7 0.6 1.1 \u2013 \u2013 \u2013 \u2013 Mullite \u2013 \u2013 \u2013 \u2013 13.3 \u2013 \u2013 \u2013 Hematite \u2013 \u2013 \u2013 \u2013 0.7 \u2013 \u2013 \u2013 Amorphous \u2013 89.7 85.9 75.1 71.7 100.0 100.0 100.0 Table 3 Quantification of the volume fractions in the model sample. Component Density [g/cm3] Volume fraction [%] Expected 4 frames ∆ 8 frames ∆ S1 2.9 33 26 7 33 0 S2 3.0 32 38 6 37 5 G 2.7 35 36 1 30 5 Average 4.7 3.3 Table 4 Segmentation criteria: coordinates of the centre points of the hexagonal areas and their spread. Phase Al Si Ca (+/−) 1 Silicate −5 89 16 24 2 Ca-silicate 11 51 38 13 3 Al-silicate 44 56 0 24 4 Ca-Al-silicate 38 12 50 25 5 C3S 1 24 75 4 6 C2S 1 32 67 4 Table 5 Mean chemical composition of the four groups identified in FA2. 1 Silicate 2 Ca-silicate 3 Al-silicate 4 Ca-Al-silicate Al Al/(Al + Si + Ca) 0.8 2 5.9 18 12.7 40 9.7 29 Si Si/(Al + Si + Ca) 30.1 94 15.0 47 15.7 49 7.1 21 Ca Ca/(Al + Si + Ca) 1.2 4 11.3 35 3.5 11 16.6 50 Al+Si+Ca 32.1 100 32.2 100 31.9 100 33.4 100 Na+K (Na + K)/(Na + K + Mg + Fe) 1.4 65 2.0 29 5.3 72 0.7 10 Mg Mg/(Na + K + Mg + Fe) 0.4 20 3.7 53 1.3 18 4.7 63 Fe Fe/(Na + K + Mg + Fe) 0.3 15 1.3 18 0.7 9 2.0 27 Na+K+Mg+Fe 2.1 100 6.9 100 7.3 100 7.4 100 Oxygen and trace elements 65.8 60.8 60.8 59.1 A new quantification method based on SEM-EDS to assess fly ash composition and study the reaction of its individual components in hydrating cement paste Durdzinski Paweł T. Durdziński a \u204e Cyrille F. Dunant a Mohsen Ben Haha b Karen L. Scrivener a a Laboratory of Construction Materials, École Polytechnique Fédérale de Lausanne (EPFL), Station 12, CH-1015 Lausanne, Switzerland Laboratory of Construction Materials École Polytechnique Fédérale de Lausanne (EPFL) Station 12 Lausanne CH-1015 Switzerland b HeidelbergCement Technology Center GmbH (HeidelbergCement AG), Rohrbacher Str. 95, 69181 Leimen, Germany HeidelbergCement Technology Center GmbH (HeidelbergCement AG) Rohrbacher Str. 95 Leimen 69181 Germany \u204e Corresponding author. Tel.: +41 21 69 32827; fax: +41 21 69 35800. Calcareous fly ashes are high-potential reactive residues for blended cements, but their qualification and use in concrete are hindered by heterogeneity and variability. Current characterization often fails to identify the dominant, most reactive, amorphous fraction of the ashes. We developed an approach to characterize ashes using electron microscopy. EDS element composition of millions of points is plotted in a ternary frequency plot. A visual analysis reveals number and ranges of chemical composition of populations: silicate, calcium-silicate, aluminosilicate, and calcium-rich aluminosilicate. We quantified these populations in four ashes and followed their hydration in two Portland-ash systems. One ash reacted at a moderate rate: it was composed of 70vol.% of aluminosilicates and calcium-silicates and reached 60% reaction at 90days. The other reacted faster, reaching 60% at 28days due to 55vol.% of calcium-rich aluminosilicates, but further reaction was slower and 15vol.% of phases, the silica-rich ones, did not react. Keywords Characterization (B) EDX (B) Image analysis (B) Blended cement (D) Fly ash (D) 1 Introduction The world's production of concrete is estimated to be 20\u201337 Gt per year [1] and growing. Most of the related costs and CO2 emissions are linked to the clinkerization process. Fly ashes can substitute for part of the Portland clinker, but despite large availability (around 670Mt [2] are produced every year) only around 30wt.% [2] is used in concrete. This is because fly ashes are inherently heterogeneous and variable. Coal type, combustion temperature, processing, and other factors influence fly ash properties [3\u20136]. Indeed, many fly ashes are discarded out of hand due to potentially low or variable quality. In an attempt to categorize fly ashes, standards such as EN 197-1 [7] and ASTM C618 [8] divide them by their bulk chemical composition. The EN standard distinguishes siliceous (CaOreactive <10wt.%) and calcareous (CaOreactive >10wt.%) fly ashes, the ASTM divides them into class F (SiO2 +Al2O3 +Fe2O3 >70wt.%) and C (SiO2 +Al2O3 +Fe2O3 >50wt.%). Most of the fly ashes in use are the less variable and less heterogeneous but also less reactive siliceous fly ashes. Due to this low reactivity, the clinker substitution limit is around 35wt.% [7]. It could be increased, but the more reactive calcareous fly ashes are frequently rejected due to their significantly greater heterogeneity. Indeed, calcareous fly ashes are considerably more difficult to characterize and remain poorly understood. This is essentially caused by the lack of appropriate techniques both for the characterization of raw fly ashes and for the measurement of their reaction in hydrated blended cement. 1.1 Characterization of raw fly ash More effective tools to characterize fly ash are much needed, but usually the only data easily available for classification is bulk chemical composition by XRF. XRD-Rietveld refinement can quantify the crystalline phases [9]. The main obstacle for characterization is the dominant amorphous phase. Indeed, glass may represent up to 90% of the total fly ash weight and contain a mixture of different compositions [10,11]. Unfortunately, XRD mostly fails to distinguish between the amorphous fly ash phases. Electron microscopy WDS (wavelength-dispersive X-ray spectroscopy) or EDS (energy-dispersive X-ray spectroscopy) is the most common approach to study fly ash glass and analyse chemical composition of different particles [11\u201317]. In manual mode the operator selects points for examination, but as fly ashes are very heterogeneous, the scatter of the results is large and makes detailed analysis difficult. A new approach to SEM-EDS image analysis was described by Lydon [18] for measurement of modal mineralogy of rocks and was later adapted by Chancey [19] for characterization of siliceous fly ashes. Fast, new generation EDS detectors can collect a spectrum for every pixel of the frame within an hour. The spectra are then processed into a set of element intensity maps and analysed using MultiSpec© [20], a multispectral image analysis software, in which a clustering algorithm is used to identify and quantify groups of mutually exclusive chemical compositions. The display of a segmented image allows insight into microstructure, notably location of phases and intermixing. The analysis can treat large amounts of data but the interpretation is time-consuming, not intuitive and requires a skilled operator. The clustering algorithm can become very operator-dependent if the number of groups is not specified, which is usual for fly ash. If the chemical composition is evaluated directly from the X-ray count or normalized to 0\u2013255 in an intensity image it may lead to false conclusions on the actual chemical composition of the identified phases. 1.2 Measuring the degree of reaction of fly ash A reliable quantification of the fly ash degree of reaction (the proportion that has reacted) in a hydrated cement paste is difficult. The most commonly used indirect methods are the measurement of the amount of Portlandite and non-evaporable water [21\u201325]. Using these methods the differentiation between the reaction of fly ash and Portland clinker requires a comparison with a reference in which fly ash is replaced by an appropriate inert filler. Indeed, the anhydrous fly ash is quantified only indirectly, which means that changes in the type and amount of hydrates may greatly affect the results. Therefore, other methods were sought to measure the amount of unreacted fly ash directly. Selective dissolution [24\u201327] is meant to eliminate the hydration products and leave the anhydrous part for quantification. However, studies show that a significant fraction of the fly ash may be dissolved, while some hydrates remain [28]. Reactivity tests in highly diluted solutions provide a more theoretical approach, but were argued not to address the fly ash reactivity in cement adequately as they are carried out outside of paste [11]. Backscattered electron image analysis (BSE-IA) can determine the degree of reaction of plain Portland clinkers [29\u201333] and was further developed to tackle blended cements [28,34,35]. In BSE images, the grey level is a function of element composition [33] and different peaks in a grey level histogram can basically be attributed to different phases, separated and quantified. However, fly ash often contains several different glasses with different grey levels that may overlap with those of clinker phases, slag [34], C\u2013(A)\u2013S\u2013H or Portlandite [28]. Additional filters aid the process [28,35], but an accurate separation and quantification is difficult and sometimes impossible, especially for the more complex, calcareous fly ashes. Given the limited accuracy of the aforementioned methods, fly ash can only be treated as a single entity although it is a mixture of different compositions [11,19,36] that react at different rates [37,38]. Furthermore, the morphology of particles is generally not addressed. Improved characterization and quantification methods are needed to better understand the mechanisms acting in fly ash composite cements. Generic knowledge can only be developed if the methods are robust so that a multitude of different fly ashes can be investigated. This paper presents a new numerical treatment of SEM-EDS full element maps that allows quick and intuitive visual identification, precise separation and quantitative analysis of phases in fly ash. Parameters for collection and treatment of EDS data were studied and validated on a model sample. We propose a ternary frequency diagram to display and evaluate the chemical composition of millions of data points in a single plot. Groups of similar chemical compositions appear as blobs in the diagram so the user can readily distinguish them and evaluate their ranges and scatter. Display of the groups facilitates the analysis of fly ash microstructure while the calculation of their respective volume fractions sets a baseline for quantitative comparisons within a fly ash and between different ashes. Further, the different glassy components of a fly ash can be identified in a hydrated Portland\u2013fly ash paste and their degrees of reaction followed individually. 2 Materials Portland cement (PC), three calcareous fly ashes (FA1, FA2, FA3), one siliceous fly ash (FA4), two slags (S1, S2) and a synthetic glass (G) ground to around 4200cm2/g Blaine as well as gypsum ground to around 7000cm2/g Blaine were used in the study. The bulk chemical and phase compositions of the raw materials were analysed by XRF (Table 1 ) and XRD-Rietveld (Table 2 ). Fly ashes 2 and 3 had similar chemical composition but differed in phase composition. Particle size distributions were measured by laser diffraction in isopropanol dispersions using Malvern MasterSizer S (Fig. 17 ). 3 Experimental 3.1 Sample preparation To test the capacity for quantification, a model sample was prepared with three homogeneous and amorphous materials\u2014two slags: S1, S2 and a synthetic glass G. The materials were mixed in a proportion of 1:1:1 by mass, compacted into a pellet and embedded in epoxy resin. Their volume fractions were calculated using densities obtained according to [39] and are included in Table 3 . Samples for fly ash characterization contained single raw fly ashes in resin-embedded pellets. For the study of fly ash hydration we prepared powder mixtures of 55wt.% PC and 45wt.% FA1 and FA2. Gypsum was added to adjust the SO3 content to 3.25wt.%. The powders were mixed with water (w/b wt. ratio 0.4) in a laboratory mixer for 2min at 1600rpm. The pastes were cured at 20°C in cylindrical PP containers in sealed conditions until testing after 1, 7, 28, 56, 90 and 365days. At the designated times, discs were cut from the samples and immersed into isopropanol to stop hydration by solvent exchange. The isopropanol was exchanged three times over the 7-day storage period. The disks were then dried and stored in a desiccator with silica gel beads and under vacuum for another 7days to evacuate the isopropanol. Part of the disc was crushed in a mortar and analysed by XRD and TGA while the remainder was pre-polished to assure a flat surface, a requirement for uniform epoxy impregnation and polishing. All samples for SEM investigations were impregnated under vacuum with a spectrally transparent epoxy resin (EpoTek® 301), gradually polished down to ¼μm with diamond spray and petrol as a lubricant and coated with a thin conductive layer of carbon (10nm). 3.2 Microscope setup The scanning electron microscope used for this study was a FEI Quanta 200 with Bruker XFlash 4030 EDS detector with 30mm2 active surface. The microscope was operated at 15kV accelerating voltage and 12.5mm working distance. The field of view was 252μm×189μm, the image resolution was 1024×768 and the pixel size 0.246×0.246μm. The system was configured to take a backscatter electron image (BSE) and to carry out EDS element mapping. To analyse and interpret the element maps in detail, the acquisition of high quality spectra is essential. A large spot size was used to obtain high EDS count rate of 100000\u2013150000 counts per second. Due to fast detector and signal processing the dead time remained between 0 and 5%. A dwell time of 256μs was chosen to keep the scanning speed at a moderate rate. It provided balance between poorer measurement statistics at high speeds and larger sample damage at lower speeds. An automated routine analysed eight frames per sample, which corresponds to approximately 20000 particles. The total acquisition time was around 4.5h per sample. Eight frames per sample per testing age were considered a good compromise between the size of the analysed area and the measurement time. Compared to other studies using SEM, eight frames may seem very few but the information carried in a precise EDS map allows a more accurate analysis and therefore less frames need to be measured. Samples made of compacted powder contain more particles per unit surface of the polished section compared to paste samples: a paste of 70% Portland clinker and 30% fly ash at 0.4 water/binder ratio contains around four times less fly ash. Eight frames measured on raw compacted powder are thus equivalent to 32 on paste, which is typical of the numbers of images often used in paste studies. The accuracy and errors are analysed in detail in Appendix 2. 3.3 Data treatment The following elements were quantified from the spectra: Al, Si, Ca, Na, K, Mg, Fe, Ti and P. Oxygen was calculated by stoichiometry if needed. Indeed, quantification of oxygen by EDS is not reliable as its emitted X-rays have low energy and can be easily absorbed by the specimen or the detector window. The quantification of elements was carried out by Esprit software using a profile fit with standards and PhiRhoZ matrix corrections. The calculations are automated and require around 1h per frame. The results are expressed in atomic percent and saved in a numerical form. Custom MATLAB™ software was used to treat the data. For the anhydrous particulate specimens, background pixels are removed using a mask from a thresholded BSE image. The threshold value was found using the grey level histogram of the image. The remaining data is smoothed (see Appendix 1) and plotted in a ternary diagram for further analysis. Any of the quantified elements or their combinations can be used for the ternary plot, but in case of fly ashes the Al\u2013Si\u2013Ca system is typically of main interest. For each pixel the values of atomic-% of Al, Si and Ca are normalized to 100%, transformed to barycentric coordinates and plotted in a ternary diagram. As most of the compounds analysed were glasses it was preferred to plot the elements at the apexes rather than oxides. Although all the elements are oxidized, using the formula Al2O3 can be confusing when subsequently considering ratios of Al to Si, for example. If all the data points are plotted individually the ternary plot is saturated with millions of points and cannot be interpreted (Fig. 1A). Our solution is to re-plot it as a ternary frequency plot. The area of the ternary plot is split into smaller triangular areas (bins). The size was set so that one bin would span 1atomic-% on each of the three axes. Each axis is therefore divided into 100 equal sections and the resulting total number of bins is 10000. The number of points that fall into each bin creates a height vector for it. The height vectors of all bins are presented in form of a ternary frequency plot with linear colour intensity scaled to the maximum value of the height vector (Fig. 1B). Fig. 1 illustrates the two versions for the model sample containing two slags and one synthetic glass. The plot of all points (Fig. 1A) is not very informative, whereas the frequency plot (Fig. 1B) clearly shows the chemical compositions of the three constituents. The frequency plot allows an intuitive visual analysis of the distribution of chemical composition. Coordinates of points and areas in the ternary plot represent the proportions of Al, Si and Ca in atomic-%. Groups of similar chemical compositions appear as blobs in the graph and their relative proportions can be compared qualitatively from the height vectors. One can identify the number of the groups, their approximate chemical compositions and spread. One of the targets of the visual analysis is to define the ranges of chemical composition of the groups, which later serve as criteria for separation and quantification. Separation of phases of very close chemical compositions is possible. The compositions identified in the ternary plots can then be mapped back onto the original image, from which the amount of each phase in vol.% is calculated as its area fraction (Fig. 2 right), according to fundamental stereology (Delesse's principle). The accuracy of such quantification was assessed for the model sample by comparing with the known volume fractions of the materials used to prepare this specimen (Table 3). The maximum absolute differences between the expected and the calculated values were around 5vol.% for four frames analysed and around 3vol.% for eight frames analysed. A detailed error analysis is presented in Appendix 2. 4 Results and discussion 4.1 Characterization of a calcareous fly ash As an example, the analysis of raw FA2 is presented. BSE image reveals a complex microstructure and a multitude of phases distinguished by their grey levels (Fig. 3). The EDS data of the main elements of interest Al, Si and Ca is displayed with false colour attributed to each of these elements: red\u2014Al, green\u2014Si, and blue\u2014Ca (Fig. 4). One can identify groups of different compositions and some particles are composed of multiple phases. This heterogeneity is likely due to differences in composition of the source coal particles. These particles may contain different, mostly clay, minerals and as their combustion and cooling occur locally the melt does not undergo homogenization. Further, as calcareous fly ashes may contain large amounts of Ca, Mg, Na and K, the phase separation in glass, common in multi-component glass melts [11,40\u201342], could contribute to the microstructure complexity and heterogeneity of single glass particles. A first analysis of the ternary frequency plot for FA2 revealed that despite large overall scatter due to intrinsic heterogeneity, it was composed of several groups of phases readily distinguishable in the Al\u2013Si\u2013Ca ternary frequency plot (Fig. 5). The spread of the groups in the plot varies from small spots for well defined compositions to large regions covering ranges of compositions. The Si- and aluminosilicate-dominated groups are represented by high and narrow peaks, which suggest a reduced range of chemical compositions and large abundance. The Ca-rich alumino-silicate group has a diffuse shape of nonetheless high intensity. This phase or group of phases seems the most abundant in the fly ash but its chemical composition spans a large section of the ternary graph. Intermediate phases such as calcium-silicates with moderate Al and alumino-silicates with moderate Ca are well defined but present in lower amounts. Phases appearing at the 100% Ca corner typically include free lime (CaO), calcium sulfates and calcium carbonate (calcite). FA2 contains around 4wt.% C3A by XRD Rietveld analysis, which appears in the ternary frequency plot as a group below the calcium-rich aluminosilicate group. The hazy appearance of this group suggests that the C3A may be finely intermixed with other phases or may have formed inside glassy particles, whose composition was close to that of the C3A and favoured its formation. The quantity of non Ca\u2013Al\u2013Si phases such as iron oxides and magnesium oxide (periclase) is below 3wt.%, as determined by XRD-Rietveld (Table 2); they do not appear in the Ca\u2013Al\u2013Si diagram. To further investigate specific fly ash groups one has to define appropriate criteria for their selection. In this study the limits on Al, Si and Ca were sufficient to separate the groups but in different systems any of the quantified elements may be used and the selection may include more than three elements at once. The selection criteria for the groups should be rather wide to provide the necessary margin for often broad chemical compositions. Further, wide selection limits reduce the measurement error due to data scatter and potentially low content of the groups. For a more universally applicable description of fly ash composition, the selection criteria should cover most of the area of the ternary frequency plot. We propose a segmentation of the fly ash phases into four main groups, roughly corresponding to (1) mainly silicate, (2) calcium-silicate with low to moderate aluminium, (3) alumino-silicate with low to moderate calcium and (4) calcium-rich alumino-silicate (Fig. 6). Al-rich phases (>60atomic-% Al) are typically not encountered in fly ashes. Ca (>80atomic-% Ca) and Ca-Si (<10atomic-% Al) areas essentially contain crystalline phases such as free lime, calcium sulfates, calcite, C2S and C3S, which are assessed by XRD-Rietveld. The selection was carried out by applying limits on the content of normalized Al, Si and Ca atomic-% (Fig. 6, Table 4.). The resulting segmentation was considered reasonable as the segmented areas largely correspond to entire particles or major parts of particles. The chemical composition and microstructure of the groups identified in FA2 were investigated in more detail. Complementary (Na+K)\u2013Mg\u2013Fe graphs (Fig. 7) show that the composition of the groups 1, 3 and 4 is self-homogeneous and they do not need to be further divided into sub-groups. Due to low overall amount of group 2 its further separation, although possible, does not seem justifiable from a practical point of view. The complete average chemical compositions of the four groups are given in Table 5 . In the silicate and the aluminosilicate group, the relative proportion of alkalis to Mg and Fe is significantly larger than in the Ca-rich aluminosilicate and calcium-silicate group. However, in absolute terms, the alkali content of the silicate and the Ca-rich aluminosilicate groups is similar, but the latter contains more Mg and Fe. Mg seems to be more abundant in Ca-rich glasses and the content of Mg increases with Ca content, in the order of group 1<3<2<4. This is probably because Mg and Ca cations have the same charge and similar radii, which could facilitate their exchange or coexistence in glasses. Alkalis on the other hand, seem to follow an opposite trend and are present in larger amounts in glasses poor in Ca. An exception here is group 1, which contains almost only Si and only small amounts of other elements. Image overlays can be used to visualize the groups in the fly ash microstructure (Fig. 7). Combining chemical and morphological information allows a qualitative correlation of the glass chemical composition and the particle sizes. Ca-rich alumino-silicate glasses tend to form smaller particles while Si-rich and alumino-silicate glasses tend to form larger ones. Further, the size of particles may affect the cooling rate of the glass and thus the spread of chemical composition observed in the frequency plot. Small Ca-rich alumino-silicate particles may cool very quickly causing the chemical compositions to \u201cfreeze\u201d before phase separation occurs and leading to more spread ranges of chemical composition. Large particles are expected to cool down more slowly, allowing more pronounced phase separation or even devitrification and thus better defined blobs in the ternary plot. Indeed, the crystalline phases in fly ashes often exist inside the glass particles [43]. Hollow particles, cenospheres, are present in FA2. Although their actual mechanism of formation is not well understood [44], uniform Al/Si ratio of cenospheres found in various studies suggests [45] that certain glass compositions may favour cenosphere formation, notably that corresponding to anauxite, or kaolinite with excess silica. Practically all of the cenospheres in FA2 of this study belong to the aluminosilicate group, whose composition is the closest to that of kaolinite. 4.2 Application of the method to different fly ashes Ternary plots for all four fly ashes studied are shown in Fig. 8. They allow a quick visual comparison of the number and ranges of chemical composition of phases present in different fly ashes. Such comparison could also be applied to batches of the same ash to monitor its variability. In frequency plots the observed intensities are always relative to the largest height vector so direct visual comparisons should remain rather qualitative. Indeed, due to the presence of a single high peak from a not necessarily abundant phase but of a well defined composition other phases may appear as less prominent than is really the case. A convenient way to compare fly ashes is to use a common set of selection criteria to separate the phases into groups, as illustrated in Fig. 6, and compare their volume fractions. As most of the fly ash glasses are expected to form in the Al\u2013Si\u2013Ca\u2013Mg\u2013Fe\u2013alkali system or its subsystems, different fly ashes are likely to contain similar groups, although in potentially different proportions. Fig. 9 shows that these proportions can vary substantially depending on fly ash. While a siliceous fly ash FA4 is composed of aluminosilicates and silicates, higher calcium content in calcareous fly ashes results in the presence of additional calcium-bearing phases. An interesting subject is the distribution of calcium. According to the bulk chemical analysis (Table 1) calcium content in FA1, FA2 and FA3 is quite similar. However, the detailed chemical analysis shows that in FA1 calcium is mostly present in the large fraction of alumino-silicates with low to moderate-calcium. In FA2 and FA3 the dominant part is calcium-rich alumino-silicate, which is where most calcium is present. Simultaneously, a significant fraction of FA2 and FA3 is predominantly silicate and probably not very reactive. The actual reactivity of the identified groups is assessed in the next section. 4.3 Quantification of the degree of reaction of fly ash The reaction of fly ash is not characterized by a unique degree of reaction. Instead, different groups contribute to the overall reaction and it is essential to track the reaction of each of them separately. Each fly ash class can be extracted from hydrated cement paste following the same procedure as for raw fly ash (Fig. 10). However, in hydrated pastes, EDS maps contain both anhydrous and hydrated phases. Their Al\u2013Si\u2013Ca normalized chemical compositions can be very similar. To differentiate between the hydrates and the anhydrous phases a simple filter was applied. Assuming that each of the elements exists as its most common oxide, the stoichiometric oxygen was calculated and summed up for each pixel separately. Because hydrates contain water and hydrogen is not detected by EDS, the total amount of the quantified elements as well as the respective oxygen is lower compared to anhydrous phases. Pixels with less than 55atomic-% of the respective oxygen were assigned to hydrates and removed from further analysis. This threshold value was determined empirically and worked best for all the investigated mixes. The previously defined criteria were used to assign pixels into the fly ash groups. Noise filtering was carried out using an open (erode-dilate) morphological operation and a diamond shaped structuring element with 3-pixel distance from the structuring element origin to the points of the diamond. For each of the groups, the number of segmented pixels was related to the total number of pixels in the frame to give an area fraction (equivalent to volume fraction). The values at time zero were calculated from the proportions of Portland clinker, calcareous fly ash and water in the mix and their densities. In the case of group 4 (calcium-alumino-silicate), it was necessary to account for the overlap with the anhydrous C3A and C4AF phases from Portland clinker. The volume fractions of C3A and C4AF, unreacted at each time, were computed from XRD-Rietveld quantification and subtracted from the volume fractions of the group 4. To verify that such operation did not carry a significant error, a comparison between SEM-EDS and XRD was made. Quantification of C3S and C2S in PC\u2013FA2 mix showed only minor differences (Fig. 11). The unreacted volume fractions for each of the fly ash groups were calculated for Portland\u2013fly ash pastes at hydration times spanning from 1day to 365days (Fig. 12). The points were joined with lines to guide the reader's eye and facilitate visual assessment of the results. The overall trends are quite smooth as local fluctuations tend to cancel out, which raises confidence in the results and suggests that the observations made using this method are quite robust. Fig. 12 shows that the two investigated fly ashes contain significantly different proportions of the identified groups and that these groups clearly contribute differently to the reaction of fly ash. FA1 is mainly composed of aluminosilicates with low to moderate calcium content (70vol.%) and calcium-silicates with low to moderate aluminium (15vol.%), while in FA2 these two phases account together for only around 20vol.%. They react at a moderate pace and reach around 60% degree of reaction after one year of hydration. FA2 contains a significant amount of around 55vol.% of calcium-rich aluminosilicate phases, which in FA1 are only present in a small quantity, below 10vol.%. These calcium-rich aluminosilicates are the most reactive, exceeding 80% degree of reaction at 28days (FA2) and 56days (FA1) of hydration and contribute the most to the overall reaction of FA2. Indeed, Ca-rich glasses tend to be more reactive than those with moderate and low Ca contents [37]. Calcium acts as a modifier in the glass structure; breaking up SiO bonds it creates a network that is less connected and thus easier to break apart upon contact with solvents. Large amounts of highly reactive Ca-rich alumino-silicate glass could have an important impact on the hydration products of PC\u2013FA mixes, leading to formation of significant amounts of AFm and AFt phases. As these phases can interact with Cl− and SO4 2− ions from aggressive environments they may affect the durability of the binder. Large quantities of readily available alumina from the fast reacting Ca-rich alumino-silicate glass could potentially react with carbonates from limestone [46] and improve its reactivity in blended cement, which may subsequently allow larger clinker replacement. The strength development of PC\u2013FA mixes is likely to depend on the type and amount of calcium-bearing phases in fly ash. The influence of calcium was shown by Mehta [47] and indicated a clear trend to higher compressive strength with higher overall calcium content of fly ash. However, it did not take into account that a significant fraction of fly ash may be composed of almost non-reactive highly silicate phases. As shown in Fig. 12, one fifth of FA2 volume was such silicate. 5 Conclusions The technique presented here allows a quick visual determination of the groups of different chemical compositions constituting a complex material, here fly ash. The number of groups, their approximate chemical compositions and uniformity can be readily evaluated from the ternary plot. The identified groups can be used to produce a segmented image or be further analysed (chemical composition, relative volume fraction). With small adjustments, the presented methodology could be extended to other types of SEM-EDS data. Groups of different chemical compositions were identified and quantified in four different fly ashes. Analysis of their reaction in two selected Portland-fly ash pastes confirmed different contributions to the overall reaction. The proportion of the groups seems to have a crucial impact on the reactivity of the fly ash, which strengthens the view that fly ashes should not be judged by their bulk chemical composition only. Further work is under way to understand how different fly ash glasses react and influence the reactivity of other components in cement, the microstructure of the paste and the durability of the binder. More research is needed to investigate the reactivity of the fly ash groups in a broader range of fly ashes and in systems with other SCMs such as limestone and slag. Understanding of the fly ash composition, reactivity and effect on concrete properties is a challenge for cement research. The method presented here offers a tool that could facilitate investigations, lead to an improved classification and use of calcareous fly ashes in concrete or even enable predictions of their impact on this material. Acknowledgements The authors would like to acknowledge HeidelbergCement for the financial support John Rossen for helpful advices on microscope setup and Ruben Snellings for comments, discussions and the synthetic glass used in the experiments. Appendix 1 Quality of EDS data A reliable set of chemical composition data is key for a precise and accurate analysis. An important drawback of EDS is that the signal is collected from a volume of sample, several microns in size, called an interaction volume. Because of that, the proximity of epoxy resin or other particles of different chemical composition affects the measurement, and adds noise and uncertainty to the spatial resolution. To account for this effect the raw data was smoothed with a Hamming window (Fig. 13). This window belongs to a family of windows that reduce high frequency noise, but do not change the size and shape of the input. The size of the window was chosen to match the size of the interaction volume. The interaction volume was modelled using Monte Carlo simulation in Casino v2.41 software (www.gel.usherbrooke.ca/casino/index.html) for a bulk composition of FA2 and the parameters the microscope was operated at (Fig. 14). As the chemical composition is quantified for each pixel of the frame, the quality of the quantification depends primarily on the quality of the individual spectra. The quality of the individual spectra depends on the measurement conditions and can be evaluated by comparing the SEM-EDS results to bulk chemical composition by XRF. This was done for FA2 (Fig. 15). The EDS data was treated in two ways. Quantification of a spectrum taken collectively from the entire frame (EDS-1) showed that up to around 1.5atomic-% difference is related to the quality of standards, the way the spectrum is treated in the software and the errors involved, all of which are largely independent of the user. When individual spectra were quantified and the results averaged (EDS-2) the differences did not change. This suggests satisfactory quality of the individual spectra. It is difficult to evaluate all sources of errors of an EDS analysis and quantification. Due to sample-, microscope-, EDS detector- and data processing-related errors the combined uncertainty of quantification can be estimated around ±1.5atomic-%. In practice, the chemical composition is represented by bin coordinates and each of the data points adds to a single bin. To account for the uncertainty of quantification an individual data point adds to multiple bins. The value of the increment varies as a function of the distance from the data point coordinates according to a specified distribution. In this study, the uncertainty of quantification was assumed to follow Gaussian distribution with 2σ=1.5%. This operation adds spread to the frequency plots but the results more truly reflect the meaning of the data. Chemical resolution is limited by several factors. The uncertainty of quantification (±1.5%) sets the lowest limit. Particle edges and finely intermixed fractions, below the pixel size, are likely to share contributions to the measured chemical composition with their surroundings. Mixed contributions are plotted in the frequency plots between the original areas reducing precision of the separation and quantification. Fly ashes can have a very wide range of chemical compositions that add spread to the groups seen in ternary frequency plots. The extent of this effect depends on the heterogeneity of the investigated material. With no clear borders between the groups, segmentation may be impossible or may require arbitrary decisions of a skilled operator. Some issues may be resolved using additional refinements and adjustments, depending on the case. Appendix 2 Error analysis There exists no absolute measure of the error in general. Using a model system, the error for eight analysed frames was determined to be around 3vol.% (Fig. 16). In most cases the absolute values are unknown and a relative error analysis is carried out instead. For a certain quantity being assessed (e.g. volume fraction of a phase), one should prepare a log\u2013log convergence plot of the relative differences of the amount quantified in different frames against the number of frames, which is the usual way to assess convergence. One can then fit a trend line to the calculated points and use it to determine the number of frames required to reach a certain relative error. The size of the particles may influence the uncertainty. Fine or finely intermixed phases below the size of the interaction volume or the size of the minimum recognizable grain may be inseparable and thus not correctly qualified. In image analysis, a particle is reliably identified as such if its diameter is at least the size of two pixels and at most half the size of the field of view. Resolution and frame field of view in this study result in a pixel size of 0.246×0.246μm. Particles of a mean diameter smaller than 2pixels (0.5μm) or larger than 1/4 of the frame (90μm) are thus not adequately identified. An independent measure of the particle size distribution (Fig. 17) shows that the fractions below 0.5μm and above 90μm account for less than 2\u20133vol.% each. For the investigated materials the resulting error is not expected to influence the results much. However, larger errors should be expected for materials of broad particle size distributions (e.g. a non-ground fly ash), which may require significantly more frames to reach similar levels of certainty. Shortening of the measurement by allowing less time per frame may jeopardize the reliability of the results and lead to false interpretations. Decreased magnification would lower the precision and the resolution. Optimization of the parameters may be required. References [1] U.S. Geological Survey Mineral Commodity Summaries 2013 2013 U.S. Geol. Surv (198pp.) [2] J.E. Anderson Sustainable Cement Using Fly Ash: An Examination of The Net Role of High Volume Fly Ash cement on Carbon Dioxide Emissions Ecocity World Summit 2008 Proc. 2008 1 12 [3] N. Koukouzas J. Hämäläinen D. Papanikolaou A. Tourunen T. Jäntti Mineralogical and elemental composition of fly ash from pilot scale fluidised bed combustion of lignite, bituminous coal, wood chips and their blends Fuel 86 2007 2186 2193 [4] K. Erdoğdu P. Türker Effects of fly ash particle size on strength of portland cement fly ash mortars Cem. Concr. Res. 28 1998 1217 1222 [5] S.V. Vassilev R. Menendez D. Alvarez M. Diaz-Somoano M.R. Martinez-Tarazona Phase-mineral and chemical composition of coal fly ashes as a basis for their multicomponent utilization. 1. Characterization of feed coals and fly ashes Fuel 82 2003 1793 1811 [6] C.R. Ward D. French Determination of glass content and estimation of glass composition in fly ash using quantitative X-ray diffractometry Fuel 85 2006 2268 2277 [7] EN 197-1 2011\u2014Cement\u2014Part 1: Composition, specifications and conformity criteria for common cement 2011 [8] ASTM Standard C618: Standard Specification for Coal Fly Ash and Raw or Calcined Natural Pozzolan for Use in Concrete 2012 [9] R.S. Winburn D.G. Grier G.J. McCarthy R.B. Peterson Rietveld quantitative X-ray diffraction analysis of NIST fly ash standard reference materials Powder Diffract. 15 2000 163 172 [10] Y. Nathan M. Dvorachek I. Pelly U. Mimran Characterization of coal fly ash from Israel Fuel 78 1999 205 213 [11] H. Pietersen Reactivity of Fly Ash and Slag in Cement 1993 TU Delft [12] R.J. Lauf Application of Materials Characterization Techniques to Coal and Coal Wastes 1981 Dept. of Energy, Oak Ridge National Laboratory Oak Ridge, Tenn. [13] R. Dhole M.D.A. Thomas K.J. Folliard T. Drimalas Characterization of fly ashes for sulfate resistance ACI Mater. J. 110 2013 159 168 [14] A. Johnson L.J.J. Catalan S.D. Kinrade Characterization and evaluation of fly-ash from co-combustion of lignite and wood pellets for use as cement admixture Fuel 89 2010 3042 3050 [15] B.G. Kutchko A.G. Kim Fly ash characterization by SEM\u2013EDS Fuel 85 2006 2537 2544 [16] R.J. Stevenson Mineralogical characterization of a lignite gasification ash from a low-BTU fixed-bed gasifier II. Scanning electron microscope phase analysis Cem. Concr. Res. 14 1984 485 490 [17] R.J. Stevenson J.C. Collier J.J. Crashell L.R. Quandt Characterization of North American lignite fly ashes I. Chemical variation MRS Proc. 113 2011 87 [18] J.W. Lydon The Measurement of the Modal Mineralogy of Rocks from SEM Imagery: The use of Multispec© and ImageJ Freeware 2005 Geol. Surv. Canada [19] R.T. Chancey P. Stutzman M.C.G. Juenger D.W. Fowler Comprehensive phase characterization of crystalline and amorphous phases of a Class F fly ash Cem. Concr. Res. 40 2010 146 156 [20] L. Biehl D. Landgrebe MultiSpec\u2014a tool for multispectral\u2013hyperspectral image data analysis Comput. Geosci. 28 2002 1153 1159 [21] F. Deschner F. Winnefeld B. Lothenbach S. Seufert P. Schwesig S. Dittrich Hydration of Portland cement with high replacement by siliceous fly ash Cem. Concr. Res. 42 2012 1389 1400 [22] G. Baert S. Hoste G. De Schutter N. De Belie Reactivity of fly ash in cement paste studied by means of thermogravimetry and isothermal calorimetry J. Therm. Anal. Calorim. 94 2008 485 492 [23] L. Lam Y. Wong C. Poon Degree of hydration and gel/space ratio of high-volume fly ash/cement systems Cem. Concr. Res. 30 2000 747 756 [24] K. Luke F.P. Glasser Internal chemical evolution of the constitution of blended cements Cem. Concr. Res. 18 1988 495 502 [25] E. Sakai S. Miyahara S. Ohsawa S.-H. Lee M. Daimon Hydration of fly ash cement Cem. Concr. Res. 35 2005 1135 1140 [26] S. Ohsawa K. Asaga S. Goto M. Daimon Quantitative determination of fly ash in the hydrated fly ash\u2013CaSO4·2H2O\u2013Ca(OH)2 system Cem. Concr. Res. 15 1985 357 366 [27] B. Suprenant G. Papadopoulos Selective dissolution of Portland-Fly-Ash cements J. Mater. Civ. Eng. 3 1991 48 59 [28] M. Ben Haha K. De Weerdt B. Lothenbach Quantification of the degree of reaction of fly ash Cem. Concr. Res. 40 2010 1620 1629 [29] K.L. Scrivener H.H. Patel P.L. Pratt L.J. Parrott Analysis of phases in cement paste using backscattered electron images, methanol adsorption and thermogravimetric analysis MRS Proc. 85 1986 [30] K.O. Kjellsen R.J. Detwiler Reaction kinetics of portland cement mortars hydrated at different temperatures Cem. Concr. Res. 22 1992 112 120 [31] J.E. Ash M. Mellas Application of backscattered electron imaging to concrete materials Cem. Concr. Res. 23 1993 576 580 [32] M. Mouret A. Bascoul G. Escadeillas Study of the degree of hydration of concrete by means of image analysis and chemically bound water Adv. Cem. Based Mater. 6 1997 109 115 [33] K. Scrivener Backscattered electron imaging of cementitious microstructures: understanding and quantification Cem. Concr. Compos. 26 2004 935 945 [34] X. Feng E.J. Garboczi D.P. Bentz P.E. Stutzman T.O. Mason Estimation of the degree of hydration of blended cement pastes by a scanning electron microscope point-counting procedure Cem. Concr. Res. 34 2004 1787 1793 [35] F. Deschner B. Münch F. Winnefeld B. Lothenbach Quantification of fly ash in hydrated, blended Portland cement pastes by backscattered electron imaging J. Microsc. 251 2013 188 204 [36] P.J. Williams J.B. Joseph J.R. Claudia W. Larry B. Jianming Microanalytical and computational analysis of class F fly ash ACI Mater. J. 102 2005 330 [37] K.L. Aughenbaugh R.T. Chancey P. Stutzman M.C. Juenger D.W. Fowler An examination of the reactivity of fly ash in cementitious pore solutions Mater. Struct. 46 2013 869 880 [38] R. Snellings Solution-controlled dissolution of supplementary cementitious material glasses at pH13: the effect of solution composition on glass dissolution rates J. Am. Ceram. Soc. 96 2013 2467 2475 [39] A. Fluegel Global model for calculating room-temperature glass density from the composition J. Am. Ceram. Soc. 90 2007 2622 2625 [40] W. Vogel Phase separation in glass J. Non-Cryst. Solids 25 1977 170 214 [41] W.D. Kingery P.B. Vandiver I.-W. Huang Y.-M. Chiang Liquid-liquid immiscibility and phase separation in the quaternary systems K2O\u2013Al2O3\u2013CaO\u2013SiO2 and Na2O\u2013Al2O3\u2013CaO\u2013SiO2 J. Non-Cryst. Solids 54 1983 163 171 [42] M.I. Wood P.C. Hess The structural role of Al2O3 and TiO2 in immiscible silicate liquids in the system SiO2\u2013MgO\u2013CaO\u2013FeO\u2013TiO2\u2013Al2O3 Contrib. Mineral. Petrol. 72 1980 319 328 [43] R. Helmuth Fly Ash in Cement and Concrete 1987 Portland Cement Assn [44] L. Ngu H. Wu D. Zhang Characterization of Ash cenospheres in Fly Ash from Australian power stations Energy Fuel 21 2007 3437 3445 [45] D. Bibby Composition and variation of pulverized fuel ash obtained from the combustion of sub-bituminous coals, New Zealand Fuel 56 1977 427 431 [46] T. Matschei B. Lothenbach F.P. Glasser The role of calcium carbonate in cement hydration Cem. Concr. Res. 37 2007 551 558 [47] P. Mehta Pozzolanic and Cementitious By-products in Concrete\u2014Another Look 1989 ACI Spec. Publ 1 44",
    "scopus-id": "84925304391",
    "coredata": {
        "eid": "1-s2.0-S0008884615000502",
        "dc:description": "Calcareous fly ashes are high-potential reactive residues for blended cements, but their qualification and use in concrete are hindered by heterogeneity and variability. Current characterization often fails to identify the dominant, most reactive, amorphous fraction of the ashes. We developed an approach to characterize ashes using electron microscopy. EDS element composition of millions of points is plotted in a ternary frequency plot. A visual analysis reveals number and ranges of chemical composition of populations: silicate, calcium-silicate, aluminosilicate, and calcium-rich aluminosilicate. We quantified these populations in four ashes and followed their hydration in two Portland-ash systems. One ash reacted at a moderate rate: it was composed of 70vol.% of aluminosilicates and calcium-silicates and reached 60% reaction at 90days. The other reacted faster, reaching 60% at 28days due to 55vol.% of calcium-rich aluminosilicates, but further reaction was slower and 15vol.% of phases, the silica-rich ones, did not react.",
        "openArchiveArticle": "false",
        "prism:coverDate": "2015-07-31",
        "openaccessUserLicense": null,
        "prism:aggregationType": "Journal",
        "prism:url": "https://api.elsevier.com/content/article/pii/S0008884615000502",
        "dc:creator": [
            {
                "@_fa": "true",
                "$": "Durdziński, Paweł T."
            },
            {
                "@_fa": "true",
                "$": "Dunant, Cyrille F."
            },
            {
                "@_fa": "true",
                "$": "Haha, Mohsen Ben"
            },
            {
                "@_fa": "true",
                "$": "Scrivener, Karen L."
            }
        ],
        "link": [
            {
                "@_fa": "true",
                "@rel": "self",
                "@href": "https://api.elsevier.com/content/article/pii/S0008884615000502"
            },
            {
                "@_fa": "true",
                "@rel": "scidir",
                "@href": "https://www.sciencedirect.com/science/article/pii/S0008884615000502"
            }
        ],
        "dc:format": "application/json",
        "openaccessType": null,
        "pii": "S0008-8846(15)00050-2",
        "prism:volume": "73",
        "prism:publisher": "Elsevier Ltd.",
        "dc:title": "A new quantification method based on SEM-EDS to assess fly ash composition and study the reaction of its individual components in hydrating cement paste",
        "prism:copyright": "Copyright © 2015 Elsevier Ltd. All rights reserved.",
        "openaccess": "0",
        "prism:issn": "00088846",
        "dcterms:subject": [
            {
                "@_fa": "true",
                "$": "Characterization (B)"
            },
            {
                "@_fa": "true",
                "$": "EDX (B)"
            },
            {
                "@_fa": "true",
                "$": "Image analysis (B)"
            },
            {
                "@_fa": "true",
                "$": "Blended cement (D)"
            },
            {
                "@_fa": "true",
                "$": "Fly ash (D)"
            }
        ],
        "openaccessArticle": "false",
        "prism:publicationName": "Cement and Concrete Research",
        "openaccessSponsorType": null,
        "prism:pageRange": "111-122",
        "prism:endingPage": "122",
        "pubType": "fla",
        "prism:coverDisplayDate": "July 2015",
        "prism:doi": "10.1016/j.cemconres.2015.02.008",
        "prism:startingPage": "111",
        "dc:identifier": "doi:10.1016/j.cemconres.2015.02.008",
        "openaccessSponsorName": null
    },
    "objects": {"object": [
        {
            "@category": "standard",
            "@height": "242",
            "@width": "390",
            "@_fa": "true",
            "$": "https://api.elsevier.com/content/object/eid/1-s2.0-S0008884615000502-gr9.jpg?httpAccept=%2A%2F%2A",
            "@multimediatype": "JPEG image file",
            "@type": "IMAGE-DOWNSAMPLED",
            "@size": "20319",
            "@ref": "gr9",
            "@mimetype": "image/jpeg"
        },
        {
            "@category": "standard",
            "@height": "482",
            "@width": "535",
            "@_fa": "true",
            "$": "https://api.elsevier.com/content/object/eid/1-s2.0-S0008884615000502-gr8.jpg?httpAccept=%2A%2F%2A",
            "@multimediatype": "JPEG image file",
            "@type": "IMAGE-DOWNSAMPLED",
            "@size": "50905",
            "@ref": "gr8",
            "@mimetype": "image/jpeg"
        },
        {
            "@category": "standard",
            "@height": "824",
            "@width": "513",
            "@_fa": "true",
            "$": "https://api.elsevier.com/content/object/eid/1-s2.0-S0008884615000502-gr7.jpg?httpAccept=%2A%2F%2A",
            "@multimediatype": "JPEG image file",
            "@type": "IMAGE-DOWNSAMPLED",
            "@size": "204391",
            "@ref": "gr7",
            "@mimetype": "image/jpeg"
        },
        {
            "@category": "standard",
            "@height": "267",
            "@width": "313",
            "@_fa": "true",
            "$": "https://api.elsevier.com/content/object/eid/1-s2.0-S0008884615000502-gr6.jpg?httpAccept=%2A%2F%2A",
            "@multimediatype": "JPEG image file",
            "@type": "IMAGE-DOWNSAMPLED",
            "@size": "18217",
            "@ref": "gr6",
            "@mimetype": "image/jpeg"
        },
        {
            "@category": "standard",
            "@height": "340",
            "@width": "491",
            "@_fa": "true",
            "$": "https://api.elsevier.com/content/object/eid/1-s2.0-S0008884615000502-gr5.jpg?httpAccept=%2A%2F%2A",
            "@multimediatype": "JPEG image file",
            "@type": "IMAGE-DOWNSAMPLED",
            "@size": "39438",
            "@ref": "gr5",
            "@mimetype": "image/jpeg"
        },
        {
            "@category": "standard",
            "@height": "269",
            "@width": "358",
            "@_fa": "true",
            "$": "https://api.elsevier.com/content/object/eid/1-s2.0-S0008884615000502-gr4.jpg?httpAccept=%2A%2F%2A",
            "@multimediatype": "JPEG image file",
            "@type": "IMAGE-DOWNSAMPLED",
            "@size": "111542",
            "@ref": "gr4",
            "@mimetype": "image/jpeg"
        },
        {
            "@category": "standard",
            "@height": "269",
            "@width": "358",
            "@_fa": "true",
            "$": "https://api.elsevier.com/content/object/eid/1-s2.0-S0008884615000502-gr3.jpg?httpAccept=%2A%2F%2A",
            "@multimediatype": "JPEG image file",
            "@type": "IMAGE-DOWNSAMPLED",
            "@size": "79020",
            "@ref": "gr3",
            "@mimetype": "image/jpeg"
        },
        {
            "@category": "standard",
            "@height": "270",
            "@width": "358",
            "@_fa": "true",
            "$": "https://api.elsevier.com/content/object/eid/1-s2.0-S0008884615000502-gr2.jpg?httpAccept=%2A%2F%2A",
            "@multimediatype": "JPEG image file",
            "@type": "IMAGE-DOWNSAMPLED",
            "@size": "93964",
            "@ref": "gr2",
            "@mimetype": "image/jpeg"
        },
        {
            "@category": "standard",
            "@height": "233",
            "@width": "390",
            "@_fa": "true",
            "$": "https://api.elsevier.com/content/object/eid/1-s2.0-S0008884615000502-gr17.jpg?httpAccept=%2A%2F%2A",
            "@multimediatype": "JPEG image file",
            "@type": "IMAGE-DOWNSAMPLED",
            "@size": "18502",
            "@ref": "gr17",
            "@mimetype": "image/jpeg"
        },
        {
            "@category": "standard",
            "@height": "319",
            "@width": "369",
            "@_fa": "true",
            "$": "https://api.elsevier.com/content/object/eid/1-s2.0-S0008884615000502-gr16.jpg?httpAccept=%2A%2F%2A",
            "@multimediatype": "JPEG image file",
            "@type": "IMAGE-DOWNSAMPLED",
            "@size": "18149",
            "@ref": "gr16",
            "@mimetype": "image/jpeg"
        },
        {
            "@category": "standard",
            "@height": "290",
            "@width": "349",
            "@_fa": "true",
            "$": "https://api.elsevier.com/content/object/eid/1-s2.0-S0008884615000502-gr15.jpg?httpAccept=%2A%2F%2A",
            "@multimediatype": "JPEG image file",
            "@type": "IMAGE-DOWNSAMPLED",
            "@size": "18284",
            "@ref": "gr15",
            "@mimetype": "image/jpeg"
        },
        {
            "@category": "standard",
            "@height": "272",
            "@width": "391",
            "@_fa": "true",
            "$": "https://api.elsevier.com/content/object/eid/1-s2.0-S0008884615000502-gr14.jpg?httpAccept=%2A%2F%2A",
            "@multimediatype": "JPEG image file",
            "@type": "IMAGE-DOWNSAMPLED",
            "@size": "24347",
            "@ref": "gr14",
            "@mimetype": "image/jpeg"
        },
        {
            "@category": "standard",
            "@height": "324",
            "@width": "350",
            "@_fa": "true",
            "$": "https://api.elsevier.com/content/object/eid/1-s2.0-S0008884615000502-gr13.jpg?httpAccept=%2A%2F%2A",
            "@multimediatype": "JPEG image file",
            "@type": "IMAGE-DOWNSAMPLED",
            "@size": "18940",
            "@ref": "gr13",
            "@mimetype": "image/jpeg"
        },
        {
            "@category": "standard",
            "@height": "521",
            "@width": "390",
            "@_fa": "true",
            "$": "https://api.elsevier.com/content/object/eid/1-s2.0-S0008884615000502-gr12.jpg?httpAccept=%2A%2F%2A",
            "@multimediatype": "JPEG image file",
            "@type": "IMAGE-DOWNSAMPLED",
            "@size": "36754",
            "@ref": "gr12",
            "@mimetype": "image/jpeg"
        },
        {
            "@category": "standard",
            "@height": "270",
            "@width": "358",
            "@_fa": "true",
            "$": "https://api.elsevier.com/content/object/eid/1-s2.0-S0008884615000502-gr11.jpg?httpAccept=%2A%2F%2A",
            "@multimediatype": "JPEG image file",
            "@type": "IMAGE-DOWNSAMPLED",
            "@size": "26845",
            "@ref": "gr11",
            "@mimetype": "image/jpeg"
        },
        {
            "@category": "standard",
            "@height": "803",
            "@width": "535",
            "@_fa": "true",
            "$": "https://api.elsevier.com/content/object/eid/1-s2.0-S0008884615000502-gr10.jpg?httpAccept=%2A%2F%2A",
            "@multimediatype": "JPEG image file",
            "@type": "IMAGE-DOWNSAMPLED",
            "@size": "112630",
            "@ref": "gr10",
            "@mimetype": "image/jpeg"
        },
        {
            "@category": "standard",
            "@height": "309",
            "@width": "714",
            "@_fa": "true",
            "$": "https://api.elsevier.com/content/object/eid/1-s2.0-S0008884615000502-gr1.jpg?httpAccept=%2A%2F%2A",
            "@multimediatype": "JPEG image file",
            "@type": "IMAGE-DOWNSAMPLED",
            "@size": "33096",
            "@ref": "gr1",
            "@mimetype": "image/jpeg"
        },
        {
            "@category": "thumbnail",
            "@height": "136",
            "@width": "219",
            "@_fa": "true",
            "$": "https://api.elsevier.com/content/object/eid/1-s2.0-S0008884615000502-gr9.sml?httpAccept=%2A%2F%2A",
            "@multimediatype": "GIF image file",
            "@type": "IMAGE-THUMBNAIL",
            "@size": "5301",
            "@ref": "gr9",
            "@mimetype": "image/gif"
        },
        {
            "@category": "thumbnail",
            "@height": "164",
            "@width": "182",
            "@_fa": "true",
            "$": "https://api.elsevier.com/content/object/eid/1-s2.0-S0008884615000502-gr8.sml?httpAccept=%2A%2F%2A",
            "@multimediatype": "GIF image file",
            "@type": "IMAGE-THUMBNAIL",
            "@size": "5396",
            "@ref": "gr8",
            "@mimetype": "image/gif"
        },
        {
            "@category": "thumbnail",
            "@height": "164",
            "@width": "102",
            "@_fa": "true",
            "$": "https://api.elsevier.com/content/object/eid/1-s2.0-S0008884615000502-gr7.sml?httpAccept=%2A%2F%2A",
            "@multimediatype": "GIF image file",
            "@type": "IMAGE-THUMBNAIL",
            "@size": "9080",
            "@ref": "gr7",
            "@mimetype": "image/gif"
        },
        {
            "@category": "thumbnail",
            "@height": "164",
            "@width": "192",
            "@_fa": "true",
            "$": "https://api.elsevier.com/content/object/eid/1-s2.0-S0008884615000502-gr6.sml?httpAccept=%2A%2F%2A",
            "@multimediatype": "GIF image file",
            "@type": "IMAGE-THUMBNAIL",
            "@size": "3470",
            "@ref": "gr6",
            "@mimetype": "image/gif"
        },
        {
            "@category": "thumbnail",
            "@height": "152",
            "@width": "219",
            "@_fa": "true",
            "$": "https://api.elsevier.com/content/object/eid/1-s2.0-S0008884615000502-gr5.sml?httpAccept=%2A%2F%2A",
            "@multimediatype": "GIF image file",
            "@type": "IMAGE-THUMBNAIL",
            "@size": "6933",
            "@ref": "gr5",
            "@mimetype": "image/gif"
        },
        {
            "@category": "thumbnail",
            "@height": "164",
            "@width": "218",
            "@_fa": "true",
            "$": "https://api.elsevier.com/content/object/eid/1-s2.0-S0008884615000502-gr4.sml?httpAccept=%2A%2F%2A",
            "@multimediatype": "GIF image file",
            "@type": "IMAGE-THUMBNAIL",
            "@size": "32573",
            "@ref": "gr4",
            "@mimetype": "image/gif"
        },
        {
            "@category": "thumbnail",
            "@height": "164",
            "@width": "218",
            "@_fa": "true",
            "$": "https://api.elsevier.com/content/object/eid/1-s2.0-S0008884615000502-gr3.sml?httpAccept=%2A%2F%2A",
            "@multimediatype": "GIF image file",
            "@type": "IMAGE-THUMBNAIL",
            "@size": "18960",
            "@ref": "gr3",
            "@mimetype": "image/gif"
        },
        {
            "@category": "thumbnail",
            "@height": "164",
            "@width": "218",
            "@_fa": "true",
            "$": "https://api.elsevier.com/content/object/eid/1-s2.0-S0008884615000502-gr2.sml?httpAccept=%2A%2F%2A",
            "@multimediatype": "GIF image file",
            "@type": "IMAGE-THUMBNAIL",
            "@size": "27582",
            "@ref": "gr2",
            "@mimetype": "image/gif"
        },
        {
            "@category": "thumbnail",
            "@height": "131",
            "@width": "219",
            "@_fa": "true",
            "$": "https://api.elsevier.com/content/object/eid/1-s2.0-S0008884615000502-gr17.sml?httpAccept=%2A%2F%2A",
            "@multimediatype": "GIF image file",
            "@type": "IMAGE-THUMBNAIL",
            "@size": "4879",
            "@ref": "gr17",
            "@mimetype": "image/gif"
        },
        {
            "@category": "thumbnail",
            "@height": "163",
            "@width": "189",
            "@_fa": "true",
            "$": "https://api.elsevier.com/content/object/eid/1-s2.0-S0008884615000502-gr16.sml?httpAccept=%2A%2F%2A",
            "@multimediatype": "GIF image file",
            "@type": "IMAGE-THUMBNAIL",
            "@size": "3907",
            "@ref": "gr16",
            "@mimetype": "image/gif"
        },
        {
            "@category": "thumbnail",
            "@height": "164",
            "@width": "197",
            "@_fa": "true",
            "$": "https://api.elsevier.com/content/object/eid/1-s2.0-S0008884615000502-gr15.sml?httpAccept=%2A%2F%2A",
            "@multimediatype": "GIF image file",
            "@type": "IMAGE-THUMBNAIL",
            "@size": "3873",
            "@ref": "gr15",
            "@mimetype": "image/gif"
        },
        {
            "@category": "thumbnail",
            "@height": "152",
            "@width": "219",
            "@_fa": "true",
            "$": "https://api.elsevier.com/content/object/eid/1-s2.0-S0008884615000502-gr14.sml?httpAccept=%2A%2F%2A",
            "@multimediatype": "GIF image file",
            "@type": "IMAGE-THUMBNAIL",
            "@size": "9667",
            "@ref": "gr14",
            "@mimetype": "image/gif"
        },
        {
            "@category": "thumbnail",
            "@height": "164",
            "@width": "177",
            "@_fa": "true",
            "$": "https://api.elsevier.com/content/object/eid/1-s2.0-S0008884615000502-gr13.sml?httpAccept=%2A%2F%2A",
            "@multimediatype": "GIF image file",
            "@type": "IMAGE-THUMBNAIL",
            "@size": "2023",
            "@ref": "gr13",
            "@mimetype": "image/gif"
        },
        {
            "@category": "thumbnail",
            "@height": "163",
            "@width": "122",
            "@_fa": "true",
            "$": "https://api.elsevier.com/content/object/eid/1-s2.0-S0008884615000502-gr12.sml?httpAccept=%2A%2F%2A",
            "@multimediatype": "GIF image file",
            "@type": "IMAGE-THUMBNAIL",
            "@size": "3696",
            "@ref": "gr12",
            "@mimetype": "image/gif"
        },
        {
            "@category": "thumbnail",
            "@height": "164",
            "@width": "217",
            "@_fa": "true",
            "$": "https://api.elsevier.com/content/object/eid/1-s2.0-S0008884615000502-gr11.sml?httpAccept=%2A%2F%2A",
            "@multimediatype": "GIF image file",
            "@type": "IMAGE-THUMBNAIL",
            "@size": "4020",
            "@ref": "gr11",
            "@mimetype": "image/gif"
        },
        {
            "@category": "thumbnail",
            "@height": "164",
            "@width": "109",
            "@_fa": "true",
            "$": "https://api.elsevier.com/content/object/eid/1-s2.0-S0008884615000502-gr10.sml?httpAccept=%2A%2F%2A",
            "@multimediatype": "GIF image file",
            "@type": "IMAGE-THUMBNAIL",
            "@size": "6503",
            "@ref": "gr10",
            "@mimetype": "image/gif"
        },
        {
            "@category": "thumbnail",
            "@height": "95",
            "@width": "219",
            "@_fa": "true",
            "$": "https://api.elsevier.com/content/object/eid/1-s2.0-S0008884615000502-gr1.sml?httpAccept=%2A%2F%2A",
            "@multimediatype": "GIF image file",
            "@type": "IMAGE-THUMBNAIL",
            "@size": "3563",
            "@ref": "gr1",
            "@mimetype": "image/gif"
        }
    ]},
    "link": {
        "@rel": "abstract",
        "@href": "https://api.elsevier.com/content/abstract/scopus_id/84925304391"
    }
}}