{"full-text-retrieval-response": {
    "scopus-eid": "2-s2.0-84883879020",
    "originalText": "serial JL 271496 291210 291732 291767 291786 291877 291878 31 Fuel FUEL 2013-08-27 2013-08-27 2019-12-17T23:43:13 1-s2.0-S0016236113007588 S0016-2361(13)00758-8 S0016236113007588 10.1016/j.fuel.2013.08.030 S300 S300.2 FULL-TEXT 1-s2.0-S0016236113X00122 2019-12-18T02:50:44.109473Z 0 0 20140115 2014 2013-08-27T00:00:00Z articleinfo articletitlenorm authfirstinitialnorm authfirstsurnamenorm cid cids contenttype copyright crossmark dateloaded dateloadedtxt datesearch datesort dateupdated dco docsubtype doctype doi eid ewtransactionid hubeid indexeddate issn issnnorm itemstage itemtransactionid itemweight openaccess openarchive pg pgfirst pglast pii piinorm pubdatestart pubdatetxt pubyr sectiontitle sortorder srctitle srctitlenorm srctype ssids alllist content subj subheadings suppl tomb volfirst volissue volumelist webpdf webpdfpagecount yearnav figure table body acknowledge affil articletitle auth authfirstini authfull authkeywords authlast primabst ref specialabst 0016-2361 00162361 true 116 116 C Volume 116 57 438 447 438 447 20140115 15 January 2014 2014-01-15 2014 Full Length Articles article fla Copyright © 2013 Elsevier Ltd. All rights reserved. CHARACTERIZATIONBIOMASSHIGHCARBONCONTENTCOALASHFORPRODUCTIVEREUSEAPPLICATIONS YEBOAH N 1 Introduction 2 Experimental 2.1 Materials 2.2 Experimental methods 3 Results and discussion 3.1 Physical characteristics 3.2 Chemical and mineralogical characteristics 3.2.1 Proximate, ultimate analysis, and heating value 3.2.2 Major elemental composition 3.2.3 Mineralogy 4 Conclusions Acknowledgements References AHMARUZZAMAN 2010 327 363 M ARANDAUSON 2013 242 260 A BALTRUS 2002 757 762 J BALTRUS 2001 304 305 J BALTRUS 2001 455 462 J BAN 1997 801 805 H BAN 1996 609 611 H BELLOTTO 1989 45 56 M BROWN 1995 570 574 R DEMIRBAS 2009 1464 1472 T EVANS 2010 1419 1427 A FISHER 1978 447 451 G GEORGESCU 2011 872 877 M HALL 2002 234 239 M HARDJITO 2004 467 472 D HEMMINGS 1987 3 38 R HILL 1997 193 204 R HOWER 1997 219 229 J HOWER 1996 403 411 J HOWER 1999 701 712 J HOWER 1999 175 195 J HOWER 2001 37 58 J KAO 2000 237 249 P KIM 2008 649 659 B LEVANDOWSKI 2009 269 281 J LEY 2008 494 498 M MCCARTHY 1987 99 105 G MCCARTHY 1989 3 33 G NARAYANAN 2007 2548 2558 K NAUMOV 2009 S HYSTERESISPHENOMENAINMESOPOROUSMATERIALSLEIPZIG PEDERSEN 2010 208 216 K PEDERSEN 2008 135 154 K ROBINSON 2002 343 355 A ROY 1982 563 568 W SANTAMARINA 2002 233 241 J SCHURE 1985 82 86 M SING 1985 603 K STEVENSON 1987 87 98 R THOKCHOM 2010 36 40 S VANLOO 2007 S HANDBOOKBIOMASSCOMBUSTIONCOFIRING VANROODE 1987 183 197 M VASSILEV 2010 913 933 S VASSILEV 2003 271 281 S VASSILEV 1997 19 45 S VASSILEV 2007 1490 1512 S WANG 2008 359 364 S WANG 2008 365 371 S WEI 2002 1095 1108 X YEBOAH 2011 697 705 N YIN 2011 1128 1132 C YEBOAHX2014X438 YEBOAHX2014X438X447 YEBOAHX2014X438XN YEBOAHX2014X438X447XN 2019-03-27T21:56:08.045Z http://vtw.elsevier.com/data/voc/AddOnTypes/50.7/nlp S0016236113007588 DOE SCGF Southern Company Southern Company http://data.elsevier.com/vocabulary/SciValFunders/100004402 http://sws.geonames.org/6252001/ ORISE-ORAU Department of Energy Office of Science This research was funded by Southern Company. All ash samples investigated were provided by Southern Company. All opinions expressed in this paper are the author\u2019s and do not necessarily reflect the policies and views of Southern Company. The second author acknowledges support from Department of Energy Office of Science Graduate Fellowship Program (DOE SCGF), made possible in part by the American Recovery and Reinvestment Act of 2009, administered by ORISE-ORAU under contract no. DE-AC05-06OR23100. item S0016-2361(13)00758-8 S0016236113007588 1-s2.0-S0016236113007588 10.1016/j.fuel.2013.08.030 271496 2019-12-18T02:50:44.109473Z 2014-01-15 1-s2.0-S0016236113007588-main.pdf https://s3.amazonaws.com/prod-ucs-content-store-us-east/content/pii:S0016236113007588/MAIN/application/pdf/f33effba8ffb4c53bd2c849e6bab653b/main.pdf main.pdf pdf true 1724597 MAIN 10 1-s2.0-S0016236113007588-main_1.png https://s3.amazonaws.com/prod-ucs-content-store-us-east/content/pii:S0016236113007588/PREVIEW/image/png/52324800343788ffe693ce6446eab440/main_1.png main_1.png png 48648 849 656 IMAGE-WEB-PDF 1 1-s2.0-S0016236113007588-gr1.sml https://s3.amazonaws.com/prod-ucs-content-store-us-east/content/pii:S0016236113007588/gr1/THUMBNAIL/image/gif/b624dcc95a9ac64a8145e992060170cf/gr1.sml gr1 gr1.sml sml 23435 145 219 IMAGE-THUMBNAIL 1-s2.0-S0016236113007588-gr10.sml https://s3.amazonaws.com/prod-ucs-content-store-us-east/content/pii:S0016236113007588/gr10/THUMBNAIL/image/gif/def9d738075ea28d137f27fa6bc01690/gr10.sml gr10 gr10.sml sml 4133 163 77 IMAGE-THUMBNAIL 1-s2.0-S0016236113007588-gr11.sml https://s3.amazonaws.com/prod-ucs-content-store-us-east/content/pii:S0016236113007588/gr11/THUMBNAIL/image/gif/255117d7f90c2704aa969981cb63bd3b/gr11.sml gr11 gr11.sml sml 4536 164 207 IMAGE-THUMBNAIL 1-s2.0-S0016236113007588-gr12.sml https://s3.amazonaws.com/prod-ucs-content-store-us-east/content/pii:S0016236113007588/gr12/THUMBNAIL/image/gif/ded3b3deb74cfe564e4b76d1ff8eafef/gr12.sml gr12 gr12.sml sml 10267 164 200 IMAGE-THUMBNAIL 1-s2.0-S0016236113007588-gr13.sml https://s3.amazonaws.com/prod-ucs-content-store-us-east/content/pii:S0016236113007588/gr13/THUMBNAIL/image/gif/aeffc60bc8d6ea60b32a344173e8ccfd/gr13.sml gr13 gr13.sml sml 7282 164 212 IMAGE-THUMBNAIL 1-s2.0-S0016236113007588-gr2.sml https://s3.amazonaws.com/prod-ucs-content-store-us-east/content/pii:S0016236113007588/gr2/THUMBNAIL/image/gif/58d59a1bf512a1f4670dedccd10f7dd5/gr2.sml gr2 gr2.sml sml 9124 143 219 IMAGE-THUMBNAIL 1-s2.0-S0016236113007588-gr3.sml https://s3.amazonaws.com/prod-ucs-content-store-us-east/content/pii:S0016236113007588/gr3/THUMBNAIL/image/gif/80654f87a7fffde026809cee4ecfe11f/gr3.sml gr3 gr3.sml sml 5123 155 219 IMAGE-THUMBNAIL 1-s2.0-S0016236113007588-gr4.sml https://s3.amazonaws.com/prod-ucs-content-store-us-east/content/pii:S0016236113007588/gr4/THUMBNAIL/image/gif/355cb9eb2597bce1b3fdd5d08340a3bb/gr4.sml gr4 gr4.sml sml 5088 90 219 IMAGE-THUMBNAIL 1-s2.0-S0016236113007588-gr5.sml https://s3.amazonaws.com/prod-ucs-content-store-us-east/content/pii:S0016236113007588/gr5/THUMBNAIL/image/gif/ae10e7bc3f8ae44eb591ab864de904a3/gr5.sml gr5 gr5.sml sml 7663 132 219 IMAGE-THUMBNAIL 1-s2.0-S0016236113007588-gr6.sml https://s3.amazonaws.com/prod-ucs-content-store-us-east/content/pii:S0016236113007588/gr6/THUMBNAIL/image/gif/1894476663a9d132e298aad218d69af7/gr6.sml gr6 gr6.sml sml 5645 164 116 IMAGE-THUMBNAIL 1-s2.0-S0016236113007588-gr7.sml https://s3.amazonaws.com/prod-ucs-content-store-us-east/content/pii:S0016236113007588/gr7/THUMBNAIL/image/gif/5d7b31cd88c5211838f057bfedecc967/gr7.sml gr7 gr7.sml sml 4353 163 141 IMAGE-THUMBNAIL 1-s2.0-S0016236113007588-gr8.sml https://s3.amazonaws.com/prod-ucs-content-store-us-east/content/pii:S0016236113007588/gr8/THUMBNAIL/image/gif/0e92feff5f55ddcc2a228ffc0b90e31a/gr8.sml gr8 gr8.sml sml 4961 158 219 IMAGE-THUMBNAIL 1-s2.0-S0016236113007588-gr9.sml https://s3.amazonaws.com/prod-ucs-content-store-us-east/content/pii:S0016236113007588/gr9/THUMBNAIL/image/gif/447fce66020a5c3fe7f410f58a43e86d/gr9.sml gr9 gr9.sml sml 6318 145 219 IMAGE-THUMBNAIL 1-s2.0-S0016236113007588-gr1.jpg https://s3.amazonaws.com/prod-ucs-content-store-us-east/content/pii:S0016236113007588/gr1/DOWNSAMPLED/image/jpeg/86ad7fe177bbea9ad4cf00b195ac9453/gr1.jpg gr1 gr1.jpg jpg 79320 339 510 IMAGE-DOWNSAMPLED 1-s2.0-S0016236113007588-gr10.jpg https://s3.amazonaws.com/prod-ucs-content-store-us-east/content/pii:S0016236113007588/gr10/DOWNSAMPLED/image/jpeg/a75dce5f033fad5446bf0cd34e423481/gr10.jpg gr10 gr10.jpg jpg 46270 710 335 IMAGE-DOWNSAMPLED 1-s2.0-S0016236113007588-gr11.jpg https://s3.amazonaws.com/prod-ucs-content-store-us-east/content/pii:S0016236113007588/gr11/DOWNSAMPLED/image/jpeg/1392f11bce15692cd3d57f8f3dac127f/gr11.jpg gr11 gr11.jpg jpg 12862 271 341 IMAGE-DOWNSAMPLED 1-s2.0-S0016236113007588-gr12.jpg https://s3.amazonaws.com/prod-ucs-content-store-us-east/content/pii:S0016236113007588/gr12/DOWNSAMPLED/image/jpeg/b7225525df8dc15a2780e1812080d5fe/gr12.jpg gr12 gr12.jpg jpg 29558 269 328 IMAGE-DOWNSAMPLED 1-s2.0-S0016236113007588-gr13.jpg https://s3.amazonaws.com/prod-ucs-content-store-us-east/content/pii:S0016236113007588/gr13/DOWNSAMPLED/image/jpeg/1f2dbbe951197f32b181be59501eb015/gr13.jpg gr13 gr13.jpg jpg 19414 263 341 IMAGE-DOWNSAMPLED 1-s2.0-S0016236113007588-gr2.jpg https://s3.amazonaws.com/prod-ucs-content-store-us-east/content/pii:S0016236113007588/gr2/DOWNSAMPLED/image/jpeg/138a9c4f1c14aaa428b86449247ba355/gr2.jpg gr2 gr2.jpg jpg 29748 247 378 IMAGE-DOWNSAMPLED 1-s2.0-S0016236113007588-gr3.jpg https://s3.amazonaws.com/prod-ucs-content-store-us-east/content/pii:S0016236113007588/gr3/DOWNSAMPLED/image/jpeg/2cbc38f70c31034b588a5cf35fea7e97/gr3.jpg gr3 gr3.jpg jpg 11897 228 322 IMAGE-DOWNSAMPLED 1-s2.0-S0016236113007588-gr4.jpg https://s3.amazonaws.com/prod-ucs-content-store-us-east/content/pii:S0016236113007588/gr4/DOWNSAMPLED/image/jpeg/bd21cb4ceaf261a05f7c67322b06692b/gr4.jpg gr4 gr4.jpg jpg 22395 213 519 IMAGE-DOWNSAMPLED 1-s2.0-S0016236113007588-gr5.jpg https://s3.amazonaws.com/prod-ucs-content-store-us-east/content/pii:S0016236113007588/gr5/DOWNSAMPLED/image/jpeg/799c1e62daa17e57d33bb0b1e8ae5652/gr5.jpg gr5 gr5.jpg jpg 33178 296 490 IMAGE-DOWNSAMPLED 1-s2.0-S0016236113007588-gr6.jpg https://s3.amazonaws.com/prod-ucs-content-store-us-east/content/pii:S0016236113007588/gr6/DOWNSAMPLED/image/jpeg/82095b8689f14abdeaa6d9bfada7e63a/gr6.jpg gr6 gr6.jpg jpg 72331 698 495 IMAGE-DOWNSAMPLED 1-s2.0-S0016236113007588-gr7.jpg https://s3.amazonaws.com/prod-ucs-content-store-us-east/content/pii:S0016236113007588/gr7/DOWNSAMPLED/image/jpeg/b39b40cf68d94ed41aefbce30f6c3c59/gr7.jpg gr7 gr7.jpg jpg 15616 326 282 IMAGE-DOWNSAMPLED 1-s2.0-S0016236113007588-gr8.jpg https://s3.amazonaws.com/prod-ucs-content-store-us-east/content/pii:S0016236113007588/gr8/DOWNSAMPLED/image/jpeg/c81357c61a224087efd14408e486e382/gr8.jpg gr8 gr8.jpg jpg 11325 222 308 IMAGE-DOWNSAMPLED 1-s2.0-S0016236113007588-gr9.jpg https://s3.amazonaws.com/prod-ucs-content-store-us-east/content/pii:S0016236113007588/gr9/DOWNSAMPLED/image/jpeg/c8136e91487dc036c07252a84fb4b08b/gr9.jpg gr9 gr9.jpg jpg 15930 207 312 IMAGE-DOWNSAMPLED 1-s2.0-S0016236113007588-gr1_lrg.jpg https://s3.amazonaws.com/prod-ucs-content-store-us-east/content/pii:S0016236113007588/gr1/HIGHRES/image/jpeg/24c43931cbe2cdc9fb556f3ae1ed00b9/gr1_lrg.jpg gr1 gr1_lrg.jpg jpg 688745 1501 2260 IMAGE-HIGH-RES 1-s2.0-S0016236113007588-gr10_lrg.jpg https://s3.amazonaws.com/prod-ucs-content-store-us-east/content/pii:S0016236113007588/gr10/HIGHRES/image/jpeg/68c160a1df245ccef7d5a9ef8f3d8898/gr10_lrg.jpg gr10 gr10_lrg.jpg jpg 147978 1886 890 IMAGE-HIGH-RES 1-s2.0-S0016236113007588-gr11_lrg.jpg https://s3.amazonaws.com/prod-ucs-content-store-us-east/content/pii:S0016236113007588/gr11/HIGHRES/image/jpeg/5a4dc91793dc687cb9ad218d36e21cc2/gr11_lrg.jpg gr11 gr11_lrg.jpg jpg 85141 1198 1510 IMAGE-HIGH-RES 1-s2.0-S0016236113007588-gr12_lrg.jpg https://s3.amazonaws.com/prod-ucs-content-store-us-east/content/pii:S0016236113007588/gr12/HIGHRES/image/jpeg/f0c2f96a60591c5111328c6b57029e6f/gr12_lrg.jpg gr12 gr12_lrg.jpg jpg 206597 1191 1454 IMAGE-HIGH-RES 1-s2.0-S0016236113007588-gr13_lrg.jpg https://s3.amazonaws.com/prod-ucs-content-store-us-east/content/pii:S0016236113007588/gr13/HIGHRES/image/jpeg/b82dad98c7f9cb1a3dcef23ff48d084c/gr13_lrg.jpg gr13 gr13_lrg.jpg jpg 142609 1168 1512 IMAGE-HIGH-RES 1-s2.0-S0016236113007588-gr2_lrg.jpg https://s3.amazonaws.com/prod-ucs-content-store-us-east/content/pii:S0016236113007588/gr2/HIGHRES/image/jpeg/85c48a37c314aedd51057aec3c15c821/gr2_lrg.jpg gr2 gr2_lrg.jpg jpg 225708 1095 1673 IMAGE-HIGH-RES 1-s2.0-S0016236113007588-gr3_lrg.jpg https://s3.amazonaws.com/prod-ucs-content-store-us-east/content/pii:S0016236113007588/gr3/HIGHRES/image/jpeg/3447e3c3e5d9c269da183910ca506cad/gr3_lrg.jpg gr3 gr3_lrg.jpg jpg 86481 1012 1429 IMAGE-HIGH-RES 1-s2.0-S0016236113007588-gr4_lrg.jpg https://s3.amazonaws.com/prod-ucs-content-store-us-east/content/pii:S0016236113007588/gr4/HIGHRES/image/jpeg/ed50275b4db1bb5cfb1400b6c4486904/gr4_lrg.jpg gr4 gr4_lrg.jpg jpg 77133 567 1379 IMAGE-HIGH-RES 1-s2.0-S0016236113007588-gr5_lrg.jpg https://s3.amazonaws.com/prod-ucs-content-store-us-east/content/pii:S0016236113007588/gr5/HIGHRES/image/jpeg/034344516b0be17268b4a246c3e7a1b2/gr5_lrg.jpg gr5 gr5_lrg.jpg jpg 235660 1311 2171 IMAGE-HIGH-RES 1-s2.0-S0016236113007588-gr6_lrg.jpg https://s3.amazonaws.com/prod-ucs-content-store-us-east/content/pii:S0016236113007588/gr6/HIGHRES/image/jpeg/fe474c61d2b2112fd41520eb00126881/gr6_lrg.jpg gr6 gr6_lrg.jpg jpg 556424 3091 2191 IMAGE-HIGH-RES 1-s2.0-S0016236113007588-gr7_lrg.jpg https://s3.amazonaws.com/prod-ucs-content-store-us-east/content/pii:S0016236113007588/gr7/HIGHRES/image/jpeg/2743894105f97e0a642c4e88668f449c/gr7_lrg.jpg gr7 gr7_lrg.jpg jpg 115207 1448 1251 IMAGE-HIGH-RES 1-s2.0-S0016236113007588-gr8_lrg.jpg https://s3.amazonaws.com/prod-ucs-content-store-us-east/content/pii:S0016236113007588/gr8/HIGHRES/image/jpeg/4530f0e0fcc11e308d6c1707cd13f5bc/gr8_lrg.jpg gr8 gr8_lrg.jpg jpg 81103 984 1363 IMAGE-HIGH-RES 1-s2.0-S0016236113007588-gr9_lrg.jpg https://s3.amazonaws.com/prod-ucs-content-store-us-east/content/pii:S0016236113007588/gr9/HIGHRES/image/jpeg/e0d7c5b9723dbb506ea3c622a61d14f0/gr9_lrg.jpg gr9 gr9_lrg.jpg jpg 113796 916 1382 IMAGE-HIGH-RES JFUE 7386 S0016-2361(13)00758-8 10.1016/j.fuel.2013.08.030 Elsevier Ltd Fig. 1 SEM micrographs showing different fly ash morphologies for: (a) low carbon, coal fly ash \u2013 LCFA; (b) high carbon, coal fly ash \u2013 HCFA; (c) coal co-fired with biomass fly ash \u2013 CBFA; (d) pure biomass ash \u2013 PBA. Fig. 2 Laser diffraction particle size distribution of pure coal, co-fired, and biomass ash samples used in this study. Fig. 3 Specific gravity variation with residual organic carbon content. Fig. 4 Correlation between ROC and AS for (a) coal and co-fired ash; and (b) pure biomass ash. Fig. 5 Residual organic carbon content (bars, left axis) for seven sieved particle size fractions, compared with specific surface area (lines, right axis) for each particle size group. Fig. 6 Sorption\u2013desorption isotherms for particle size fractioned ash sample CP4-2. Each chart shows data for fly ash retained on the indicated sieve size. Fig. 7 IUPAC sorption isotherm classification scheme. After Sing (1985). Fig. 8 Correlations between hygroscopic moisture and Total C for coal and co-fired, and pure biomass ash samples. Fig. 9 Correlation between Higher Heating Value and Fixed C for coal and co-fired ash, and biomass ash and petroleum coke. Predicted results are generated using FC and VM from proximate analysis. Fig. 10 Variation of CaO, SO3, MgO, and LOI with POC (SiO2 +Al2O3 +Fe2O4) in fly ash and biomass ash samples, compared to a database of similar results for coal ash compiled from literature. Fig. 11 Comparison between loss on ignition (LOI) and residual organic carbon (ROC). Fig. 12 XRD patterns for coal and co-fired ash samples from coal plants CP1 and CP5. Fig. 13 XRD patterns for pure biomass ash samples BP1, BP2, and BP3. Table 1 Power plant location, operating capacity, and types of ash samples received. Plant ID a Location Capacity (MW) Pulverizing process Boiler configuration b Type of ash c CP1 Georgia 3499 Wet ball mill TF LCFA CP2 Mississippi 750 Ball and tube mill OWF LCFA, CBFA Bowl mill CP3 Alabama 2013 Bowl mill OWF HCFA, CBFA CP4 Alabama 568 Bowl mill OWF HCFA, CBFA CP5 Alabama 138 Bowl mill TF HCFA, CBFA BP1 Vermont 50 \u2013 TGS PBA BP2 Virginia 83 \u2013 FGS PBA BP3 Georgia 73 \u2013 RB PBA a CP=coal plant, BP=biomass plant. b OWF=opposed wall fired; TF=tangentially fired; TGS=travelling grate stoker; FGS=fixed grate stoker; RB=recovery boiler. c LCFA=low carbon content coal fly ash; HCFA=high carbon content coal fly ash; CBFA=coal co-fired with biomass ash; PBA=pure biomass ash. Table 2 initial coal and biomass content (before firing), and type for each ash sample. Sample ID wt% Coal wt% Biomass Coal/biomass type CP1-1 100 0 Bituminous (low S, Ca) CP2-1 100 0 Bituminous (Columbian: low S, Ca) CP2-2 95 5 Whole-tree 1/2\u2033 Pine Chips CP2-3 95 5 Whole-tree 1/2\u2033 Pine Chips CP3-1 100 0 Bituminous (low S, Ca) CP3-2 96 4 Clean 1/2\u2033 Pine Chips CP3-3 91.8 8.2 Clean 1/2\u2033 Pine Chips CP4-1 100 0 Bituminous (low S, Ca) CP4-2 94.5 5.5 De-limbed 1/2\u2033 Pine Chips CP4-3 95.1 4.9 Whole-tree 1/2\u2033 Pine Chips CP5-1 100 0 Bituminous (low S, Ca) CP5-2 90 10 Hardwood, green, coarse CP5-3 85 15 Hardwood, green, coarse BP1-1 0 100 Forrest, sawmill, urban Wood waste BP2-1 0 100 Logging, paper mill, sawmill waste BP3-1 0 100 Sawmill waste Table 3 ASTM C618 chemical requirements for fly ash classes. Class SiO2 +Al2O3 +Fe2O3 (Minimum wt%) SO3 (Maximum wt%) Moisture (Maximum wt%) LOI (Maximum wt%) C 50 5 5 6 F 70 3 3 6 Table 4 Key ash physical characteristics. Ash ID D 50 (μm) a CU b GS As (m2/g) ROC (%) LOI (%) CP1-1 16.2 7.3 2.63 1.27 1.1 1.4 CP2-1 14.0 9.7 2.54 3.01 2.2 3.1 CP2-2 17.9 12.8 2.48 3.37 2.3 2.4 CP2-3 19.9 9.3 2.46 3.16 2.1 2.8 CP3-1 29.9 6.3 2.47 4.60 5.0 5.9 CP3-2 26.9 6.7 2.45 2.50 4.6 5.5 CP3-3 23.3 7.9 2.39 3.48 4.3 5.2 CP4-1 21.7 7.6 2.37 8.12 8.7 8.9 CP4-2 18.8 7.9 2.39 8.90 7.7 7.4 CP4-3 23.2 9.4 2.28 9.15 9.4 9.4 CP5-1 17.3 10.8 2.15 7.52 14.0 15.0 CP5-2 18.4 9.4 2.22 4.90 10.9 13.1 CP5-3 11.4 9.5 2.20 6.05 13.6 15.0 BP1-1 168 6.61 1.87 116 22.4 46.7 BP2-1 640 13.43 1.62 180 47.4 63.9 BP3-1 1440 35.47 1.03 687 80.5 95.9 a D 50 =median particle size. b CU =coefficient of uniformity= D 60/D 10. Table 5 Proximate and ultimate analysis results, and higher heating value. Ash ID Proximate analysis (wt%) Ultimate analysis (wt%, dry basis) a HHV b (MJ/kg) Moisture (%) Volatile matter (%, dry) Ash (%, dry) Fixed C (%, dry) C S H N CP1-1 0.18 0.92 98.22 0.86 1.3 0.08 bd bd 0.42 CP2-1 0.20 0.62 96.84 2.54 2.2 0.36 bd bd 2.11 CP2-2 0.27 0.61 97.60 1.79 2.1 0.26 bd bd 2.06 CP2-3 0.20 0.67 97.24 2.09 2.3 0.34 bd bd 2.04 CP3-1 0.23 1.74 92.78 5.49 5.5 0.51 bd bd 1.65 CP3-2 0.19 1.93 92.82 5.25 5.3 0.41 bd bd 1.74 CP3-3 0.28 1.78 93.07 5.15 5.1 0.63 bd bd 1.58 CP4-1 0.24 0.89 90.66 8.45 8.6 0.07 bd bd 2.48 CP4-2 0.26 0.90 92.20 6.90 7.9 0.11 bd bd 2.23 CP4-3 0.33 0.91 90.48 8.61 9.2 0.06 bd bd 2.62 CP5-1 0.59 0.86 86.45 12.69 14.4 0.04 0.1 bd 4.44 CP5-2 0.59 1.04 87.39 11.57 12.7 0.05 bd bd 4.33 CP5-3 0.55 0.77 85.85 13.38 13.4 0.08 bd bd 4.08 BP1-1 5.14 19.72 54.32 25.96 24.5 3.48 0.6 bd 5.95 BP2-1 6.89 16.98 43.66 39.36 43.6 1.29 1.1 bd 15.28 BP3-1 12.12 15.75 5.04 79.21 80.5 0.45 1.4 bd 25.36 a bd =below detection limit; detection limit for C, H, N=0.1% (Perkin Elmer 2400 Series II), detection limit for S=0.01% (Leco S-144DR). b HHV=higher heating value. Table 6 major element composition expressed as oxides for all 16 ash samples in this study (X-ray fluorescence). Major oxides CP1 CP2-1 CP2-2 CP2-3 CP3-1 CP3-2 CP3-3 CP4-1 CP4-2 CP4-3 CP5-1 CP5-2 CP5-3 BP1 BP2 BP3 SiO2 55.28 42.77 42.84 43.95 45.32 47.85 48.03 60.65 62.61 61.64 46.95 48.57 47.06 6.43 10.63 1.74 Al2O3 27.21 25.62 26.21 26.45 23.39 24.71 24.41 19.48 19.14 19.58 22.90 23.37 23.08 0.75 2.06 0.27 Fe2O3 7.98 14.67 13.87 13.18 14.01 11.73 10.19 7.01 6.13 6.67 9.82 9.04 8.66 0.54 0.85 0.09 CaO 1.26 3.83 4.01 3.76 1.13 1.22 1.24 2.85 2.83 2.74 0.49 0.74 0.77 24.12 14.47 1.16 MgO 1.23 1.27 1.25 1.25 1.18 1.20 1.16 1.53 1.39 1.49 0.71 0.77 0.76 2.54 1.78 bd SO3 0.07 0.48 0.44 0.52 0.06 0.10 0.07 0.34 0.29 0.38 0.04 0.05 0.08 2.88 1.10 0.44 Na2O 0.47 0.51 0.52 0.53 0.68 0.62 0.80 1.92 1.98 1.76 0.19 0.23 0.26 0.40 0.17 bd K2O 3.02 2.13 2.08 2.09 2.42 2.58 2.43 1.51 1.47 1.51 2.13 2.22 2.24 7.48 3.42 0.13 P2O5 0.19 0.60 0.65 0.65 0.33 0.37 0.34 0.19 0.19 0.19 0.34 0.42 0.53 2.18 0.98 0.07 TiO2 1.41 1.26 1.31 1.31 1.07 1.14 1.14 0.83 0.80 0.82 1.36 1.46 1.43 0.07 0.17 0.01 Mn2O3 0.06 0.06 0.06 0.06 0.12 0.10 0.09 0.07 0.06 0.07 0.03 0.03 0.03 0.65 0.44 0.05 Cr2O3 0.05 0.07 0.06 0.06 0.05 0.05 0.05 0.07 0.06 0.04 bd bd bd bd 0.01 0.04 ZnO 0.01 0.01 0.01 0.01 0.01 0.01 0.01 0.01 bd 0.01 bd bd bd 0.10 bd bd V2O5 0.07 0.08 0.08 0.07 0.06 0.06 0.06 0.05 0.05 0.05 bd bd bd bd bd bd ZrO2 0.05 0.07 0.07 0.07 0.04 0.04 0.04 0.04 0.05 0.04 bd bd bd bd bd bd SrO bd b bd bd bd bd bd bd bd bd bd 0.05 0.06 0.05 0.09 bd 0.04 LOI 1.40 3.10 2.40 2.80 5.90 5.50 5.20 8.90 7.40 9.40 15.00 13.10 15.00 46.70 63.90 95.90 ROC 1.1 2.2 2.3 2.1 5 4.6 4.3 8.7 7.7 9.4 14 10.9 13.6 22.4 47.4 80.5 POC a 90.47 83.06 82.92 83.58 82.72 84.29 82.63 87.14 87.88 87.89 79.67 82.67 78.80 7.72 13.54 2.10 a POC=primary oxide content (SiO2 +Al2O3 +Fe2O3). b bd =below instrument detection limit (0.01ppm). Characterization of biomass and high carbon content coal ash for productive reuse applications N.N. Nortey Yeboah \u204e Christopher R. Shearer Susan E. Burns Kimberly E. Kurtis School of Civil and Environmental Engineering, Georgia Institute of Technology, 790 Atlantic Dr., Atlanta, GA 30332-0355, United States School of Civil and Environmental Engineering Georgia Institute of Technology 790 Atlantic Dr. Atlanta GA 30332-0355 United States \u204e Corresponding author. Tel.: +1 410 402 3565; fax: +1 404 894 2281. Highlights \u2022 We characterize pure coal, coal and biomass co-fired, and pure biomass ash. \u2022 We examine physical, thermal, chemical and mineralogical characteristics. \u2022 Up to 15% biomass co-firing with coal does not significantly change the fly ash physical and chemical characteristics. \u2022 Co-fired ash that meets ASTM requirements for concrete can be used like coal ash. \u2022 Biomass ash can likely be used as sorptive agents or as a fuel supplement. Productively reusing the waste residuals from energy production is an essential component in sustainable disposal and management of energy related waste. In the US, the world\u2019s second largest producer of coal next to China, over 118 million tons of coal combustion by-products are produced each year; only 44% of which are productively reused. In recent decades, advances in lowering CO2, SOX, and NOX emissions from coal combustion have changed the characteristics of the solid coal combustion products. In particular, the residual carbon content of fly ash generated at many US coalfired power plants has increased, and has become more heterogeneous. Additionally, utilities are exploring the use of pure biomass as a fuel source, which results in a fly ash that is generated from a purely organic source. While much research effort has been devoted to understanding the properties and potential productive reuse alternatives for coal combustion products, relatively little research has been done on the byproducts from biomass combustion or co-combustion. In this study, high carbon content coal ash, co-fired coal/biomass ash, and pure biomass ash from several US power plants were investigated. The ashes were characterized using a number of physical and chemical analysis techniques, including: scanning electron microscopy, laser diffraction, organic carbon content, nitrogen adsorption surface area, proximate and ultimate, X-ray fluorescence, and X-ray diffraction analysis. Results showed little physical, chemical, and mineralogical differentiation between coal ash and coal co-fired with biomass ash. However, the pure biomass ashes investigated in this study, showed significantly lower specific gravity, and primary oxide content, as well as coarser particle size distribution, higher residual carbon, higher heating value, and much higher specific surface area, when compared to the coal and co-fired ashes. These results have important implications on the potential for productive reuse of these waste materials. Keywords Coal combustion ash Biomass ash Co-fired Residual carbon Productive reuse 1 Introduction Slightly more than 118 million metric tons of coal combustion by-products are produced in the US every year, only 44% of which are productively reused [1]. Fly ash, the fine particulate residual material generated from coal combustion, is produced at a rate of just over 54 million tons annually in the US [1]. The majority of this waste material is currently disposed of in impoundments on site at utilities or landfilled offsite, while 38% of fly ash is productively reused; predominantly as supplementary cementitious material (SCM) in the concrete and concrete products sector [1,56]. In 1990, an amendment to the Clean Air Act mandated a conversion to more environmentally friendly and renewable energy production in the form of low NOX combustion processes, in addition to longstanding CO2 and SOX emissions restrictions. This conversion to low emissions combustion can be achieved by techniques like: flu gas recirculation, low excess air operation, coal blending, and staged combustion [23,24]. All of these techniques alter ambient gas concentrations and/or lower boiler temperature, producing fly ash with coarser particle size distribution, lower amorphous glass content, and most importantly, higher and more inconsistent carbon content [17,21,23,24,25,30,51]. Increased residual carbon content in fly ash reduces the marketability of this waste product as SCM in concrete. The residual carbon adsorbs air entraining agents (AEAs) added to concrete to produce stable air voids to mitigate freeze\u2013thaw cracking [6,20,30,36,37]. Along with the low emissions strategies being implemented at modern power plants, sole combustion or co-combustion of waste biomass with coal has also become an attractive option for renewable and environmentally friendly energy production [14,33,53]. This biomass is typically in the form of chipped tree limbs, wood chips, and saw dust from urban, industrial, and agricultural sources. It is generally accepted that renewable energy generates zero net greenhouse gas emissions, while at the same time offsetting those from fossil fuel combustion [26,47,52]. In addition to the environmental benefits of biomass combustion or co-combustion for energy, mixing of biomass with coal in typical combustion processes is a simple and relatively inexpensive procedure. It is thus a particularly appealing option for power plants [2]. Understanding the physical and chemical properties of fly ash produced at power plants is necessary for improving existing productive reuse and disposal methods, as well as for developing new alternatives for both reuse and disposal of this abundant waste stream. In the US, the concrete and concrete products sector accounts for just over 21% of total coal combustion product (CCP) productive reuse, consuming 11 million tons of fly ash annually, making this the largest fly ash reuse sector [1]. The ASTM C618 standard governs the use of fly ash in concrete, allowing only fly ash from 100% coal combustion, with loss on ignition levels below 6% (by mass), to be used in such applications. There are additional chemical composition and physical requirements for the use of ash as SCM; however, the two ASTM C618 restrictions mentioned above eliminate a large portion of fly ash produced today from potential reuse in concrete applications. The use of co-fired ashes with acceptable LOI, chemical and physical characteristics is not addressed in the current ASTM C618. As regulating bodies continue to reduce the allowable levels of SOX, NOX, and CO2 emitted into the atmosphere, it is likely that there will be an increase in the number of utilities interested in transitioning from coal only combustion, to co-firing coal and biomass [55]. While a great deal of research on CCPs has been conducted over the past half century, relatively little work has been done on fly ash from this modern era that is seeking enhanced renewable energy resources. Research on the physical, chemical, and potentially beneficial characteristics of this ever evolving waste stream must continue. In this study, we aim to determine any differences between pure coal ash and biomass co-fired with coal ash, as well as pure biomass ash, through in-depth physical, chemical, and mineralogical characterization. Emphasis is placed on identifying potential productive reuse alternatives for these waste materials. 2 Experimental 2.1 Materials Sixteen ash samples from eight different power plants located in the eastern US were investigated in this study. Table 1 shows the location and operating capacity of each plant; along with the respective pulverizing processes, boiler configurations, and types of ash received. Table 2 shows the feed coal and biomass content for each ash sample. Plant CP1 coal ash was included as a reference high quality, low loss on ignition (LOI) Class F ash (ASTM C618), which is commercially marketed for use as SCM. The ASTM C618 criteria for the different fly ash class designations are summarized in Table 3 . As shown in Table 2, three samples were received from each of Plants CP2, 3, 4, and 5. The first ash sample from each plant was from the pure coal ash produced at that plant. The second and third ash samples were from biomass co-firing tests conducted at each plant. The samples from Plants BP1, 2, and 3 were pure biomass ashes from combustion of mill waste, logging, or urban wood waste without any coal. All pure coal ash samples were collected from dry storage silos after electrostatic precipitation (ESP). The co-fired fly ash samples were collected directly from hoppers at the electrostatic precipitators after the conclusion of each co-firing test. The pure biomass ashes were all obtained from storage silos after cyclone collection and electrostatic precipitation. All ash samples were provided by Southern Company. 2.2 Experimental methods Particle size distribution (PSD) was determined by dry dispersion laser diffraction (Sympatec GmbH, Rodos T4.1) for coal and co-fired ash samples. Dry sieving was used for pure biomass ash samples as their particle sizes were outside the measuring range for laser diffraction. A stack of 20 individual sieves from a #4 (4.75mm openings) to #400 (37μm openings) was used. Specific gravity for all samples was measured by kerosene displacement in triplicate (ASTM C188). Bulk sample specific surface area was determined by liquid nitrogen adsorption (Micromeritics, ASAP 2020) using BET theory. Scanning electron microscope images were obtained on a LEO 1550 field emission SEM. Proximate analysis was conducted in accordance with the ASTM D7582 by thermogravimetry (Leco TGA-601). Ultimate analysis was conducted on a CHN analyzer (Perkin Elmer 2400 Series II), and a total sulfur analyzer (Leco S-144DR) following ASTM D3176. Heating value was determined by bomb calorimeter (Leco AC-350). In addition to the total carbon content from ultimate analysis, residual organic carbon content (ROC) was also measured with a Shimadzu total organic carbon analyzer (TOC-Vcpm) with a solid sample module (SSM-5000A). Major elemental composition (expressed as oxides) was determined by X-ray fluorescence (XRF) spectrometry (Philips PW 2400). Mineralogy for all 16 ash samples was determined by random powder X-ray diffraction (PANalytical X\u2019Pert PRO). All samples were oven dried at 110°C for a minimum of 1h before analysis. The coal and co-fired ashes were analyzed without any particle size reduction. Pure biomass ash samples however, were ground to fine powder using mortar and pestle prior to analysis. 3 Results and discussion 3.1 Physical characteristics Eleven major morphological fly ash particle groups have previously been categorized in terms of shape (angular, amorphous, rounded, spherical, vesicular, lacy) and opacity (non-opaque, mixed, and opaque) [15]. These morphologies can be observed in essentially all the coal ash samples tested in this study. To distinguish between the four different fly ash types considered in this study (LCFA, HCFA, CBFA, PBA \u2013 see Table 1), four general morphological classes were determined. Fig. 1 (a\u2013d) shows SEM images for each of these morphologic groups. Typical glassy aluminosilicate spherical particles, including cenospheres (hollow spheres) and plerospheres (spheres filled with spheres), found in a commercial LCFA (Fig. 1a); amorphous and porous unburned carbon particle from incomplete coal combustion surrounded by spheroids (Fig. 1b); carbon-rich fraction of CBFA generated by dry triboelectrostatic separation, which is a common fly ash beneficiation technique (Fig. 1c) [5,7,8,9]. The same type of unburned coal particles present in Fig. 1b were observed in Fig. 1c, along with a larger, more fibrous, woody particle from the biomass. Such fibrous and woody particles were the only particles observed in PBA (Fig. 1d). The particle size distributions (PSDs) for coal and co-fired ash were obtained by laser diffraction in air, while the biomass ash results were produced by dry mechanical sieving (Fig. 2 ). From literature, the majority of coal fly ash is typically finer than the standard number 200 sieve (75μm openings), and is evenly distributed over a relatively wide range of particle sizes from greater than 200μm to less than 1μm [19,41]. Results show that the PSD for coal and co-fired ashes in this study are in line with these trends. The median particle size (D 50) ranged from 11.4μm to 29.9μm for the coal and co-fired ash samples, compared to 168μm to 1440μm for the biomass ash as shown in Table 4 . Coefficients of uniformity (CU = D 60/D 10) ranged from 6.3 to 35.47 for all 16 samples, indicating a distributed range of particle sizes for each of the ashes investigated. No consistent particle size distribution trend existed between pure coal and co-fired ash samples produced from the same plant. In some cases, the pure coal ash was finer than the co-fired ash produced from same boiler, while in other cases, the opposite trend was observed. In general, particle size distribution was relatively consistent for fly ash samples from the same boiler, and was largely unaffected by quantities of up to 15% co-fired biomass by energy. All biomass ash samples were significantly coarser than the coal and co-fired ashes, and showed more variability in their particle size distribution. Specific gravity (Gs ) values ranged from 2.15 to 2.63 for the coal and co-fired ashes and 1.03\u20131.87 for the biomass ashes (Table 4). ROC varied from approximately 1% to 14% for coal and co-fired ash samples, and from 22% to 80% for pure biomass ash. A trend of decreasing specific gravity with increasing ROC was evident (Fig. 3 ). Values for coal ash Gs from literature typically range from 2.0 to 3.0: however, for individual particles, Gs values can vary from less than 2.0, like in residual carbon, to 4.0 in iron rich spinels like magnetite and franklinite [3,28]. For the coal and co-fired ashes, specific surface area (As ) ranged from 1.27 to 9.15m2/g. For the pure biomass ash samples, As values were notably higher and varied over a much wider range, from 116 to 687m2/g. No trend was observed when comparing As for the pure coal and co-fired ash samples from the same boiler. In some cases, As decreased slightly with co-firing, and in other cases As increased slightly. In general, a trend of increasing ROC with As was observed for all ash samples (Fig. 4 ). There was, however, a stronger positive correlation between ROC and As for the pure biomass ash samples compared to the coal and co-fired ashes. Specific surface values for coal fly ash can vary from less than 1m2/g to 10m2/g, depending mainly on residual carbon content, with particle size distribution playing a less significant role [3,27,41,50]. Fig. 5 shows ROC and As results for different particle size fractions for ash samples CP4-1, 2, and 3. The ash samples were separated into seven particle size fractions using six sieves (178μm, 152μm, 75μm, 44μm, 37μm, and 25μm openings). For each fraction, ROC and As were determined. ROC decreased as particle size fraction decreased, from close to 50% organic carbon in the fractions retained on the 177μm sieve, to 2% organic carbon in the fractions passing the 25μm sieve. Other researchers have also shown that carbon content decreases while amorphous silica(glass) content increases with decreasing particle size in fly ash [10,19]. As also decreased with decreasing particle size from over 20m2/g for the fractions retained on the 177μm sieve, to less than 5m2/g for the fractions finer than 25μm. As should theoretically increase as particle size decreases since it is inversely proportional to the smallest dimension of a particle [40]. The presence of well developed internal porosity in the residual carbon particles, which became less prominent as particle size decreased, was the most likely source of the increased surface area. Similar results were observed for ash samples from plants CP2, 3, and 5 (data not shown). Schure et al. [41], conducted similar testing on two different ash samples, and also attributed higher than expected specific surface values in the larger particles size fractions to the presence of highly porous carbonaceous particles [41]. Further indication of the presence of internal porosity in the larger particle size fractions and the lack of porosity in the smaller particle size fractions, can be observed in nitrogen sorption\u2013desorption isotherms for particle size fractioned sample CP4-2, shown in Fig. 6 . The four largest particle size fractions produced Type IV isotherms (Fig. 6a\u2013d) as defined by the IUPAC [34,42]. The two smallest particle size fractions (Fig. 6e\u2013f) produced Type II isotherms. Fig. 7 shows the shapes of the basic IUPAC isotherm types [42]. Type II isotherms are generated by non-porous or macroporous adsorbents (pore diameters larger than 50nm), and they indicate unrestricted monolayer and multilatayer adsorption [34,42]. Type IV isotherms are indicative of mesoporous adsorbents (pore diameters between 2 and 25nm), and are similar to Type II isotherms in their adsorption leg, with a hysteresis loop in the desorption leg [34,42]. The hysteresis is caused by capillary condensation in the mesopores at high P/P 0 values [34]. In Fig. 6, the largest particle size fraction, retained on the 178 micron sieve, showed the most pronounced hysteresis loop, and thus contained the most developed mesoporosity. The hysteresis decreased progressively as particle size decreased until virtually no hysteresis was observed in the smallest particle size fractions. Similar results were obtained for the other CP4 ashes, CP4-1 and 3, (data not shown). 3.2 Chemical and mineralogical characteristics 3.2.1 Proximate, ultimate analysis, and heating value Proximate and ultimate analysis, as well as higher heating value (HHV) measurements, were conducted on all 16 ash samples. The results are shown in Table 5 , and clear difference between the pure biomass ash and the coal and co-fired ash samples can be observed. The biomass ash samples showed significantly higher moisture content, volatile matter (VM), fixed carbon (FC), total carbon (C), sulfur (S), and hydrogen (H); and lower ash content. Comparing the coal and co-fired ashes, there was little differentiation between the pure coal and co-fired ash samples from the same boiler. Overall, the proximate and ultimate results were very similar for ash produced at the same boiler. The differences between ash samples from different boilers can be attributed to variations in the composition of source coals, grinding and fuel preparation procedures, as well as combustion and ash collection conditions. Moisture and total carbon content were positively correlated for both the coal and co-fired ash samples (R 2 =0.788), and the biomass ashes (R 2 =0.990) (Fig. 8 ). As carbon content increased, surface area increased as well, due to the internal porosity of the residual carbon (previously discussed), resulting in more surface area available for hygroscopic moisture sorption. There was also a very strong correlation between HHV and FC for the coal and co-fired ash (R 2= 0.899), and the pure biomass ash samples (R 2 =0.953) (Fig. 9 ). One additional data point was plotted for reference, representing the average HHV and FC for 11 fuel-grade petroleum coke samples from a cement kiln at a plant in Cupertino, California was plotted (provided by Heidelberg Technology Center, Norcross, Georgia). Predicted HHV for all 16 ash samples using FC and volatile matter (VM) from proximate analysis using the empirical correlation: HHV=0.1905VM+0.2521FC [57], were also plotted. The predicted HHV values match the measured results relatively well. Measured HHV for the BP3 sample (25.36MJ/kg) was the closest to the measured HHV for fuel grade pet coke (32.68MJ/kg). Sample BP3 is thus a particularly strong candidate for productive reuse as an alternative fuel source for industrial processes like in cement kilns [4], or potentially in fired clay brick production [12]. 3.2.2 Major elemental composition Fly ash, is composed primarily of approximately 90\u201399% inorganic matter, consisting mainly of oxides of silicon, aluminum and iron; with lesser inclusions of magnesium, sulfur, titanium, phosphorous, potassium, sodium, and manganese [3,19,32,50]. In trace quantities, a wide variety of heavy metals like arsenic, lead, zinc, selenium, chromium and manganese can also be detected in coal fly ash [50]. Major element composition (expressed as oxides) from X-ray fluorescence (XRF) spectroscopy, and loss on ignition (LOI) for the 16 ash samples (Table 6 ) were determined and compared with a database of similar results from literature. The bulk of the database content was from a study by McCarthy (1989) (178 fly ash samples), which consisted of major element composition and LOI data points for fly ash samples from US power plants. The complete data base (224 fly ash samples) includes 114 Class F, 102 Class C, and 8 non-specified fly ash samples from the US, Europe, India, and Australia [16,18,32,43,44,48,49]. The relationship between Ca, S, Mg, and LOI (respectively) vs. primary oxide content (POC=SiO2 +Al2O3 +Fe2O4) is shown in Fig. 10 . Values from the literature database are plotted together with the values for all 16 ash samples used in this study. All 13 coal and co-fired ash samples investigated plotted in the Class F (ASTM C618) region, with low CaO, SO3, and MgO content. The database of coal ash samples from literature showed a general trend of decreasing CaO, SO3, and MgO (respectively) with increasing POC. The decreasing CaO content with increasing POC was the most pronounced, ranging from close to 30% in the class C ashes to less than 1% in the Class F region. Class F ashes from the literature database showed the highest variability in CaO, SO3, MgO and LOI. In general, the Ca in fly ash tends to associate more with Mg, S, and P, and not with the aluminosilicate minerals and glass phases [10,19,22,29,31,32,39,43,50]. Fig. 10d shows consistently low LOI values (below 2%) in the Class C region for the coal ash samples from literature. In the Class F region, LOI values increased, and became highly variable for both the literature database and the data points from the samples in this investigation. The coal and co-fired ash samples from CP2, 3, 4, and 5 showed decreasing LOI with increasing POC within the Class F region. From literature, LOI and residual organic carbon content (ROC) values are typically higher for low calcium and sulfur content fly ash types (predominantly class F), owing to their higher rank coal origins [32]. Lower rank coals, which are typically richer in both Ca and S, are younger and thus less compacted and dense, and easier to burn, thus producing less ash and lower residual carbon content [32]. Adequate grinding and boiler efficiency is more important when higher rank coals are burned, and these factors can vary significantly from plant to plant, explaining the increase and the variability of LOI in the class F ashes. The results showed no consistent differences in major elemental composition and LOI between the coal and co-fired fly ash samples used in this study. However, the pure biomass ashes had significantly lower POC than the coal and co-fired ashes, plotting in the non-specification section. These biomass ash samples also had relatively low SO3 and MgO content, and variable CaO content from above 20% in BP1 to less than 2% in BP3. Researchers have shown that, the most common elemental constituents in biomass ash are typically Ca and K with lesser Mg, Na, Ma and Fe. Silicates, oxalates and sulfates are common anions in biomass ash as well [13]. Compared to coal ash, however, biomass ash is typically less enriched in silica, aluminum, iron and sulfur. The XRF results for the three biomass ash samples from this study are in agreement with these trends. In practice, LOI is often considered equivalent to ROC; however, this is not always the case. It has been demonstrated that fly ash from low rank coals typically shows significant disagreement between LOI and ROC, while ashes from high rank coals have minimal disagreement [11,50]. Residual carbon may be present in fly ash in both organic and inorganic (mainly CaCO3) forms. LOI will include the mass loss from both of these carbon sources, as well as from other volatile components that may be present in the ash, such as CaOH2 in the form of the mineral portlandite, which is commonly present in fly ash [11]. Thus, ashes with high Ca content typically show the largest discrepancy between LOI and ROC values [50]. This trend was observed in this study, where the two biomass ash samples BP1 and BP2 with Ca contents of 24.12% and 14.47%, respectively, showed significant deviation from the 1:1 line (Fig. 11 ). BP3 had Ca content of only 1.16%; however this sample (as with BP1, and 2) was also composed of other non-carbon volatile matter, which contributed to the LOI (Table 5). It should be noted that while the majority of the co-fired ash samples had high LOI (above the 6% ASTM limit), the results showed no correlation between LOI (or ROC) and the addition of biomass (up to 15% by mass) to the feed coal. The LOI or ROC of a particular co-fired ash was very similar to (sometimes even less than) the pure coal ash produced at the same boiler. The co-fired ashes produced at Plant CP2 (CP2-2, 3), each with 5% biomass and LOI below 3%, are thus excellent candidates for productive reuse as SCM, like the pure coal ash produced from the same plant. Furthermore, in situations where air entrained concrete is not required (e.g.: interior walls and slabs, and exterior walls in warm climates where freeze\u2013thaw cycles are not expected), high LOI co-fired ash can be used similar to coal ash as SCM, provided all other ASTM requirements are met. Vassilev et al. [47] have shown that compared to coal ash, pure biomass contains phases with more oxygen-containing functional groups like hydroxyl, carboxyl, ether, and ketone groups with highly reactive functionalities (\u2013COOH, \u2013OCH3 and \u2013OH) [47]. Biomass ashes are also more likely to contain chelates, light hydrocarbons, carbohydrates, oxyhydroxides, carbonates, chlorides, and phosphates; and less aromatic carbon species which are predominant in coal [35,47]. Biomass also generally contains more of the alkali and alkaline elements (K, Na, Mg, Ca) and chlorine than coal, which have been shown to cause boiler fouling or slagging during combustion [2,38,45,54]. These trends from literature are consistent with the higher alkali content measured in the three biomass ashes in this study, compared to the coal and co-fired ash samples (Table 5). Water soluble alkalis in biomass ash have been shown to interact unfavorably with air entraining agents (AEA) in concrete, thus increasing AEA demand and limiting the potential for productive reuse of some forms of biomass ash in concrete [45]. 3.2.3 Mineralogy Depending on the sensitivity of the measuring technique, almost all known natural elements can be detected in coal [35]. Several dozen detrital and authigenic minerals formed from these natural elements have been found in coal ash; the majority of which, however, are only present in trace quantities. The most prominent fly ash minerals are from 5 groups: silica, aluminosilicates, carbonates (calcite), sulfides, and chlorides [19]. XRD patterns for coal and co-fired ash samples from plant CP1, and CP5 showed that the predominant crystalline phases present in the coal and co-fired ash samples analyzed in this study were quartz (SiO2), mullite (Al6Si2O13), hematite (Fe2O3), and magnetite (Fe3O4) (Fig. 12 ). XRD patterns for the other coal and co-fired ash samples demonstrated similar trends (data not shown). In all cases, a distinct \u201chump\u201d in the XRD pattern from approximately 18° to 35° 2 Theta was observed. This broad peak is very common in fly ash XRD studies, and is referred to as the amorphous rise (or hump), due to the poorly ordered atomic structure of the glassy (amorphous) component of coal fly ash [10,46]. The results showed no significant change in the mineralogy of the resulting fly ash with co-firing of coal with up to 15% biomass. XRD results for the 3 biomass ash samples demonstrated that calcite (CaCO3), arcanite (K2SO4), and silica (SiO2) were the dominant mineral species identified in these ashes (Fig. 13 ). The mineral component in sample BP1 was predominantly calcite with minor arcanite. Sample BP2 was also mainly calcite, with a minor silica component. For sample BP3, the only identifiable mineral phase was silica. The vast majority of the material in BP3 was organic carbon, which is not identifiable by XRD. As in Fig. 10, these XRD patterns are shown without removal of the background; and as such, the lack of an amorphous rise in any of the biomass ashes confirms observations from SEM analysis (Fig. 1) that they did not contain very much (if any) amorphous glass. The lack of any aluminosilicate or iron oxide minerals in the biomass ash also corroborated the XRF results (Table 6). 4 Conclusions This study compared morphology, physical and chemical characteristics, and mineralogy of high carbon Class F coal ash, biomass co-fired with coal ash, and pure biomass ash from different US power plants. The pure coal and co-fired ashes were very similar morphologically, except the co-fired ashes contained a minor component of unburned woody particles not present in the pure coal ash. Pure biomass ash had significantly different morphology from the coal and co-fired ashes, consisting solely of fibrous, woody char particles and no evidence of the typical cenospheres found in fly ash. The specific surface area of the coal and co-fired fly ash samples was controlled by internal porosity in the residual carbon content, which decreased as particle size fraction decreased, resulting in a decrease in specific surface area as particle size fraction decreased. There was no indication that co-firing biomass with coal changed the overall residual carbon content of the ash samples. With up to 15% (mass) biomass co-firing, the ash produced at a particular boiler remained relatively unchanged, in terms of residual carbon, particle size, major elemental composition, and mineralogy. This suggested that ash from co-firing of coal with up to 15% biomass could be productively reused in concrete as supplementary cementitious material in much the same way as pure coal ash, provided this ash meets all the other required ASTM C618 criteria. The pure biomass ash samples examined in this study were significantly different from coal ash. Unlike coal ash, biomass ash did not contain aluminosilicate glass cenospheres, and was composed solely of large fibrous woody remnants with elevated alkali content compared to coal ash. These forms of ash will not likely be usable in concrete applications as SCMs due to their unsuitable chemical and physical characteristics. However, the relatively high carbon content, surface area, and higher heating value of these ash samples, warrant investigating their utility as sorptive agents, and potentially as fuel supplements in energy production or in industrial applications like clay brick firing and cement kilns. Acknowledgements This research was funded by Southern Company. All ash samples investigated were provided by Southern Company. All opinions expressed in this paper are the author\u2019s and do not necessarily reflect the policies and views of Southern Company. The second author acknowledges support from Department of Energy Office of Science Graduate Fellowship Program (DOE SCGF), made possible in part by the American Recovery and Reinvestment Act of 2009, administered by ORISE-ORAU under contract no. DE-AC05-06OR23100. References [1] ACAA. 2010 Coal combustion product (CCP) production & use survey report; 2011. <http://acaa.affiniscape.com/displaycommon.cfm?an=1&subarticlenbr=3> [accessed 11.01.12]. [2] AGS. Co-combustion, a summary of technology. Gothenburg, Sweden; 2007. <http://www.energy-pathways.org/pdf/R5_co-combustion.pdf> [accessed 18.11.11]. [3] M. Ahmaruzzaman A review on the utilization of fly ash Prog Energy Combust Sci 36 3 2010 327 363 [4] A. Aranda Uson A.M. Lopez-Sabiron G. Ferreira E. Llera Sastresa Uses of alternative fuels and raw materials in the cement industry as sustainable waste management options Renew Sustain Energy Rev 23 2013 242 260 [5] J.P. Baltrus J.R. Diehl Y. Soong W. Sands Triboelectrostatic separation of fly ash and charge reversal Fuel 81 6 2002 757 762 [6] J.P. Baltrus R.B. LaCount D.G. Kern Relationships between Foam Index, AEA adsorption and unburned carbon content of coal-combustion fly ash ACS Division of Fuel Chemistry, Preprints 46 1 2001 304 305 [7] J.P. Baltrus A.W. Wells D.J. Fauth J.R. Diehl C.M. White Characterization of carbon concentrates from coal-combustion fly ash Energy Fuels 15 2 2001 455 462 [8] H. Ban T.X. Li J.C. Hower J.L. Schaefer J.M. Stencel Dry triboelectrostatic beneficiation of fly ash Fuel 76 8 1997 801 805 [9] H. Ban T.X. Li J.L. Schaefer J.M. Stencel Triboelectrostatic separation of unburned carbon from fly ash ACS Division of Fuel Chemistry, Preprints 41 2 1996 609 611 [10] M. Bellotto C. Boni A. Caridi E. Cereda C. Chemelli G.M.B. Marcazzan Analysis of coal fly ash by bulk and surface characterization techniques MRS Online Proc Library 178 1989 45 56 [11] R.C. Brown J. Dykstra Systematic-errors in the use of loss-on-ignition to measure unburned carbon in fly-ash Fuel 74 4 1995 570 574 [12] Chusid M, Miller SH, Rapoport J. The building brick of sustainability; 2009. <http://www.chusid.com/Portfolio_files/csmay20092.pdf> [accessed 13.12.12]. [13] T. Demirbas C. Demirbas Fuel properties of wood species Energy Sources A-Recovery Util Environ Effects 31 16 2009 1464 1472 [14] A. Evans V. Strezov T.J. Evans Sustainability considerations for electricity generation from biomass Renew Sustain Energy Rev 14 5 2010 1419 1427 [15] G.L. Fisher B.A. Prentice D. Silberman J.M. Ondov A.H. Biermann R.C. Ragaini Physical and morphological-studies of size-classified coal fly-ash Environ Sci Technol 12 4 1978 447 451 [16] M. Georgescu I.E. Catanescu G. Voicu Geopolymer binders based on fly ash influences of some compositional characteristics Rev Chim 62 9 2011 872 877 [17] M.L. Hall W.R. Livingston Fly ash quality, past, present and future, and the effect of ash on the development of novel products J Chem Technol Biotechnol 77 3 2002 234 239 [18] D. Hardjito S.E. Wallah D.M.J. Sumajouw B.V. Rangan On the development of fly ash-based geopolymer concrete ACI Mater J 101 6 2004 467 472 [19] R.T. Hemmings E.E. Berry On the glass in coal fly ashes: recent advances MRS Online Proc Lib 113 1987 3 38 [20] R.L. Hill S.L. Sarkar R.F. Rathbone J.C. Hower An examination of fly ash carbon and its interactions with air entraining agent Cem Concr Res 27 2 1997 193 204 [21] J.C. Hower R.F. Rathbone T.L. Robl G.A. Thomas B.O. Haeberlin A.S. Trimble Case study of the conversion of tangential- and wall-fired units to low-NOx combustion: impact on fly ash quality Waste Manage 17 4 1997 219 229 [22] J.C. Hower J.D. Robertson G.A. Thomas A.S. Wong W.H. Schram U.M. Graham Characterization of fly ash from Kentucky power plants Fuel 75 Compendex 1996 403 411 [23] J.C. Hower T.L. Robl G.A. Thomas Changes in the quality of coal combustion by-products produced by Kentucky power plants, 1978 to 1997: consequences of Clean Air Act directives Fuel 78 6 1999 701 712 [24] J.C. Hower G.A. Thomas J. Palmer Impact of the conversion to low-NOx combustion on ash characteristics in a utility boiler burning Western US coal Fuel Process Technol 61 3 1999 175 195 [25] J.C. Hower A.S. Trimble C.F. Eble Temporal and spatial variations in fly ash quality Fuel Process Technol 73 1 2001 37 58 [26] IEA. Biomass for power generation and combined heat and power (CHP); 2007. <http://www.iea.org/techno/essentials3.pdf> [accessed 30.11.11]. [27] P.C. Kao J.H. Tzeng T.L. Huang Removal of chlorophenols from aqueous solution by fly ash J Hazard Mater 76 2\u20133 2000 237 249 [28] B. Kim M. Prezzi Evaluation of the mechanical properties of class-F fly ash Waste Manage 28 3 2008 649 659 [29] J. Levandowski W. Kalkreuth Chemical and petrographical characterization of feed coal, fly ash and bottom ash from the Figueira Power Plant, Parana, Brazil Int J Coal Geol 77 3\u20134 2009 269 281 [30] M.T. Ley N.J. Harris K.J. Folliard K.C. Hover Investigation of air-entraining admixture dosage in fly ash concrete ACI Mater J 105 5 2008 494 498 [31] G.J. McCarthy D.M. Johansen A. Thedchanamoorthy S.J. Steinwand K.D. Swanson Characterization of North American lignite fly ashes II. XRD mineralogy MRS Online Proc Lib 113 1987 99 105 [32] G.J. McCarthy J.K. Solem O.E. Manz D.J. Hassett Use of a database of chemical, mineralogical and physical properties of North American fly ash to study the nature of fly ashand its utilization as a mineral admixture in concrete MRS Online Proc Lib 178 1989 3 33 [33] K.V. Narayanan E. Natarajan Experimental studies on cofiring of coal and biomass blends in India Renew Energy 32 15 2007 2548 2558 [34] S. Naumov Hysteresis phenomena in mesoporous materials: Leipzig 2009 University of Leipzig [35] Netzel DA. Multinuclear NMR approach to coal fly ash characterization; 1991. <http://www.osti.gov/bridge/servlets/purl/10137808-jIjjQ0/10137808.pdf> [accessed 28.11.11]. [36] K.H. Pedersen A.D. Jensen K. Dam-Johansen The effect of low-NOx combustion on residual carbon in fly ash and its adsorption capacity for air entrainment admixtures in concrete Combust Flame 157 2 2010 208 216 [37] K.H. Pedersen A.D. Jensen M.S. Skjoth-Rasmussen K. Dam-Johansen A review of the interference of carbon containing fly ash with air entrainment in concrete Prog Energy Combust Sci 34 2 2008 135 154 [38] A.L. Robinson H. Junker L.L. Baxter Pilot-scale investigation of the influence of coal-biomass cofiring on ash deposition Energy Fuels 16 2 2002 343 355 [39] W.R. Roy R.A. Griffin A proposed classification-system for coal fly-ash in multidisciplinary research J Environ Qual 11 4 1982 563 568 [40] J.C. Santamarina K.A. Klein Y.H. Wang E. Prencke Specific surface: determination and relevance Can Geotech J 39 1 2002 233 241 [41] M.R. Schure P.A. Soltys D.F.S. Natusch T. Mauney Surface-area and porosity of coal fly-ash Environ Sci Technol 19 1 1985 82 86 [42] K.S.W. Sing D.H. Everett R.A.W. Haul L. Moscou R.A. Pierotti J. Rouguerol Reporting physisorption data for gas/solid systems Pure Appl Chem 57 4 1985 603 [43] R.J. Stevenson J.C. Collier J.J. Crashell L.R. Quandt Characterization of North American lignite fly ashes I. Chemical variation MRS Online Proc Lib 113 1987 87 98 [44] S. Thokchom P. Ghosh S. Ghosh Performance of fly ash based geopolymer mortars in sulphate solution J Eng Sci Technol Rev 3 1 2010 36 40 [45] S. van Loo J. Koppejan The handbook of biomass combustion and co-firing 2007 Earthscan London, Sterling, VA [46] M. Vanroode E. Douglas R.T. Hemmings X-ray-diffraction measurement of glass content in fly ashes and slags Cem Concr Res 17 2 1987 183 197 [47] S.V. Vassilev D. Baxter L.K. Andersen C.G. Vassileva An overview of the chemical composition of biomass Fuel 89 5 2010 913 933 [48] S.V. Vassilev J.M.D. Tascon Methods for characterization of inorganic and mineral matter in coal: a critical overview Energy Fuels 17 2 2003 271 281 [49] S.V. Vassilev C.G. Vassileva Geochemistry of coals, coal ashes and combustion wastes from coal-fired power stations Fuel Process Technol 51 1\u20132 1997 19 45 [50] S.V. Vassilev C.G. Vassileva A new approach for the classification of coal fly ashes based on their origin, composition, properties, and behaviour Fuel 86 10\u201311 2007 1490 1512 [51] Veranth JM, Pershing DW, Sarofim AF, Shield JE. Sources of unburned carbon in the fly ash produced from low-NOx pulverized coal combustion; 1998. p. 1737\u201344. [52] S.Z. Wang E. Llamazos L. Baxter F. Fonseca Durability of biomass fly ash concrete: freezing and thawing and rapid chloride permeability tests Fuel 87 3 2008 359 364 [53] S.Z. Wang A. Miller E. Llamazos F. Fonseca L. Baxter Biomass fly ash in concrete: mixture proportioning and mechanical properties Fuel 87 3 2008 365 371 [54] X.L. Wei C. Lopez T. von Puttkamer U. Schnell S. Unterberger K.R.G. Hein Assessment of chlorine-alkali-mineral interactions during co-combustion of coal and straw Energy & Fuels 16 5 2002 1095 1108 [55] Wiltsee G. Lessons learned from existing biomass power plants. Golden, Colorado; 2000. <http://www.nrel.gov/docs/fy00osti/26946.pdf> [accessed 30.11.11]. [56] N.N.N. Yeboah S.E. Burns Geologic disposal of energy related waste KSCE J Civil Eng 15 4 2011 697 705 [57] C.Y. Yin Prediction of higher heating values of biomass from proximate and ultimate analyses Fuel 90 3 2011 1128 1132",
    "scopus-id": "84883879020",
    "coredata": {
        "eid": "1-s2.0-S0016236113007588",
        "dc:description": "Productively reusing the waste residuals from energy production is an essential component in sustainable disposal and management of energy related waste. In the US, the world\u2019s second largest producer of coal next to China, over 118 million tons of coal combustion by-products are produced each year; only 44% of which are productively reused. In recent decades, advances in lowering CO2, SOX, and NOX emissions from coal combustion have changed the characteristics of the solid coal combustion products. In particular, the residual carbon content of fly ash generated at many US coalfired power plants has increased, and has become more heterogeneous. Additionally, utilities are exploring the use of pure biomass as a fuel source, which results in a fly ash that is generated from a purely organic source. While much research effort has been devoted to understanding the properties and potential productive reuse alternatives for coal combustion products, relatively little research has been done on the byproducts from biomass combustion or co-combustion. In this study, high carbon content coal ash, co-fired coal/biomass ash, and pure biomass ash from several US power plants were investigated. The ashes were characterized using a number of physical and chemical analysis techniques, including: scanning electron microscopy, laser diffraction, organic carbon content, nitrogen adsorption surface area, proximate and ultimate, X-ray fluorescence, and X-ray diffraction analysis. Results showed little physical, chemical, and mineralogical differentiation between coal ash and coal co-fired with biomass ash. However, the pure biomass ashes investigated in this study, showed significantly lower specific gravity, and primary oxide content, as well as coarser particle size distribution, higher residual carbon, higher heating value, and much higher specific surface area, when compared to the coal and co-fired ashes. These results have important implications on the potential for productive reuse of these waste materials.",
        "openArchiveArticle": "false",
        "prism:coverDate": "2014-01-15",
        "openaccessUserLicense": null,
        "prism:aggregationType": "Journal",
        "prism:url": "https://api.elsevier.com/content/article/pii/S0016236113007588",
        "dc:creator": [
            {
                "@_fa": "true",
                "$": "Yeboah, N.N. Nortey"
            },
            {
                "@_fa": "true",
                "$": "Shearer, Christopher R."
            },
            {
                "@_fa": "true",
                "$": "Burns, Susan E."
            },
            {
                "@_fa": "true",
                "$": "Kurtis, Kimberly E."
            }
        ],
        "link": [
            {
                "@_fa": "true",
                "@rel": "self",
                "@href": "https://api.elsevier.com/content/article/pii/S0016236113007588"
            },
            {
                "@_fa": "true",
                "@rel": "scidir",
                "@href": "https://www.sciencedirect.com/science/article/pii/S0016236113007588"
            }
        ],
        "dc:format": "application/json",
        "openaccessType": null,
        "pii": "S0016-2361(13)00758-8",
        "prism:volume": "116",
        "prism:publisher": "Elsevier Ltd.",
        "dc:title": "Characterization of biomass and high carbon content coal ash for productive reuse applications",
        "prism:copyright": "Copyright © 2013 Elsevier Ltd. All rights reserved.",
        "openaccess": "0",
        "prism:issn": "00162361",
        "dcterms:subject": [
            {
                "@_fa": "true",
                "$": "Coal combustion ash"
            },
            {
                "@_fa": "true",
                "$": "Biomass ash"
            },
            {
                "@_fa": "true",
                "$": "Co-fired"
            },
            {
                "@_fa": "true",
                "$": "Residual carbon"
            },
            {
                "@_fa": "true",
                "$": "Productive reuse"
            }
        ],
        "openaccessArticle": "false",
        "prism:publicationName": "Fuel",
        "openaccessSponsorType": null,
        "prism:pageRange": "438-447",
        "prism:endingPage": "447",
        "pubType": "fla",
        "prism:coverDisplayDate": "15 January 2014",
        "prism:doi": "10.1016/j.fuel.2013.08.030",
        "prism:startingPage": "438",
        "dc:identifier": "doi:10.1016/j.fuel.2013.08.030",
        "openaccessSponsorName": null
    },
    "objects": {"object": [
        {
            "@category": "thumbnail",
            "@height": "145",
            "@width": "219",
            "@_fa": "true",
            "$": "https://api.elsevier.com/content/object/eid/1-s2.0-S0016236113007588-gr1.sml?httpAccept=%2A%2F%2A",
            "@multimediatype": "GIF image file",
            "@type": "IMAGE-THUMBNAIL",
            "@size": "23435",
            "@ref": "gr1",
            "@mimetype": "image/gif"
        },
        {
            "@category": "thumbnail",
            "@height": "163",
            "@width": "77",
            "@_fa": "true",
            "$": "https://api.elsevier.com/content/object/eid/1-s2.0-S0016236113007588-gr10.sml?httpAccept=%2A%2F%2A",
            "@multimediatype": "GIF image file",
            "@type": "IMAGE-THUMBNAIL",
            "@size": "4133",
            "@ref": "gr10",
            "@mimetype": "image/gif"
        },
        {
            "@category": "thumbnail",
            "@height": "164",
            "@width": "207",
            "@_fa": "true",
            "$": "https://api.elsevier.com/content/object/eid/1-s2.0-S0016236113007588-gr11.sml?httpAccept=%2A%2F%2A",
            "@multimediatype": "GIF image file",
            "@type": "IMAGE-THUMBNAIL",
            "@size": "4536",
            "@ref": "gr11",
            "@mimetype": "image/gif"
        },
        {
            "@category": "thumbnail",
            "@height": "164",
            "@width": "200",
            "@_fa": "true",
            "$": "https://api.elsevier.com/content/object/eid/1-s2.0-S0016236113007588-gr12.sml?httpAccept=%2A%2F%2A",
            "@multimediatype": "GIF image file",
            "@type": "IMAGE-THUMBNAIL",
            "@size": "10267",
            "@ref": "gr12",
            "@mimetype": "image/gif"
        },
        {
            "@category": "thumbnail",
            "@height": "164",
            "@width": "212",
            "@_fa": "true",
            "$": "https://api.elsevier.com/content/object/eid/1-s2.0-S0016236113007588-gr13.sml?httpAccept=%2A%2F%2A",
            "@multimediatype": "GIF image file",
            "@type": "IMAGE-THUMBNAIL",
            "@size": "7282",
            "@ref": "gr13",
            "@mimetype": "image/gif"
        },
        {
            "@category": "thumbnail",
            "@height": "143",
            "@width": "219",
            "@_fa": "true",
            "$": "https://api.elsevier.com/content/object/eid/1-s2.0-S0016236113007588-gr2.sml?httpAccept=%2A%2F%2A",
            "@multimediatype": "GIF image file",
            "@type": "IMAGE-THUMBNAIL",
            "@size": "9124",
            "@ref": "gr2",
            "@mimetype": "image/gif"
        },
        {
            "@category": "thumbnail",
            "@height": "155",
            "@width": "219",
            "@_fa": "true",
            "$": "https://api.elsevier.com/content/object/eid/1-s2.0-S0016236113007588-gr3.sml?httpAccept=%2A%2F%2A",
            "@multimediatype": "GIF image file",
            "@type": "IMAGE-THUMBNAIL",
            "@size": "5123",
            "@ref": "gr3",
            "@mimetype": "image/gif"
        },
        {
            "@category": "thumbnail",
            "@height": "90",
            "@width": "219",
            "@_fa": "true",
            "$": "https://api.elsevier.com/content/object/eid/1-s2.0-S0016236113007588-gr4.sml?httpAccept=%2A%2F%2A",
            "@multimediatype": "GIF image file",
            "@type": "IMAGE-THUMBNAIL",
            "@size": "5088",
            "@ref": "gr4",
            "@mimetype": "image/gif"
        },
        {
            "@category": "thumbnail",
            "@height": "132",
            "@width": "219",
            "@_fa": "true",
            "$": "https://api.elsevier.com/content/object/eid/1-s2.0-S0016236113007588-gr5.sml?httpAccept=%2A%2F%2A",
            "@multimediatype": "GIF image file",
            "@type": "IMAGE-THUMBNAIL",
            "@size": "7663",
            "@ref": "gr5",
            "@mimetype": "image/gif"
        },
        {
            "@category": "thumbnail",
            "@height": "164",
            "@width": "116",
            "@_fa": "true",
            "$": "https://api.elsevier.com/content/object/eid/1-s2.0-S0016236113007588-gr6.sml?httpAccept=%2A%2F%2A",
            "@multimediatype": "GIF image file",
            "@type": "IMAGE-THUMBNAIL",
            "@size": "5645",
            "@ref": "gr6",
            "@mimetype": "image/gif"
        },
        {
            "@category": "thumbnail",
            "@height": "163",
            "@width": "141",
            "@_fa": "true",
            "$": "https://api.elsevier.com/content/object/eid/1-s2.0-S0016236113007588-gr7.sml?httpAccept=%2A%2F%2A",
            "@multimediatype": "GIF image file",
            "@type": "IMAGE-THUMBNAIL",
            "@size": "4353",
            "@ref": "gr7",
            "@mimetype": "image/gif"
        },
        {
            "@category": "thumbnail",
            "@height": "158",
            "@width": "219",
            "@_fa": "true",
            "$": "https://api.elsevier.com/content/object/eid/1-s2.0-S0016236113007588-gr8.sml?httpAccept=%2A%2F%2A",
            "@multimediatype": "GIF image file",
            "@type": "IMAGE-THUMBNAIL",
            "@size": "4961",
            "@ref": "gr8",
            "@mimetype": "image/gif"
        },
        {
            "@category": "thumbnail",
            "@height": "145",
            "@width": "219",
            "@_fa": "true",
            "$": "https://api.elsevier.com/content/object/eid/1-s2.0-S0016236113007588-gr9.sml?httpAccept=%2A%2F%2A",
            "@multimediatype": "GIF image file",
            "@type": "IMAGE-THUMBNAIL",
            "@size": "6318",
            "@ref": "gr9",
            "@mimetype": "image/gif"
        },
        {
            "@category": "standard",
            "@height": "339",
            "@width": "510",
            "@_fa": "true",
            "$": "https://api.elsevier.com/content/object/eid/1-s2.0-S0016236113007588-gr1.jpg?httpAccept=%2A%2F%2A",
            "@multimediatype": "JPEG image file",
            "@type": "IMAGE-DOWNSAMPLED",
            "@size": "79320",
            "@ref": "gr1",
            "@mimetype": "image/jpeg"
        },
        {
            "@category": "standard",
            "@height": "710",
            "@width": "335",
            "@_fa": "true",
            "$": "https://api.elsevier.com/content/object/eid/1-s2.0-S0016236113007588-gr10.jpg?httpAccept=%2A%2F%2A",
            "@multimediatype": "JPEG image file",
            "@type": "IMAGE-DOWNSAMPLED",
            "@size": "46270",
            "@ref": "gr10",
            "@mimetype": "image/jpeg"
        },
        {
            "@category": "standard",
            "@height": "271",
            "@width": "341",
            "@_fa": "true",
            "$": "https://api.elsevier.com/content/object/eid/1-s2.0-S0016236113007588-gr11.jpg?httpAccept=%2A%2F%2A",
            "@multimediatype": "JPEG image file",
            "@type": "IMAGE-DOWNSAMPLED",
            "@size": "12862",
            "@ref": "gr11",
            "@mimetype": "image/jpeg"
        },
        {
            "@category": "standard",
            "@height": "269",
            "@width": "328",
            "@_fa": "true",
            "$": "https://api.elsevier.com/content/object/eid/1-s2.0-S0016236113007588-gr12.jpg?httpAccept=%2A%2F%2A",
            "@multimediatype": "JPEG image file",
            "@type": "IMAGE-DOWNSAMPLED",
            "@size": "29558",
            "@ref": "gr12",
            "@mimetype": "image/jpeg"
        },
        {
            "@category": "standard",
            "@height": "263",
            "@width": "341",
            "@_fa": "true",
            "$": "https://api.elsevier.com/content/object/eid/1-s2.0-S0016236113007588-gr13.jpg?httpAccept=%2A%2F%2A",
            "@multimediatype": "JPEG image file",
            "@type": "IMAGE-DOWNSAMPLED",
            "@size": "19414",
            "@ref": "gr13",
            "@mimetype": "image/jpeg"
        },
        {
            "@category": "standard",
            "@height": "247",
            "@width": "378",
            "@_fa": "true",
            "$": "https://api.elsevier.com/content/object/eid/1-s2.0-S0016236113007588-gr2.jpg?httpAccept=%2A%2F%2A",
            "@multimediatype": "JPEG image file",
            "@type": "IMAGE-DOWNSAMPLED",
            "@size": "29748",
            "@ref": "gr2",
            "@mimetype": "image/jpeg"
        },
        {
            "@category": "standard",
            "@height": "228",
            "@width": "322",
            "@_fa": "true",
            "$": "https://api.elsevier.com/content/object/eid/1-s2.0-S0016236113007588-gr3.jpg?httpAccept=%2A%2F%2A",
            "@multimediatype": "JPEG image file",
            "@type": "IMAGE-DOWNSAMPLED",
            "@size": "11897",
            "@ref": "gr3",
            "@mimetype": "image/jpeg"
        },
        {
            "@category": "standard",
            "@height": "213",
            "@width": "519",
            "@_fa": "true",
            "$": "https://api.elsevier.com/content/object/eid/1-s2.0-S0016236113007588-gr4.jpg?httpAccept=%2A%2F%2A",
            "@multimediatype": "JPEG image file",
            "@type": "IMAGE-DOWNSAMPLED",
            "@size": "22395",
            "@ref": "gr4",
            "@mimetype": "image/jpeg"
        },
        {
            "@category": "standard",
            "@height": "296",
            "@width": "490",
            "@_fa": "true",
            "$": "https://api.elsevier.com/content/object/eid/1-s2.0-S0016236113007588-gr5.jpg?httpAccept=%2A%2F%2A",
            "@multimediatype": "JPEG image file",
            "@type": "IMAGE-DOWNSAMPLED",
            "@size": "33178",
            "@ref": "gr5",
            "@mimetype": "image/jpeg"
        },
        {
            "@category": "standard",
            "@height": "698",
            "@width": "495",
            "@_fa": "true",
            "$": "https://api.elsevier.com/content/object/eid/1-s2.0-S0016236113007588-gr6.jpg?httpAccept=%2A%2F%2A",
            "@multimediatype": "JPEG image file",
            "@type": "IMAGE-DOWNSAMPLED",
            "@size": "72331",
            "@ref": "gr6",
            "@mimetype": "image/jpeg"
        },
        {
            "@category": "standard",
            "@height": "326",
            "@width": "282",
            "@_fa": "true",
            "$": "https://api.elsevier.com/content/object/eid/1-s2.0-S0016236113007588-gr7.jpg?httpAccept=%2A%2F%2A",
            "@multimediatype": "JPEG image file",
            "@type": "IMAGE-DOWNSAMPLED",
            "@size": "15616",
            "@ref": "gr7",
            "@mimetype": "image/jpeg"
        },
        {
            "@category": "standard",
            "@height": "222",
            "@width": "308",
            "@_fa": "true",
            "$": "https://api.elsevier.com/content/object/eid/1-s2.0-S0016236113007588-gr8.jpg?httpAccept=%2A%2F%2A",
            "@multimediatype": "JPEG image file",
            "@type": "IMAGE-DOWNSAMPLED",
            "@size": "11325",
            "@ref": "gr8",
            "@mimetype": "image/jpeg"
        },
        {
            "@category": "standard",
            "@height": "207",
            "@width": "312",
            "@_fa": "true",
            "$": "https://api.elsevier.com/content/object/eid/1-s2.0-S0016236113007588-gr9.jpg?httpAccept=%2A%2F%2A",
            "@multimediatype": "JPEG image file",
            "@type": "IMAGE-DOWNSAMPLED",
            "@size": "15930",
            "@ref": "gr9",
            "@mimetype": "image/jpeg"
        },
        {
            "@category": "high",
            "@height": "1501",
            "@width": "2260",
            "@_fa": "true",
            "$": "https://api.elsevier.com/content/object/eid/1-s2.0-S0016236113007588-gr1_lrg.jpg?httpAccept=%2A%2F%2A",
            "@multimediatype": "JPEG image file",
            "@type": "IMAGE-HIGH-RES",
            "@size": "688745",
            "@ref": "gr1",
            "@mimetype": "image/jpeg"
        },
        {
            "@category": "high",
            "@height": "1886",
            "@width": "890",
            "@_fa": "true",
            "$": "https://api.elsevier.com/content/object/eid/1-s2.0-S0016236113007588-gr10_lrg.jpg?httpAccept=%2A%2F%2A",
            "@multimediatype": "JPEG image file",
            "@type": "IMAGE-HIGH-RES",
            "@size": "147978",
            "@ref": "gr10",
            "@mimetype": "image/jpeg"
        },
        {
            "@category": "high",
            "@height": "1198",
            "@width": "1510",
            "@_fa": "true",
            "$": "https://api.elsevier.com/content/object/eid/1-s2.0-S0016236113007588-gr11_lrg.jpg?httpAccept=%2A%2F%2A",
            "@multimediatype": "JPEG image file",
            "@type": "IMAGE-HIGH-RES",
            "@size": "85141",
            "@ref": "gr11",
            "@mimetype": "image/jpeg"
        },
        {
            "@category": "high",
            "@height": "1191",
            "@width": "1454",
            "@_fa": "true",
            "$": "https://api.elsevier.com/content/object/eid/1-s2.0-S0016236113007588-gr12_lrg.jpg?httpAccept=%2A%2F%2A",
            "@multimediatype": "JPEG image file",
            "@type": "IMAGE-HIGH-RES",
            "@size": "206597",
            "@ref": "gr12",
            "@mimetype": "image/jpeg"
        },
        {
            "@category": "high",
            "@height": "1168",
            "@width": "1512",
            "@_fa": "true",
            "$": "https://api.elsevier.com/content/object/eid/1-s2.0-S0016236113007588-gr13_lrg.jpg?httpAccept=%2A%2F%2A",
            "@multimediatype": "JPEG image file",
            "@type": "IMAGE-HIGH-RES",
            "@size": "142609",
            "@ref": "gr13",
            "@mimetype": "image/jpeg"
        },
        {
            "@category": "high",
            "@height": "1095",
            "@width": "1673",
            "@_fa": "true",
            "$": "https://api.elsevier.com/content/object/eid/1-s2.0-S0016236113007588-gr2_lrg.jpg?httpAccept=%2A%2F%2A",
            "@multimediatype": "JPEG image file",
            "@type": "IMAGE-HIGH-RES",
            "@size": "225708",
            "@ref": "gr2",
            "@mimetype": "image/jpeg"
        },
        {
            "@category": "high",
            "@height": "1012",
            "@width": "1429",
            "@_fa": "true",
            "$": "https://api.elsevier.com/content/object/eid/1-s2.0-S0016236113007588-gr3_lrg.jpg?httpAccept=%2A%2F%2A",
            "@multimediatype": "JPEG image file",
            "@type": "IMAGE-HIGH-RES",
            "@size": "86481",
            "@ref": "gr3",
            "@mimetype": "image/jpeg"
        },
        {
            "@category": "high",
            "@height": "567",
            "@width": "1379",
            "@_fa": "true",
            "$": "https://api.elsevier.com/content/object/eid/1-s2.0-S0016236113007588-gr4_lrg.jpg?httpAccept=%2A%2F%2A",
            "@multimediatype": "JPEG image file",
            "@type": "IMAGE-HIGH-RES",
            "@size": "77133",
            "@ref": "gr4",
            "@mimetype": "image/jpeg"
        },
        {
            "@category": "high",
            "@height": "1311",
            "@width": "2171",
            "@_fa": "true",
            "$": "https://api.elsevier.com/content/object/eid/1-s2.0-S0016236113007588-gr5_lrg.jpg?httpAccept=%2A%2F%2A",
            "@multimediatype": "JPEG image file",
            "@type": "IMAGE-HIGH-RES",
            "@size": "235660",
            "@ref": "gr5",
            "@mimetype": "image/jpeg"
        },
        {
            "@category": "high",
            "@height": "3091",
            "@width": "2191",
            "@_fa": "true",
            "$": "https://api.elsevier.com/content/object/eid/1-s2.0-S0016236113007588-gr6_lrg.jpg?httpAccept=%2A%2F%2A",
            "@multimediatype": "JPEG image file",
            "@type": "IMAGE-HIGH-RES",
            "@size": "556424",
            "@ref": "gr6",
            "@mimetype": "image/jpeg"
        },
        {
            "@category": "high",
            "@height": "1448",
            "@width": "1251",
            "@_fa": "true",
            "$": "https://api.elsevier.com/content/object/eid/1-s2.0-S0016236113007588-gr7_lrg.jpg?httpAccept=%2A%2F%2A",
            "@multimediatype": "JPEG image file",
            "@type": "IMAGE-HIGH-RES",
            "@size": "115207",
            "@ref": "gr7",
            "@mimetype": "image/jpeg"
        },
        {
            "@category": "high",
            "@height": "984",
            "@width": "1363",
            "@_fa": "true",
            "$": "https://api.elsevier.com/content/object/eid/1-s2.0-S0016236113007588-gr8_lrg.jpg?httpAccept=%2A%2F%2A",
            "@multimediatype": "JPEG image file",
            "@type": "IMAGE-HIGH-RES",
            "@size": "81103",
            "@ref": "gr8",
            "@mimetype": "image/jpeg"
        },
        {
            "@category": "high",
            "@height": "916",
            "@width": "1382",
            "@_fa": "true",
            "$": "https://api.elsevier.com/content/object/eid/1-s2.0-S0016236113007588-gr9_lrg.jpg?httpAccept=%2A%2F%2A",
            "@multimediatype": "JPEG image file",
            "@type": "IMAGE-HIGH-RES",
            "@size": "113796",
            "@ref": "gr9",
            "@mimetype": "image/jpeg"
        }
    ]},
    "link": {
        "@rel": "abstract",
        "@href": "https://api.elsevier.com/content/abstract/scopus_id/84883879020"
    }
}}