{"full-text-retrieval-response": {
    "scopus-eid": "2-s2.0-84909643196",
    "originalText": "serial JL 271643 291210 291788 291885 31 Cement and Concrete Composites CEMENTCONCRETECOMPOSITES 2014-10-12 2014-10-12 2016-04-30T10:01:54 1-s2.0-S0958946514001863 S0958-9465(14)00186-3 S0958946514001863 10.1016/j.cemconcomp.2014.10.001 S300 S300.2 FULL-TEXT 1-s2.0-S0958946514X00089 2016-04-30T05:24:48.697473-04:00 0 0 20150101 20150131 2015 2014-10-12T14:30:02.938682Z articleinfo articletitlenorm authfirstinitialnorm authfirstsurnamenorm cid cids contenttype copyright crossmark dateloaded dateloadedtxt datesearch datesort dateupdated dco docsubtype doctype doi eid ewtransactionid hubeid indexeddate issn issnnorm itemstage itemtransactionid itemweight openaccess openarchive pg pgfirst pglast pii piinorm pubdateend pubdatestart pubdatetxt pubyr sortorder srctitle srctitlenorm srctype ssids alllist content subj subheadings suppl tomb volfirst volissue volumelist webpdf webpdfpagecount yearnav figure table body mmlmath acknowledge affil articletitle auth authfirstini authfull authkeywords authlast primabst ref 0958-9465 09589465 true 55 55 C Volume 55 42 374 382 374 382 201501 January 2015 2015-01-01 2015-01-31 2015 article fla Copyright © 2014 Elsevier Ltd. All rights reserved. HYDRATIONQUATERNARYPORTLANDCEMENTBLENDSCONTAININGBLASTFURNACESLAGSILICEOUSFLYASHLIMESTONEPOWDER SCHOLER A 1 Introduction 2 Experimental 2.1 Materials and mix design 2.2 Thermodynamic modeling 2.3 Methods of analysis 2.3.1 Investigation of cement pastes 2.3.2 Compressive strength of mortar samples 3 Results and discussion 3.1 Thermodynamic modeling 3.2 Hydrates present 3.3 Development of compressive strength 4 Conclusions Acknowledgements References DAMTOFT 2008 115 127 J SCHNEIDER 2011 642 650 M TENNIS 2011 P STATEOFTHEARTREPORTUSELIMESTONEINCEMENTLEVELSUP15 TSIVILIS 2000 1679 1683 S WANG 2010 984 996 X VUK 2001 135 139 R LOTHENBACH 2011 1244 1256 B CARRASCO 2005 1324 1331 M MENENDEZ 2003 61 67 G DEWEERDT 2011 30 38 K LOTHENBACH 2008 848 860 B ZAJAC 2014 99 108 M MATSCHEI 2007 118 130 T DAMIDOT 1992 1179 1191 D DAMIDOT 1994 563 572 D DEWEERDT 2011 279 291 K MATSCHEI 2007 551 558 T MOESGAARD 2011 359 364 M DAMIDOT 2011 679 695 D BENHAHA 2010 1620 1629 M DEWEERDT 2012 1101 1114 K DESCHNER 2013 188 204 F ESPION 2013 145 152 B FIRSTINTERNATIONALCONFERENCECONCRETESUSTAINABILITY CHARACTERISATIONNEWTERNARYCEMENTSREDUCEDCLINKERCONTENT WAGNER 2012 1173 1195 T KULIK 2013 1 24 D MATSCHEI 2007 1379 1410 T LOTHENBACH 2008 1 18 B KULIK 2001 3017 3026 D HELGESON 1981 1249 1516 H KOCABA 2012 511 525 V LOTHENBACH 2012 410 423 B KULIK 2011 477 495 D KOCABA 2009 V DEVELOPMENTEVALUATIONMETHODSFOLLOWMICROSTRUCTURALDEVELOPMENTCEMENTITIOUSSYSTEMSINCLUDINGSLAGS DESCHNER 2012 1389 1400 F POLLMANN 2006 173 181 H TSIVILIS 2002 371 378 S BONAVETTI 2001 853 859 V GUTTERIDGE 1990 778 782 W GUTTERIDGE 1990 853 861 W BENHAHA 2011 955 963 M BENHAHA 2012 74 83 M LEONREINA 2009 906 916 L FRANKE 1941 180 184 B SCHOLERX2015X374 SCHOLERX2015X374X382 SCHOLERX2015X374XA SCHOLERX2015X374X382XA item S0958-9465(14)00186-3 S0958946514001863 1-s2.0-S0958946514001863 10.1016/j.cemconcomp.2014.10.001 271643 2016-04-30T05:24:48.697473-04:00 2015-01-01 2015-01-31 1-s2.0-S0958946514001863-main.pdf https://s3-eu-west-1.amazonaws.com/prod-ucs-content-store-eu-west/content/pii:S0958946514001863/MAIN/application/pdf/f6a9dfb12c884b153281cc5034354b16/main.pdf https://s3.amazonaws.com/prod-ucs-content-store-us-east/content/pii:S0958946514001863/MAIN/application/pdf/f6a9dfb12c884b153281cc5034354b16/main.pdf main.pdf pdf true 714011 MAIN 9 1-s2.0-S0958946514001863-main_1.png https://s3-eu-west-1.amazonaws.com/prod-ucs-content-store-eu-west/content/pii:S0958946514001863/PREVIEW/image/png/254756609cf8cd8e63d63b68e14c682b/main_1.png https://s3.amazonaws.com/prod-ucs-content-store-us-east/content/pii:S0958946514001863/PREVIEW/image/png/254756609cf8cd8e63d63b68e14c682b/main_1.png main_1.png png 57269 849 656 IMAGE-WEB-PDF 1 1-s2.0-S0958946514001863-gr1.sml https://s3-eu-west-1.amazonaws.com/prod-ucs-content-store-eu-west/content/pii:S0958946514001863/gr1/THUMBNAIL/image/gif/1cd103c7877aacf6862648e67b8e839c/gr1.sml https://s3.amazonaws.com/prod-ucs-content-store-us-east/content/pii:S0958946514001863/gr1/THUMBNAIL/image/gif/1cd103c7877aacf6862648e67b8e839c/gr1.sml gr1 gr1.sml sml 7889 164 148 IMAGE-THUMBNAIL 1-s2.0-S0958946514001863-gr2.sml https://s3-eu-west-1.amazonaws.com/prod-ucs-content-store-eu-west/content/pii:S0958946514001863/gr2/THUMBNAIL/image/gif/52ce32ca44ea60b92cb400472f2eadcb/gr2.sml https://s3.amazonaws.com/prod-ucs-content-store-us-east/content/pii:S0958946514001863/gr2/THUMBNAIL/image/gif/52ce32ca44ea60b92cb400472f2eadcb/gr2.sml gr2 gr2.sml sml 13176 164 218 IMAGE-THUMBNAIL 1-s2.0-S0958946514001863-gr3.sml https://s3-eu-west-1.amazonaws.com/prod-ucs-content-store-eu-west/content/pii:S0958946514001863/gr3/THUMBNAIL/image/gif/baef948310ad84b09b9be8249638350d/gr3.sml https://s3.amazonaws.com/prod-ucs-content-store-us-east/content/pii:S0958946514001863/gr3/THUMBNAIL/image/gif/baef948310ad84b09b9be8249638350d/gr3.sml gr3 gr3.sml sml 12725 160 219 IMAGE-THUMBNAIL 1-s2.0-S0958946514001863-gr4.sml https://s3-eu-west-1.amazonaws.com/prod-ucs-content-store-eu-west/content/pii:S0958946514001863/gr4/THUMBNAIL/image/gif/eaf91fa2afe7091cbb617f299dc4c78d/gr4.sml https://s3.amazonaws.com/prod-ucs-content-store-us-east/content/pii:S0958946514001863/gr4/THUMBNAIL/image/gif/eaf91fa2afe7091cbb617f299dc4c78d/gr4.sml gr4 gr4.sml sml 7655 164 208 IMAGE-THUMBNAIL 1-s2.0-S0958946514001863-gr5.sml https://s3-eu-west-1.amazonaws.com/prod-ucs-content-store-eu-west/content/pii:S0958946514001863/gr5/THUMBNAIL/image/gif/6d6114d2e030dba375f5bc2fae07c32b/gr5.sml https://s3.amazonaws.com/prod-ucs-content-store-us-east/content/pii:S0958946514001863/gr5/THUMBNAIL/image/gif/6d6114d2e030dba375f5bc2fae07c32b/gr5.sml gr5 gr5.sml sml 7035 153 219 IMAGE-THUMBNAIL 1-s2.0-S0958946514001863-gr6.sml https://s3-eu-west-1.amazonaws.com/prod-ucs-content-store-eu-west/content/pii:S0958946514001863/gr6/THUMBNAIL/image/gif/c520e23c00827277fad8f762dc1d95d4/gr6.sml https://s3.amazonaws.com/prod-ucs-content-store-us-east/content/pii:S0958946514001863/gr6/THUMBNAIL/image/gif/c520e23c00827277fad8f762dc1d95d4/gr6.sml gr6 gr6.sml sml 8100 158 219 IMAGE-THUMBNAIL 1-s2.0-S0958946514001863-gr7.sml https://s3-eu-west-1.amazonaws.com/prod-ucs-content-store-eu-west/content/pii:S0958946514001863/gr7/THUMBNAIL/image/gif/ffedc14d59bdfaf94216676ed28a9278/gr7.sml https://s3.amazonaws.com/prod-ucs-content-store-us-east/content/pii:S0958946514001863/gr7/THUMBNAIL/image/gif/ffedc14d59bdfaf94216676ed28a9278/gr7.sml gr7 gr7.sml sml 6306 164 211 IMAGE-THUMBNAIL 1-s2.0-S0958946514001863-gr8.sml https://s3-eu-west-1.amazonaws.com/prod-ucs-content-store-eu-west/content/pii:S0958946514001863/gr8/THUMBNAIL/image/gif/c8e1aae7091ed8893f5f9844bcaa6f8c/gr8.sml https://s3.amazonaws.com/prod-ucs-content-store-us-east/content/pii:S0958946514001863/gr8/THUMBNAIL/image/gif/c8e1aae7091ed8893f5f9844bcaa6f8c/gr8.sml gr8 gr8.sml sml 8185 164 214 IMAGE-THUMBNAIL 1-s2.0-S0958946514001863-gr1.jpg https://s3-eu-west-1.amazonaws.com/prod-ucs-content-store-eu-west/content/pii:S0958946514001863/gr1/DOWNSAMPLED/image/jpeg/2a302726d3417d3058202069e1610a49/gr1.jpg https://s3.amazonaws.com/prod-ucs-content-store-us-east/content/pii:S0958946514001863/gr1/DOWNSAMPLED/image/jpeg/2a302726d3417d3058202069e1610a49/gr1.jpg gr1 gr1.jpg jpg 36697 416 376 IMAGE-DOWNSAMPLED 1-s2.0-S0958946514001863-gr2.jpg https://s3-eu-west-1.amazonaws.com/prod-ucs-content-store-eu-west/content/pii:S0958946514001863/gr2/DOWNSAMPLED/image/jpeg/429ad1fbed068ce2c26c263bb7d72d35/gr2.jpg https://s3.amazonaws.com/prod-ucs-content-store-us-east/content/pii:S0958946514001863/gr2/DOWNSAMPLED/image/jpeg/429ad1fbed068ce2c26c263bb7d72d35/gr2.jpg gr2 gr2.jpg jpg 52190 355 472 IMAGE-DOWNSAMPLED 1-s2.0-S0958946514001863-gr3.jpg https://s3-eu-west-1.amazonaws.com/prod-ucs-content-store-eu-west/content/pii:S0958946514001863/gr3/DOWNSAMPLED/image/jpeg/6a83e81ce306e5a45f6a47bf0cb37f4b/gr3.jpg https://s3.amazonaws.com/prod-ucs-content-store-us-east/content/pii:S0958946514001863/gr3/DOWNSAMPLED/image/jpeg/6a83e81ce306e5a45f6a47bf0cb37f4b/gr3.jpg gr3 gr3.jpg jpg 49660 349 478 IMAGE-DOWNSAMPLED 1-s2.0-S0958946514001863-gr4.jpg https://s3-eu-west-1.amazonaws.com/prod-ucs-content-store-eu-west/content/pii:S0958946514001863/gr4/DOWNSAMPLED/image/jpeg/1ec4f813154e21e7d6673a07c909e173/gr4.jpg https://s3.amazonaws.com/prod-ucs-content-store-us-east/content/pii:S0958946514001863/gr4/DOWNSAMPLED/image/jpeg/1ec4f813154e21e7d6673a07c909e173/gr4.jpg gr4 gr4.jpg jpg 25685 296 375 IMAGE-DOWNSAMPLED 1-s2.0-S0958946514001863-gr5.jpg https://s3-eu-west-1.amazonaws.com/prod-ucs-content-store-eu-west/content/pii:S0958946514001863/gr5/DOWNSAMPLED/image/jpeg/4a8a73886af50655ca6363e452876c66/gr5.jpg https://s3.amazonaws.com/prod-ucs-content-store-us-east/content/pii:S0958946514001863/gr5/DOWNSAMPLED/image/jpeg/4a8a73886af50655ca6363e452876c66/gr5.jpg gr5 gr5.jpg jpg 22685 265 378 IMAGE-DOWNSAMPLED 1-s2.0-S0958946514001863-gr6.jpg https://s3-eu-west-1.amazonaws.com/prod-ucs-content-store-eu-west/content/pii:S0958946514001863/gr6/DOWNSAMPLED/image/jpeg/0887df7ae8c92be165ee7f4e99e88d37/gr6.jpg https://s3.amazonaws.com/prod-ucs-content-store-us-east/content/pii:S0958946514001863/gr6/DOWNSAMPLED/image/jpeg/0887df7ae8c92be165ee7f4e99e88d37/gr6.jpg gr6 gr6.jpg jpg 43287 362 500 IMAGE-DOWNSAMPLED 1-s2.0-S0958946514001863-gr7.jpg https://s3-eu-west-1.amazonaws.com/prod-ucs-content-store-eu-west/content/pii:S0958946514001863/gr7/DOWNSAMPLED/image/jpeg/7efe319d72b1537c4cb12893de646c7e/gr7.jpg https://s3.amazonaws.com/prod-ucs-content-store-us-east/content/pii:S0958946514001863/gr7/DOWNSAMPLED/image/jpeg/7efe319d72b1537c4cb12893de646c7e/gr7.jpg gr7 gr7.jpg jpg 22000 281 363 IMAGE-DOWNSAMPLED 1-s2.0-S0958946514001863-gr8.jpg https://s3-eu-west-1.amazonaws.com/prod-ucs-content-store-eu-west/content/pii:S0958946514001863/gr8/DOWNSAMPLED/image/jpeg/cd528a4f5c4aab2c658e9e317a1a3ba3/gr8.jpg https://s3.amazonaws.com/prod-ucs-content-store-us-east/content/pii:S0958946514001863/gr8/DOWNSAMPLED/image/jpeg/cd528a4f5c4aab2c658e9e317a1a3ba3/gr8.jpg gr8 gr8.jpg jpg 26349 286 373 IMAGE-DOWNSAMPLED 1-s2.0-S0958946514001863-si1.gif https://s3-eu-west-1.amazonaws.com/prod-ucs-content-store-eu-west/content/pii:S0958946514001863/STRIPIN/image/gif/935f3608796460c2c69576e56f91f47d/si1.gif https://s3.amazonaws.com/prod-ucs-content-store-us-east/content/pii:S0958946514001863/STRIPIN/image/gif/935f3608796460c2c69576e56f91f47d/si1.gif si1 si1.gif gif 506 19 75 ALTIMG 1-s2.0-S0958946514001863-si10.gif https://s3-eu-west-1.amazonaws.com/prod-ucs-content-store-eu-west/content/pii:S0958946514001863/STRIPIN/image/gif/5c1f83cae9507de40f6a381dfbc43ddd/si10.gif https://s3.amazonaws.com/prod-ucs-content-store-us-east/content/pii:S0958946514001863/STRIPIN/image/gif/5c1f83cae9507de40f6a381dfbc43ddd/si10.gif si10 si10.gif gif 3010 42 479 ALTIMG 1-s2.0-S0958946514001863-si11.gif https://s3-eu-west-1.amazonaws.com/prod-ucs-content-store-eu-west/content/pii:S0958946514001863/STRIPIN/image/gif/cc86b2f29553f1a7d19fb9a442fab21c/si11.gif https://s3.amazonaws.com/prod-ucs-content-store-us-east/content/pii:S0958946514001863/STRIPIN/image/gif/cc86b2f29553f1a7d19fb9a442fab21c/si11.gif si11 si11.gif gif 365 14 55 ALTIMG 1-s2.0-S0958946514001863-si12.gif https://s3-eu-west-1.amazonaws.com/prod-ucs-content-store-eu-west/content/pii:S0958946514001863/STRIPIN/image/gif/b5887398fe35a04d1f82e51095b1ddc3/si12.gif https://s3.amazonaws.com/prod-ucs-content-store-us-east/content/pii:S0958946514001863/STRIPIN/image/gif/b5887398fe35a04d1f82e51095b1ddc3/si12.gif si12 si12.gif gif 1664 19 399 ALTIMG 1-s2.0-S0958946514001863-si13.gif https://s3-eu-west-1.amazonaws.com/prod-ucs-content-store-eu-west/content/pii:S0958946514001863/STRIPIN/image/gif/7faf86d3b0e257d7f3631493811de468/si13.gif https://s3.amazonaws.com/prod-ucs-content-store-us-east/content/pii:S0958946514001863/STRIPIN/image/gif/7faf86d3b0e257d7f3631493811de468/si13.gif si13 si13.gif gif 3842 73 464 ALTIMG 1-s2.0-S0958946514001863-si14.gif https://s3-eu-west-1.amazonaws.com/prod-ucs-content-store-eu-west/content/pii:S0958946514001863/STRIPIN/image/gif/0205b9fcd299140ae1789a3dad3308ed/si14.gif https://s3.amazonaws.com/prod-ucs-content-store-us-east/content/pii:S0958946514001863/STRIPIN/image/gif/0205b9fcd299140ae1789a3dad3308ed/si14.gif si14 si14.gif gif 4014 47 538 ALTIMG 1-s2.0-S0958946514001863-si2.gif https://s3-eu-west-1.amazonaws.com/prod-ucs-content-store-eu-west/content/pii:S0958946514001863/STRIPIN/image/gif/1951400439a11081553b77e7f743884c/si2.gif https://s3.amazonaws.com/prod-ucs-content-store-us-east/content/pii:S0958946514001863/STRIPIN/image/gif/1951400439a11081553b77e7f743884c/si2.gif si2 si2.gif gif 501 17 69 ALTIMG 1-s2.0-S0958946514001863-si3.gif https://s3-eu-west-1.amazonaws.com/prod-ucs-content-store-eu-west/content/pii:S0958946514001863/STRIPIN/image/gif/7bcee28b9910418fac75d319041ab84b/si3.gif https://s3.amazonaws.com/prod-ucs-content-store-us-east/content/pii:S0958946514001863/STRIPIN/image/gif/7bcee28b9910418fac75d319041ab84b/si3.gif si3 si3.gif gif 530 19 74 ALTIMG 1-s2.0-S0958946514001863-si4.gif https://s3-eu-west-1.amazonaws.com/prod-ucs-content-store-eu-west/content/pii:S0958946514001863/STRIPIN/image/gif/3c39e51097bc3910c8d493d6d239fe75/si4.gif https://s3.amazonaws.com/prod-ucs-content-store-us-east/content/pii:S0958946514001863/STRIPIN/image/gif/3c39e51097bc3910c8d493d6d239fe75/si4.gif si4 si4.gif gif 323 19 32 ALTIMG 1-s2.0-S0958946514001863-si5.gif https://s3-eu-west-1.amazonaws.com/prod-ucs-content-store-eu-west/content/pii:S0958946514001863/STRIPIN/image/gif/c1418484dcfad897427cfe886c23f0ac/si5.gif https://s3.amazonaws.com/prod-ucs-content-store-us-east/content/pii:S0958946514001863/STRIPIN/image/gif/c1418484dcfad897427cfe886c23f0ac/si5.gif si5 si5.gif gif 5781 18 368 ALTIMG 1-s2.0-S0958946514001863-si6.gif https://s3-eu-west-1.amazonaws.com/prod-ucs-content-store-eu-west/content/pii:S0958946514001863/STRIPIN/image/gif/9b94fe052cc817039a40415aa1cd2167/si6.gif https://s3.amazonaws.com/prod-ucs-content-store-us-east/content/pii:S0958946514001863/STRIPIN/image/gif/9b94fe052cc817039a40415aa1cd2167/si6.gif si6 si6.gif gif 375 18 62 ALTIMG 1-s2.0-S0958946514001863-si7.gif https://s3-eu-west-1.amazonaws.com/prod-ucs-content-store-eu-west/content/pii:S0958946514001863/STRIPIN/image/gif/3f9543a75024896b9157c73daee7e8dc/si7.gif https://s3.amazonaws.com/prod-ucs-content-store-us-east/content/pii:S0958946514001863/STRIPIN/image/gif/3f9543a75024896b9157c73daee7e8dc/si7.gif si7 si7.gif gif 383 18 63 ALTIMG 1-s2.0-S0958946514001863-si8.gif https://s3-eu-west-1.amazonaws.com/prod-ucs-content-store-eu-west/content/pii:S0958946514001863/STRIPIN/image/gif/55107b5f8d684fea1e54f34ae660353f/si8.gif https://s3.amazonaws.com/prod-ucs-content-store-us-east/content/pii:S0958946514001863/STRIPIN/image/gif/55107b5f8d684fea1e54f34ae660353f/si8.gif si8 si8.gif gif 1239 48 187 ALTIMG 1-s2.0-S0958946514001863-si9.gif https://s3-eu-west-1.amazonaws.com/prod-ucs-content-store-eu-west/content/pii:S0958946514001863/STRIPIN/image/gif/94a4465082702403a8d118b8ded6f242/si9.gif https://s3.amazonaws.com/prod-ucs-content-store-us-east/content/pii:S0958946514001863/STRIPIN/image/gif/94a4465082702403a8d118b8ded6f242/si9.gif si9 si9.gif gif 1459 39 250 ALTIMG CECO 2425 S0958-9465(14)00186-3 10.1016/j.cemconcomp.2014.10.001 Elsevier Ltd Fig. 1 Particle size distribution of the raw materials measured by laser diffraction. The relative error is ±1vol.%. Fig. 2 Hydrates as predicted by thermodynamic modeling as a function of CaCO3/fly ash content at 20wt.% blast-furnace slag. The dash-dot lines represent the compositions of the systems under investigation. Volume expressed as cm3/100g unhydrated binder. Fig. 3 Changes in the total volume of hydrates as an effect of different additions of blast-furnace slag and fly ash in a quaternary OPC containing 5wt.% CaCO3. The dash-dot lines represent the two blast-furnace slag levels that were investigated in the present study. Volume expressed as cm3/100g unhydrated binder. Fig. 4 XRD diffractograms of samples containing 20wt.% blast-furnace slag and 30wt.% fly ash or mixtures of fly ash and limestone at 182days of hydration. AFmss \u2013 solid solution of hemicarbonate and OH− substituted monosulfate, CH \u2013 portlandite, E \u2013 ettringite, HC \u2013 hemicarbonate, HT \u2013 hydrotalcite, MC \u2013 monocrbonate, MS \u2013 monosulfate, Mu \u2013 mullite. Fig. 5 TGA curves for samples containing 20wt.% blast-furnace slag at 182days of hydration. Cc \u2013 calcite, CH \u2013 portlandite, C\u2013S\u2013H \u2013 calcium silicate hydrate, E \u2013 ettringite, HC \u2013 hemicarbonate, HT \u2013 hydrotalcite, MC \u2013 monocarbonate. Fig. 6 Content of bound water (excluding portlandite) and portlandite obtained from TGA for both blast-furnace slag levels of (a) 20wt.% and (b) 30wt.% at 28, 91 and 182days of hydration. The relative error due to preparation and measurement is between ±5% and 10%. Fig. 7 Compressive strength at 2, 7 and 28days of hydration for systems containing 20wt.% and 30wt.% blast-furnace slag. Fig. 8 The effect of limestone in cement blends containing blast-furnace slag and/or fly ash calculated by thermodynamic modeling. Assumed degrees of reaction are 100% for OPC, 70% for blast-furnace slag and 30% for fly ash. Volume expressed as cm3/100g unhydrated binder. The X represents the weight fraction of added CaCO3. Table 1 Chemical composition a and physical properties of the used raw materials. OPC BFS FA LS SiO2 19.86 41.25 56.77 2.35 Al2O3 4.64 7.57 26.03 0.78 TiO2 0.26 0.3 1.37 0.04 MnO 0.1 0.71 0.03 0.01 Fe2O3 3.52 0.38 5.07 0.28 CaO 63.67 36.43 3.19 53.18 MgO 1.11 9.67 1.34 0.33 K2O 0.63 0.62 2.53 0.18 Na2O 0.14 0.37 0.31 n.d. SO3 2.89 1.51 0.06 n.d. P2O5 0.14 0.02 0.4 0.02 LOI b 2.13 0.62 e 2.12 42.33 Total 99.09 98.83 99.22 99.50 CO2 c 0.7 0.0 1.16 42.2 Ctotal d n.d. n.d. 1.28 n.d. K2Owater soluble 0.43 0.01 0.04 n.d. Na2Owater soluble 0.06 <0.01 0.03 n.d. Blaine surface (cm2/g) 5180 4200 3360 4650 Density (g/cm3) 3.13 2.91 2.22 2.72 d 50 (μm) 11 14 10 16 a Determined by XRF analysis (wt.%). b 950°C (OPC, BFS), 1050°C (FA, LS). c Calculated from TGA. d C content determined by combustion analysis. TOC=1.22wt.%. e Gain of ignition due to oxidation of S2−. Table 2 Mineralogical composition of the used raw materials determined by XRD Rietveld (wt.%). a OPC BFS FA LS C3S 62.9 Mullite 19.2 α\u2032 C2S 5.5 Free lime 0.2 β C2S 3.2 Maghemite 0.9 C3A cubic 1.4 Quartz 0.2 10.2 0.5 C3A othorh. 4.2 Calcite 0.4 0.4 99.1 C4AF 12.7 Anhydrite 0.4 Calcite 1.5 Akermanite 0.2 Arcanite 0.7 Merwinite 0.4 Periclase 0.2 Gypsum 0.3 Portlandite b 1.7 Illite 0.4 Bassanite 3.2 Amorphous 98.5 68.8 Gypsum 1.2 Syngenite 1.4 Quartz 0.2 Total 100.0 100.0 100.1 100.0 a The Uncertainties are in the range of 4.1\u20136.5% for C3S, 2.8\u20135.5% for C2S, 0.9\u20132.5% for C3A, 1.3\u20132.4% for C4AF, 1.0\u20131.6% for gypsum and 1.5\u20133.8% for calcite as investigated by round robin tests [49]. b Free lime in OPC=1.65, detected according to [50]. Table 3 Glass composition of blast-furnace slag and fly ash (wt.%). Values are estimated by subtracting the water soluble alkalis and the fraction of crystalline phases from the total XRF composition. BFS FA SiO2 42.7 62.2 Al2O3 7.9 18.5 Fe2O3 0.4 6.3 CaO 37.5 3.9 MgO 10.0 2.0 K2O 0.6 3.8 Na2O 0.4 0.5 TiO2 0.3 2.1 P2O5 \u2013 0.6 Si/Al 5.4 3.4 Table 4 Compositions of the investigated quaternary cements. BFS-FA-L Composition (data in wt.%) OPC BFS FA LS 20-30-0 50 20 30 0 20-25-5 50 20 25 5 20-20-10 50 20 20 10 20-15-15 50 20 15 15 20-10-20 50 20 10 20 30-20-0 50 30 20 0 30-15-5 50 30 15 5 30-10-10 50 30 10 10 30-5-15 50 30 5 15 30-0-20 50 30 0 20 Table 5 Density and molar volume of hydrates used in the thermodynamic calculations [34]. Mineral Formula Density (g/cm3) Molar volume (cm3/mol) Monosulfate Ca4Al2(SO4)(OH)12·6H2O 2.01 309 Hemicarbonate Ca4Al2(CO3)0.5(OH)13·5.5H2O 1.98 285 Monocarbonate Ca4Al2(CO3)(OH)12·5H2O 2.17 262 Ettringite Ca6Fe2(SO4)3(OH)12·26H2O 1.77 707 Portlandite Ca(OH)2 2.24 33 Si-rich C\u2013S\u2013H (CaO)0.8333(SiO2)(H2O)1.3333 2.50 59 Ca-rich C\u2013S\u2013H (CaO)1.6667(SiO2)(H2O)2.1 2.67 78 Hydrotalcite Mg4Al2(OH)14·3H2O 2.01 220 FH FeO(OH) 2.61 34 Calcite CaCO3 2.71 37 Table 6 Compositions of AFm and AFt phases as used in the thermodynamic calculations. Mineral Reaction Ettringite Ca6Al2(SO4)3(OH)12·26H2O→6Ca2++2Al(OH)4 − +3SO4 2− +4OH− +26H2O Monosulfate Ca6Al2(SO4)(OH)12·6H2O→4Ca2++2Al(OH)4 − +SO4 2− +4OH− +6H2O Hemicarbonate Ca4Al2(CO3)0.5(OH)13·5.5H2O→4Ca2++2Al(OH)4 − +0.5CO3 2− +5OH− +5.5H2O Monocarbonate Ca4Al2(CO3)(OH)12·5H2O→4Ca2++2Al(OH)4 - +CO3 2− +4OH− +5H2O Table 7 Amount of bound water, C\u2013S\u2013H and portlandite at 20 and 30wt.% blast-furnace slag and 30 and 20wt.% FA, respectively. Calculated by thermodynamic modeling; referred to weight of dry hydrates. BFS content (wt.%) 30 20 Bound water (wt.%) 26.2 25.0 C\u2013S\u2013H (wt.%) 66.7 62.1 CH (wt.%) 1.0 0.0 Table 8 Bound water (excluding portlandite) and portlandite as calculated from TGA at 1 to 182days of hydration. Data is given in (wt.%). BFS-FA-LS Time (d) BW CH BFS-FA-LS Time (d) BW CH 20-10-20 1 10.4 9.3 30-0-20 1 10.4 9.4 2 14.9 11.6 2 15.0 11.7 7 18.0 11.6 7 18.1 12.6 28 18.1 12.0 28 21.6 12.8 91 22.1 12.2 91 24.7 13.5 182 20.9 12.0 182 24.5 13.2 20-15-15 1 10.8 9.1 30-5-15 1 10.5 9.1 2 14.4 10.7 2 14.7 11.1 7 17.3 11.0 7 18.5 12.6 28 18.2 12.0 28 21.8 12.6 91 22.2 11.6 91 22.8 12.8 182 21.6 11.5 182 23.7 12.5 20-20-10 1 10.6 8.7 30-10-10 1 10.7 9.2 2 14.5 11.1 2 14.5 11.3 7 18.0 11.6 7 18.4 12.1 28 18.7 11.6 28 22.0 12.2 91 22.9 11.2 91 25.0 12.4 182 22.0 11.7 182 25.0 12.0 20-25-5 1 10.5 8.9 30-15-5 1 10.5 9.3 2 14.3 10.9 2 14.7 11.0 7 18.2 11.5 7 19.3 12.3 28 19.0 11.4 28 21.8 11.9 91 22.8 11.0 91 25.1 12.2 182 21.7 10.6 182 23.1 11.5 20-30-0 1 10.2 8.6 30-20-0 1 10.5 8.6 2 14.8 10.8 2 14.6 10.9 7 18.0 11.4 7 18.1 11.6 28 18.6 11.5 28 20.8 11.8 91 23.7 11.9 91 21.6 11.7 182 21.8 11.0 182 23.4 11.2 Hydration of quaternary Portland cement blends containing blast-furnace slag, siliceous fly ash and limestone powder Axel Schöler a \u204e Barbara Lothenbach a Frank Winnefeld a Maciej Zajac b a Empa, Swiss Federal Laboratories for Materials Science and Technology, Laboratory for Concrete and Construction Chemistry, Überlandstrasse 129, 8600 Dübendorf, Switzerland Empa Swiss Federal Laboratories for Materials Science and Technology Laboratory for Concrete and Construction Chemistry Überlandstrasse 129 8600 Dübendorf Switzerland b HeidelbergCement Technology Center GmbH, Rohrbacher Strasse 95, 69181 Leimen, Germany HeidelbergCement Technology Center GmbH Rohrbacher Strasse 95 69181 Leimen Germany \u204e Corresponding author. Tel.: +41 58 765 4917; fax: +41 58 765 6935. In this study the hydration of quaternary Portland cements containing blast-furnace slag, type V fly ash and limestone and the relationship between the types and contents of supplementary cementitious materials and the hydrate assemblage were investigated at ages of up to 182days using X-ray diffraction and thermogravimetric analysis. In addition thermodynamic modeling was used to calculate the total volume of hydrates. Two blast-furnace slag contents of 20 and 30wt.% were studied in blends containing fly ash and/or limestone at a cement replacement of 50wt.%. In all cases the experiments showed the presence of C\u2013S\u2013H, portlandite and ettringite. In samples without limestone, monosulfate was formed; in the presence of limestone monocarbonate was present instead. The addition of 5wt.% of limestone resulted in a higher compressive strength after 28days than observed for cements with lower or higher limestone content. Overall the presence of fly ash exerts little influence on the hydrate assemblage. The strength development reveals that amounts of up to 30wt.% fly ash can be used in quaternary cements without significant loss in compressive strength. Keywords Quaternary Portland cement Blast-furnace slag Fly ash Thermodynamic modeling Limestone Hydrates 1 Introduction The production of cement clinker causes 5\u20138% of the global man made CO2 emissions [1,2]. The reduction of these is an important aspect of cement research in recent years, especially as the demand for cement increases [2]. This has led to numerous studies on materials suitable to partially replace the clinker in blended cements, so-called supplementary cementitious materials (SCMs). Possible and well investigated candidates for cement substitution include silica-rich materials like blast-furnace slag (BFS), fly ash (FA) and limestone (LS) [3\u20138]. Binary systems including type V fly ash or blast-furnace slag are well studied and both materials are known to show synergistic effects with limestone in ternary systems [9\u201311]. The addition of low amounts of CaCO3 to Portland cements results in the formation of mono- and/or hemicarbonate instead of monosulfate at longer reaction times [12,13]. The formation of monocarbonate prevents the destabilization of ettringite to monosulfate as monocarbonate ( C 4 A C \u203e H 11 ) and ettringite ( C 6 A S \u203e 3 H 32 ) are more stable than monosulfate ( C 4 A S \u203e H 12 ) and calcite ( C C \u203e ) [12,14\u201316]: (1) 3 C 4 A S \u203e H 12 + 2 C C \u203e + H 18 → C 6 A S \u203e 3 H 32 + 2 C 4 A C \u203e H 11 . (Cement notation with A=Al2O3, C=CaO, C \u203e = CO 2 , H=H2O, S=SiO2, S \u203e = SO 3 . ) The stabilization of ettringite and monocarbonate in the presence of CaCO3 increases the total volume of the solid phases [8,17], which has been shown to result in higher compressive strength in OPC with low additions of limestone. The amount of ettringite and monocarbonate formed in the hydrated system depends on the quantity of Al2O3 and SO3 in the system as described in detail in [18]. However, not only the total amount of Al2O3 in the system, but also the reaction degree of the aluminum containing phases (C3A, C4AF, SCMs) is an important factor [17]. The amount and fineness of calcite plays a minor role [13]. Similar effects have been observed for blends of OPC with fly ash or blast-furnace slags [9,10,19,20]. The presence of fly ash, which contains generally more Al2O3 than OPC, leads to the formation of more AFt and AFm phases, such that the effect can be more pronounced. Investigations in OPC-LS and OPC-FA-LS cements have shown that this volume increase correlates strongly with the development of compressive strength and an increase in compressive strength has been observed up to 10wt.% limestone [9,19\u201321]. The contribution of Si-rich fly ashes to the formation of AFt and AFm phases is limited due its low reaction degree. It has been reported that after 1year only 25\u201330wt.% of the fly ash present in Portland cement blends has reacted [22\u201324]. Besides these findings, efforts to reduce the carbon footprint of cements are also reflected in the work of CEN/TC 51 WG 6 Ad-Hoc-Group \u201cCEM X\u201d. This group is concerned with the investigation and the possible standardization of ternary cement compositions in EN 197-1 [25\u201327]. However, only ternary cements containing clinker, limestone and either granulated blast-furnace slag, fly ash or pozzolans are considered. While ternary composite cements are well investigated there is a lack of knowledge regarding quaternary composite cements. The latter include three SCMs besides OPC with blast-furnace slag, limestone and Si-rich fly ash (type V according to EN 197-1) being the most commonly used materials. In terms of phase composition quaternary systems have similar composition to already existing composite cements based on OPC, including blast-furnace slag or type V fly ash [28]. Such systems might therefore be promising cement compositions. This study aims to investigate the interactions between Portland cement, blast-furnace slag, type V fly ash and limestone powder in quaternary cements with high clinker replacement level of 50wt.%. Thermodynamic modeling is applied to gain information on the formed hydrates and on the volume of those as a function of blast-furnace slag/fly ash ratio. In addition thermogravimetric analysis (TGA) and X-ray diffraction (XRD) is carried out to identify the hydrates formed and their changes over time. 2 Experimental 2.1 Materials and mix design The cement used in this study was an ordinary Portland cement (CEM I 52.5 R) (OPC) with a calcite content of 1.5wt.%. Set regulators were bassanite and gypsum with shares of 3.2 and 1.2wt.%. As cement substitutes three SCMs have been studied: a blast-furnace slag (BFS), a siliceous fly ash (type V according to EN 197-1) (FA), and a limestone powder with a calcite content of >99% (LS). The chemical and mineralogical composition of these materials determined by means of X-ray fluorescence (XRF) and quantitative X-ray diffraction are given in Tables 1 and 2 . The blast-furnace slag, the fly ash and the limestone were ground separately in a laboratory ball mill, while the OPC was used as received. Fig. 1 shows the particle size distribution (PSD) of the raw materials measured by laser diffraction with a Malvern Mastersizer. The overall PSD of the OPC, the BFS and the FA do not differ significantly from each other while the limestone shows a distinct higher fraction of particles with a diameter larger than 10μm. Blast-furnace slag and fly ash both consist of amorphous and crystalline compounds, which can be determined and quantified by XRD. However, no information on the composition of amorphous phases can be derived by XRD. Thus, the average composition of the amorphous content of the blast-furnace slag and the fly ash was calculated by subtracting the readily soluble alkalis and the fraction of crystalline phases from the total XRF composition and normalizing the results to 100wt.% (Table 3 ). Due to the low crystalline content of the blast-furnace slag, the composition of the amorphous content differs only slightly from the total composition. The amorphous content of the fly ash shows clear differences to the total composition, mainly in the SiO2 and Al2O3 content. This is due to the presence of mullite (19.2wt.%) and quartz (10.2wt.%). Table 4 summarizes the compositions of the investigated quaternary cements. The cement substitution level is always 50wt.%, while the SO3 level of all systems is adjusted with anhydrite to 3wt.%. Two BFS levels of 20 and 30wt.% were investigated. At both of these levels FA is gradually replaced by limestone powder in steps of 5wt.% up to a limestone content of 20wt.%. 2.2 Thermodynamic modeling Thermodynamic modeling was carried out to investigate the changes in volume of the solid phases as well as in the hydrates assemblage, both as a function of added blast-furnace slag and fly ash. The geochemical modeling program GEMS [29,30] was used with thermodynamic data from the PSI-GEMS database [31,32] supplemented by cement specific data [33,34]. C\u2013S\u2013H is described by a solid solution between Ca-rich (C1.67S1.0H2.1) and Si-rich C\u2013S\u2013H (C0.83S1.0H1.33) end-members as described in detail in [34,35]. The use of a solid solution model allows the description of varying Ca/Si ratios in the C\u2013S\u2013H. The activities of the different species were calculated from the measured total concentrations at the respective temperatures using GEMS. The activity coefficients of aqueous species yi were computed with the built-in expanded extended Debye\u2013Hückel equation in Truesdell\u2013Jones form with common parameter a i of 3.67 for KOH solutions: (2) log γ i = - A y z i 2 I 1 + B y a i I + b y I , where zi denotes the charge of species i, I the effective molal ionic strength, by is a semi-empirical parameter (b ≈0.123 for KOH at 25°C), and Ay and By are P, T-dependent coefficients. This activity correction is thought to be applicable up to approx. 1M ionic strength [36]. Data on the density and the molar volume of phases considered in the thermodynamic calculations are given in Table 5 . For the thermodynamic calculations different long-term degrees of reaction were assumed to calculate the phase assemblage after longer hydration times. The used degrees of reaction are 100wt.% for OPC, 70wt.% for the blast-furnace slag and 30wt.% for the fly ash. The values for the SCMs are based on investigations of blast-furnace slag and fly ash blended Portland cements after one year of hydration [22,24,37,38]. As the crystalline phases in both SCMs are either considered to be non-reactive (e.g. quartz or mullite) or are only present in very low amounts, only the amorphous content was assumed to react. The XRD data indicate no significant reaction of the quartz and mullite present in fly ash up to 91days of hydration. This in turn means that the before mentioned overall long term degrees of reaction have to be based on the amorphous part of the blast-furnace slag and the fly ash which leads to elevated values of 71.1wt.% and 43.6 wt.%, respectively. For the calculation of C\u2013S\u2013H a solid solution of Ca-rich C\u2013S\u2013H (C1.67S1.0H2.1) and Si-rich C\u2013S\u2013H (C0.83S1.0H1.33) with varying C/S ratio has been implemented as described in detail in [34,39]. The oxide composition as given in Table 3 was used as input for the equilibrium calculations which give the mass, the volume and the composition of the modeled systems as output. 2.3 Methods of analysis 2.3.1 Investigation of cement pastes To study the phase development, cement paste samples were prepared from 200g of dry material with water to binder ratio of 0.45 using a Twister Evolution vacuum mixer from Renfert. The samples were mixed for 2min at 300rpm and stored at 20°C in 60ml sealed plastic vessels for TGA and XRD studies. For TGA, slices of approximately 3mm where cut from the hardened cement paste and gently crushed with a mortar and pestle. To stop the hydration the resulting powder was immersed in isopropanol for 15min and afterwards filtrated with a Buchner funnel before being flushed with diethylether in order to remove all remaining isopropanol. Drying of the filter cake in a compartment dryer at 40°C for 8min assured the elimination of remaining diethylether. The analysis was carried out directly afterwards on approximately 50mg of the resulting powder using a Mettler Toledo TGA/SDTA851e by monitoring the weight while heating up from 30 to 980°C at a heating rate of 20°C/min under nitrogen atmosphere. The corresponding changes in bound water and portlandite as given in Table 7 are calculated as percentage of the dry sample weight at 500°C according to (3) BW = m total - m dry solids m dry solids · 100 [ % ] , and (4) CH = m H 2 O CH m dry solids · M ( Ca ( OH ) 2 ) M ( H 2 O ) · 100 [ % ] = m H 2 O CH m dry solids · 74 18 · 100 [ % ] , with m total =total mass of \u201cwet\u201d paste, m dry solids =mass of dry paste corresponding to sample weight at 500°C, m H 2 O CH =weight loss due to dehydroxylation of portlandite obtained by the tangent method, M(Ca(OH)2)=molar mass of portlandite and M(H2O)=molar mass of H2O. For XRD experiments, slices where immersed in isopropanol for 20min followed by drying at 40°C for 15min. As immersion in isopropanol is known to affect hydrate phases [40] this procedure was kept as short as possible to avoid loss of information. The slices were placed in a PANalytical X\u2019Pert Pro MPD diffractometer in a θ −2θ configuration with an incident beam monochromator and CuKα radiation (λ =1.54Å). The samples were scanned for 120min between 5° and 75° with an X\u2019Celerator detector. For the evaluation of the gained data in terms of phase identification the X\u2019Pert High Score Plus program version 3.0e from PANalytical was used. 2.3.2 Compressive strength of mortar samples Compressive strength of mortar prisms was determined after 2, 7 and 28days according to EN 196-1. 3 Results and discussion 3.1 Thermodynamic modeling Thermodynamic modeling was applied to investigate the influence of limestone on the hydrate assemblage (Fig. 2 ). To illustrate the effect of limestone a CO2-free OPC containing 30wt.% fly ash and 20wt.% blast-furnace slag was chosen as starting composition. In the absence of CaCO3, C\u2013S\u2013H and monosulfate are calculated to be the main hydrates in a ternary system with 20wt.% blast-furnace slag. The partial replacement of fly ash by CaCO3 is calculated to lead to the consumption of portlandite as the SiO2 present in the fly ash will react with Ca(OH)2 according to Eq. (5): (5) y Ca ( OH ) 2 + SiO 2 + x H 2 O → y CaO · SiO 2 · ( y + x ) H 2 O. The complete replacement of fly ash by CaCO3 leads to the presence of more portlandite as no pozzolanic reaction occurs. A replacement of fly ash by CaCO3 leads to the formation of hemicarbonate, monocarbonate and more ettringite instead of monosulfate according to Eqs. (6) and (7) (additional information on the stoichiometry of AFm amd AFt phases are presented in Table 6 ): (6) 3 C 4 A S \u203e H 12 + CH + C C \u203e + 19 H → C 6 A S \u203e 3 H 32 + 2 C 4 A C \u203e 0.5 H 12 ( 3 × 309 cm 3 + 33 cm 3 + 37 cm 3 → 707 cm 3 + 2 × 285 cm 3 ; Δ V = 28 vol . % ) (7) 3 C 4 A S \u203e H 12 + 2 C C \u203e + 18 H → C 6 A S \u203e 3 H 32 + 2 C 4 A C \u203e H 11 ( see also Eq. ( 1 ) ) ( 3 × 309 cm 3 + 2 × 37 cm 3 → 707 cm 3 + 2 × 262 cm 3 ; Δ V = 23 vol . % ) Numbers in parentheses shows the molar volume of solids and the volume gain due to the reaction with respect to the reactants. In the presence of more CaCO3, monocarbonate is stable according to Eq. (7). From the diffractograms given in Fig. 4 it can be seen that both, hemicarbonate and monocarbonate are present at 182days of hydration. In experimental studies, initially the formation of hemicarbonate is observed as the formation of monocarbonate is kinetically slow [13]. In the long term a transformation of hemicarbonate to monocarbonate is observed. These effects result in a maximum volume of stable hydrates at about 3wt.% CaCO3 content, similar to the effects observed for ternary OPC-BFS-LS and OPC-FA-LS systems [10,17]. Investigations of OPC-limestone and OPC-FA-LS cements have shown that this volume maximum correlates with a maximum of compressive strength [9,19\u201321]. This positive effect is enhanced by increasing Al2O3 content as more ettringite can be stabilized by CaCO3. Thus, the partial substitution of OPC by blast-furnace slag and fly ash should increase the positive effect of the presence of CaCO3. However, the contribution of blast-furnace slag and fly ash to the amount of Al2O3 that is available to form monocarbonate and to stabilize ettringite is limited as both materials exhibit slower reaction rates than OPC. Furthermore, the used blast-furnace slag has a low Al2O3 content. After one year, the reaction of approximately 25\u201330wt.% of fly ash and 70wt.% of blast-furnace slag has been reported [22\u201324,37,38]. Considering the only partial reaction of fly ash and blast-furnace slag, blast-furnace slag contributes approx. 6wt.% and fly ash approx. 8wt.% of reactive Al2O3. Thus, their presence increases the amount of available Al2O3 in the long term. Thermodynamic modeling was also used to study the influence of different fractions of fly ash and blast-furnace slag on the hydrate assemblage. In a ternary system containing 50wt.% of blast-furnace slag and 5wt.% of CaCO3 as shown on the left hand side of Fig. 3, the main hydrates are calcium silicate hydrate (C\u2013S\u2013H), ettringite, monocarbonate, hydrotalcite and portlandite. Successive replacement of blast-furnace slag by fly ash exerts different effects: (i) The total volume of hydrated binder and the amount of C\u2013S\u2013H is slightly reduced due to the lower degree of reaction of the fly ash compared to the blast-furnace slag. (ii) Decrease of the volume of portlandite caused by the pozzolanic reaction with the SiO2 from the fly ash. (iii) The higher Al2O3 and the lower MgO content of the fly ash lead to an increase in monocarbonate and a decrease in hydrotalcite. If a complete reaction of the binder would have been assumed a slightly higher total volume of hydrates would be obtained for the fly ash rich blends, mainly due to the formation of additional C\u2013S\u2013H. Furthermore the complete depletion of portlandite and the formation of strätlingite at high fly ash contents would be calculated as has been shown elsewhere [8]. Thermodynamic modeling predicts no or very little portlandite, as a homogeneous system with C\u2013S\u2013H of C/S∼1.5 is predicted. In real systems generally the presence of significant quantities of portlandite is still observed while C\u2013S\u2013H with a more variable C/S from 1.2 to 1.6 is present [17,41]. Due to inhomogeneities and a disconnected pore network portlandite can persist in some parts of the microstructure while in other areas a low C/S is present. SEM/EDX investigations in blended Portland cements showed a very inhomogeneous microstructure [17,40]; in some areas portlandite persisted while in others the C/S of the C\u2013S\u2013H equaled to 1.2. Such inhomogeneous distribution of the C/S cannot be captured by thermodynamic modeling. In this study quaternary blends with two different blast-furnace slag levels were investigated as indicated in Fig. 3. The calculated total volume of solids as shown in Fig. 2 decreases only very slightly by 1vol.% from 30wt.% to 20wt.% blast-furnace slag content. The corresponding changes in bound water, C\u2013S\u2013H and portlandite are calculated using GEMS as given in Table 7 . 3.2 Hydrates present Results of TGA and XRD investigations at 182days of hydration for selected samples containing 20wt.% blast-furnace slag at different fly ash and limestone quantities are depicted in Figs. 4 and 5. In absence of limestone, the main phases detected by XRD and TGA are calcium silicate hydrate (C\u2013S\u2013H), ettringite, AFm phases (mainly hemicarbonate and a mixed AFm containing sulfate, carbonate and hydroxide [42]) and portlandite. The presence of limestone leads to the formation of hemi- and monocarbonate instead of the monosulfate phases [12]. Furthermore slightly more ettringite is detected as can be seen from the TGA data. XRD data recorded at different sample ages (not presented here) show that during the first weeks only hemicarbonate is observed, while hemi- and monocarbonate are both present at later ages. However, from a thermodynamic point of view only monocarbonate is stable. This initial kinetic hindrance of the monocarbonate formation has previously been reported, e.g. by [12,13]. The formation of mono- and hemicarbonate prevents the monosulfate formation, indirectly stabilizes ettringite (Fig. 2) and is the cause for the increased ettringite content as can be seen from Fig. 5. The slight increase of portlandite in the presence of 5 and 15wt.% limestone is due to the simultaneous reduction of the fly ash content whereby less portlandite is consumed to form C\u2013S\u2013H (see Fig. 6 ). XRD experiments on systems containing 30wt.% blast-furnace slag do not show differences to the data presented in Fig. 4. As shown in Table 8 the bound water content increases up to 91days in all systems. After 91 and 182days the total bound water content is comparable to calculated values (as given in Table 7). The samples with higher blast-furnace slag content have slightly more bound water in agreement with the modeling. This observation underpins the faster reaction of the blast-furnace slag. The portlandite content does not vary significantly between the two blast-furnace slag levels and does not indicate a strong influence of the fly ash used on the extent of the pozzolanic reaction. The portlandite contents are slightly lower in the samples containing more fly ash which is in agreement with the calculated trends in Figs. 2 and 3. The absolute portlandite quantities determined by TGA decrease slowly with time but are considerably higher than the modeled ones even after 182days. This could be related to a lower degree of fly ash reaction than assumed or also due to a inhomogeneous system with lower Ca/Si ratio of C\u2013S\u2013H, as has been observed by [17,19]. 3.3 Development of compressive strength The development of compressive strength up to 28days is shown in Fig. 7 . At 2 and 7days all strength values are located in the same range independent from the composition of the systems. The highest values are reached with 5wt.% additional limestone while both, higher limestone content or limestone absence lead to lower compressive strength. Thus, the presence of low quantities of limestone increases compressive strength as observed in OPC or OPC-FA blends [11,43]. CaCO3 is able to take part actively in the hydration reaction up to 2\u20133wt.% as shown in the thermodynamic calculations presented in Fig. 2. This chemical reaction of limestone has also been reported by [12,44]. At higher shares the remaining calcite will only act passively as filler. The filler effect itself is characterized by supplying higher specific surface available for nucleation and a higher effective water/cement ratio [44\u201346]. The amount of calcite that is able to react depends on the available Al2O3 and thereby on the present SCMs and their composition. The calculated effect of the blast-furnace slag and fly ash contents as a function of CaCO3 on the total volume of solids is depicted in Fig. 8 . All systems blended with blast-furnace slag and/or fly ash show a slightly lower volume of solids compared to OPC. Cement substitution by blast-furnace slag leads to slightly higher calculated volume of solids than substitution by fly ash due to the limited reactivity of the latter. When both materials are incorporated the volume of solids increases with increasing blast-furnace slag content. Blast-furnace slag can form significantly more C\u2013S\u2013H than fly ash due to its faster reaction. The Al2O3 available for reaction from the fly ash leads to more monocarbonate but this cannot compensate for the lower C\u2013S\u2013H content. The steeper decrease of the blast-furnace slag system that is visible from about 2wt.% CaCO3 originates from a decrease in blast-furnace slag content and thereby a decrease in hydrotalcite as well. The formation of hydrotalcite requires both Al2O3 and MgO. The first is provided by the fly ash and the latter by blast-furnace slag. Al2O3 is known to be preferably bound in hydrotalcite [47,48]. As this phase remains constant in the fly ash containing systems a less steep decrease is visible that mainly results from a decrease in C\u2013S\u2013H with decreasing blast-furnace slag content. A slightly higher calculated total volume of solids with higher blast furnace slag content goes along very well with the slightly higher compressive strength observed for corresponding systems (Fig. 7). 4 Conclusions The present study shows the effect of the binder composition in quaternary OPC systems with 50wt.% cement substitution by blast-furnace slag, siliceous fly ash and limestone. (i) The relative fraction of blast-furnace slag, siliceous fly ash or limestone in OPC-blends with 50wt.% substitution exerts no significant influence on strength development at early ages up to 7days. At later ages, a CaCO3 content of 2\u20135wt.% leads to the stabilization of monocarbonate and ettringite, a maximum volume of hydrates (Figs. 2 and 8) and thus to a higher compressive strength as shown in Fig. 7. (ii) The ideal amount of additional limestone depends on the composition and amounts of incorporated fly ash and/or blast-furnace slag as well as the total SO3. Further on the amount of CaCO3 that is already incorporated in OPC has to be taken into account. (iii) The types of hydrates present in ternary or quaternary blends with 50wt.% of OPC are similar to OPC. However, there are some differences in the volume of hydrates and less portlandite is present in blended OPC while more C\u2013S\u2013H and AFm phases can be observed. (iv) The presence of both, fly ash and blast-furnace slag, has little effect on the hydrate assemblage. The replacement of some blast-furnace slag by fly ash leads to a slight decrease in the amount of portlandite and C\u2013S\u2013H and to the formation of more AFm phases (monocarbonate and hemicarbonate). Portlandite is consumed in the pozzolanic reaction with the fly ash to form C\u2013S\u2013H. However, the limited assumed degree of reaction as well as the low amorphous content of the fly ash itself leads to lower calculated C\u2013S\u2013H. The low reactivity also causes the slightly reduced total volume of solids and compressive strength at high fly ash content. Yet, these effects are small and consequently amounts of up to 30wt.% fly ash can be used in quaternary blends without significant loss of compressive strength. Acknowledgements This study was financially and analytically supported by HeidelbergCement, Leimen, Germany. The authors wish to acknowledge H.-M. Ludwig and F. Bellmann (Bauhaus University Weimar) for helpful and inspiring discussions and Luigi Brunetti and Boris Ingold (Empa, Laboratory for Concrete and Construction Chemistry) for technical support. References [1] J.S. Damtoft J. Lukasik D. Herfort D. Sorrentino E.M. Gartner Sustainable development and climate change initiatives Cem Concr Res 38 2 2008 115 127 [2] M. Schneider M. Romer M. Tschudin H. Bolio Sustainable cement production at present and future Cem Concr Res 41 7 2011 642 650 [3] P.D. Tennis M.D.A. Thomas W.J. Weiss State-of-the-art-report on use of limestone in cement at levels of up to 15% 2011 Portland Cement Association Skokie [4] European construction in service of society ecoserve network, Cluster 2: Production and Application of Blended Cements; 2005. [5] S. Tsivilis G. Batis E. Chaniotakis G. Grigoriadis D. Theodossis Properties and behavior of limestone cement concrete and mortar Cem Concr Res 30 10 2000 1679 1683 [6] X.-Y. Wang H.-S. Lee Modelling the hydration of concrete incorporating fly ash or slag Cem Concr Res 40 7 2010 984 996 [7] R. Vuk V. Tinta R. Grabrovšek V. Kauči The effects of limestone addition, clinker type and fineness on properties of Portland cement Cem Concr Res 31 1 2001 135 139 [8] B. Lothenbach K.L. Scrivener R.D. Hooton Supplementary cementitious materials Cem Concr Res 41 12 2011 1244 1256 [9] M.F. Carrasco G. Menendez V. Bonavetti E.F. Irassar Strength optimization of tailor-made cement with limestone filler and blast-furnace slag Cem Concr Res 35 7 2005 1324 1331 [10] G. Menendez V. Bonavetti E.F. Irassar Strength development of ternary blended cement with limestone filler and blast-furnace slag Cem Concr Compos 25 1 2003 61 67 [11] K. De Weerdt K.O. Kjellsen E. Sellevold H. Justnes Synergy between fly ash and limestone powder in ternary cements Cem Concr Compos 33 1 2011 30 38 [12] B. Lothenbach G. Le Saout E. Gallucci K.L. Scrivener Influence of limestone on the hydration of Portland cements Cem Concr Res 38 6 2008 848 860 [13] M. Zajac A. Rossberg G. Le Saoût B. Lothenbach Influence of limestone and anhydrite on the hydration of Portland cements Cem Concr Compos 46 2014 99 108 [14] T. Matschei B. Lothenbach F.P. Glasser The AFm phase in Portland cement Cem Concr Res 37 2007 118 130 [15] D. Damidot F.P. Glasser Thermodynamic investigation of the CaO\u2013Al2O3\u2013CaSO4\u2013H2O system at 50°C and 85°C Cem Concr Res 22 6 1992 1179 1191 [16] D. Damidot S. Stronach A. Kindness M. Atkins F.P. Glasser Thermodynamic investigation of the CaO\u2013Al2O3\u2013CaCO3\u2013H2O closed system at 25°C and influence of Na2O Cem Concr Res 24 1994 563 572 [17] K. De Weerdt M. Ben Haha G. Le Saoût K.O. Kjellsen H. Justnes B. Lothenbach Hydration mechanisms of ternary Portland cements containing limestone powder and fly ash Cem Concr Res 41 3 2011 279 291 [18] T. Matschei B. Lothenbach F.P. Glasser The role of calcium carbonate in cement hydration Cem Concr Res 37 2007 551 558 [19] De Weerdt K, Justnes H, Lothenbach B, Ben Haha M. The effect of limestone powder additions on strength and microstructure of fly ash blended cements. In: 13th international conference on the chemistry of cement. Madrid; 2011. [20] M. Moesgaard D. Herfort M. Steenberg L. Frank Kirkegaard Y.Z. Yue Physical performances of blended cements containing calcium alumosilicate glass powder and limestone Cem Concr Res 41 3 2011 359 364 [21] D. Damidot B. Lothenbach D. Herfort F.P. Glasser Thermodynamics and cement science Cem Concr Res 41 7 2011 679 695 [22] M. Ben Haha K. De Weerdt B. Lothenbach Quantification of the degree of reaction of fly ash Cem Concr Res 40 11 2010 1620 1629 [23] K. De Weerdt M. Ben Haha G. Le Saoût K.O. Kjellsen H. Justnes B. Lothenbach The effect of temperature on the hydration of composite cements containing limestone powder and fly ash Mater Struct 45 7 2012 1101 1114 [24] F. Deschner B. Münch F. Winnefeld B. Lothenbach Quantification of fly ash in hydrated, blended Portland cement pastes by backscattered electron imaging J Microsc 251 2 2013 188 204 [25] CEN/TC 51 \u2013 Cement and building limes, N 1146 \u2013 Presentation of WG 6, Definition and terminology of cement, Progress Report, Athens, March 2012. [26] B. Espion B. Lebon C. Pierre O. Germain A. Hellebois Characterisation of new ternary cements with reduced clinker content K. Sakai First international conference on concrete sustainability 2013 Japan Concrete Institute Tokyo 145 152 [27] Güteüberwachung und Qualitätssicherung von Zement. VDZ-Tätigkeitsbericht 2009\u20132012. <http://www.vdz-online.de/fileadmin/gruppen/vdz/3LiteraturRecherche/TaeB09-12/TaeB_09-12_gesamt.pdf>. [28] Iñiguez Sánchez CA, Gómez Zamorano LY, Lothenbach B. Microstructure and mechanical properties of composite cements with ultra fine silica waste additions. In: 13th International Conference on the Chemistry of Cement. Madrid 2011. 7p. [29] T. Wagner D. Kulik F.F. Hingerl S.V. Dmytrievana Gem-selektor geochemical modelling package: TSolMod library and data interface for multicomponent phase models Can Mineral 50 5 2012 1173 1195 [30] D.A. Kulik T. Wagner S.V. Dmytrieva G. Kosakowski F.F. Hingerl K.V. Chudnenko GEM-Selektor geochemical modeling package: revised algorithm and GEMS3K numerical kernel for coupled simulation codes Comput Geosci 17 1 2013 1 24 [31] Thoenen T, Kulik D. Nagra/PSI chemical thermodynamic database 01/01 for GEMS-selektor (V.2-PSI) geochemical modelling code. PSI, Villingen; 2003. [32] Hummel W, Berner U, Curti E, Pearson FJ, Thoenen T. Nagra Technical Report NTB 02-16. Wettingen, Switzerland; 2002. [33] T. Matschei B. Lothenbach F.P. Glasser Thermodynamic properties of Portland cement hydrates in the system CaO\u2013Al2O3\u2013SiO2\u2013CaSO4\u2013CaCO3\u2013H2O Cem Concr Res 37 10 2007 1379 1410 [34] B. Lothenbach T. Matschei G. Möschner F.P. Glasser Thermodynamic modelling of the effect of temperature on the hydration and porosity of Portland cement Cem Concr Res 38 1 2008 1 18 [35] D.A. Kulik M. Kersten Aqueous solubility diagrams for cementitious waste stabilization systems: II, End-member stoichiometries of ideal calcium silicate hydrate solid solutions J Am Ceram Soc 84 2001 3017 3026 [36] H.C. Helgeson D.H. Kirkham G.C. Flowers Theoretical prediction of the thermodynamic behaviour of aqueous electrolytes at high pressures and temperatures: IV. Calculation of activity coefficients, osmotic coefficients, and apparent molal and standard and relative partial molal properties to 600°C and 5Kb Am J Sci 281 1981 1249 1516 [37] V. Kocaba E. Gallucci K.L. Scrivener Methods for determination of degree of reaction of slag in blended cement pastes Cem Concr Res 42 3 2012 511 525 [38] B. Lothenbach G. Le Saout M. Ben Haha R. Figi E. Wieland Hydration of a low-alkali CEM III/B\u2013SiO2 cement (LAC) Cem Concr Res 42 2 2012 410 423 [39] D.A. Kulik Improving the structural consistency of C\u2013S\u2013H solid solution thermodynamic models Cem Concr Res 41 2011 477 495 [40] V. Kocaba Development and evaluation of methods to follow microstructural development of cementitious systems including slags 2009 École Polytechnique Fédérale de Lausanne Lausanne [41] F. Deschner F. Winnefeld B. Lothenbach S. Seufert P. Schwesig S. Dittrich Hydration of Portland cement with high replacement by siliceous fly ash Cem Concr Res 42 10 2012 1389 1400 [42] H. Pöllmann Syntheses, properties and solid solutions of ternary lamellar calcium aluminate hydroxi salts (AFm-phases) containing SO4 2−, CO3 2− and OH− N Jb Miner Abh 182 2 2006 173 181 [43] S. Tsivilis E. Chaniotakis G. Kakali G. Batis An analysis of the properties of Portland limestone cements and concrete Cem Concr Compos 24 3\u20134 2002 371 378 [44] V. Bonavetti V.F. Rahhal E.F. Irassar Studies on the carboaluminate formation in limestone filler blended cements Cem Concr Res 31 6 2001 853 859 [45] W.A. Gutteridge J.A. Dalziel Filler cement \u2013 the effect of the secondary component on the hydration of Portland cement Part 1: fine nonhydraulic filler Cem Concr Res 20 1990 778 782 [46] W.A. Gutteridge J.A. Dalziel Filler cement: the effect of the secondary component on the hydration of Portland cement: Part 2: fine hydraulic binders Cem Concr Res 20 1990 853 861 [47] M. Ben Haha B. Lothenbach G. Le Saout F. Winnefeld Influence of slag chemistry on the hydration of alkali-activated blast-furnace slag \u2013 Part I: effect of MgO Cem Concr Res 41 9 2011 955 963 [48] M. Ben Haha B. Lothenbach G. Le Saoût F. Winnefeld Influence of slag chemistry on the hydration of alkali-activated blast-furnace slag \u2013 Part II: effect of Al2O3 Cem Concr Res 41 1 2012 74 83 [49] L. León-Reina A.G. De la Torre J.M. Porras-Vázquez M. Cruz L.M. Ordonez X. Alcobé Round robin on Rietveld quantitative phase analysis of Portland cements J Appl Cryst 42 2009 906 916 [50] B. Franke Bestimmung von Calciumoxyd und Calciumhydroxyd neben wasserfreiem und wasserhaltigem Calciumsilikat Z Anorg Allg Chem 247 1\u20132 1941 180 184",
    "scopus-id": "84909643196",
    "coredata": {
        "eid": "1-s2.0-S0958946514001863",
        "dc:description": "In this study the hydration of quaternary Portland cements containing blast-furnace slag, type V fly ash and limestone and the relationship between the types and contents of supplementary cementitious materials and the hydrate assemblage were investigated at ages of up to 182days using X-ray diffraction and thermogravimetric analysis. In addition thermodynamic modeling was used to calculate the total volume of hydrates. Two blast-furnace slag contents of 20 and 30wt.% were studied in blends containing fly ash and/or limestone at a cement replacement of 50wt.%. In all cases the experiments showed the presence of C\u2013S\u2013H, portlandite and ettringite. In samples without limestone, monosulfate was formed; in the presence of limestone monocarbonate was present instead. The addition of 5wt.% of limestone resulted in a higher compressive strength after 28days than observed for cements with lower or higher limestone content. Overall the presence of fly ash exerts little influence on the hydrate assemblage. The strength development reveals that amounts of up to 30wt.% fly ash can be used in quaternary cements without significant loss in compressive strength.",
        "openArchiveArticle": "false",
        "prism:coverDate": "2015-01-31",
        "openaccessUserLicense": null,
        "prism:aggregationType": "Journal",
        "prism:url": "https://api.elsevier.com/content/article/pii/S0958946514001863",
        "dc:creator": [
            {
                "@_fa": "true",
                "$": "Schöler, Axel"
            },
            {
                "@_fa": "true",
                "$": "Lothenbach, Barbara"
            },
            {
                "@_fa": "true",
                "$": "Winnefeld, Frank"
            },
            {
                "@_fa": "true",
                "$": "Zajac, Maciej"
            }
        ],
        "link": [
            {
                "@_fa": "true",
                "@rel": "self",
                "@href": "https://api.elsevier.com/content/article/pii/S0958946514001863"
            },
            {
                "@_fa": "true",
                "@rel": "scidir",
                "@href": "https://www.sciencedirect.com/science/article/pii/S0958946514001863"
            }
        ],
        "dc:format": "application/json",
        "openaccessType": null,
        "pii": "S0958-9465(14)00186-3",
        "prism:volume": "55",
        "prism:publisher": "Elsevier Ltd.",
        "dc:title": "Hydration of quaternary Portland cement blends containing blast-furnace slag, siliceous fly ash and limestone powder",
        "prism:copyright": "Copyright © 2014 Elsevier Ltd. All rights reserved.",
        "openaccess": "0",
        "prism:issn": "09589465",
        "dcterms:subject": [
            {
                "@_fa": "true",
                "$": "Quaternary Portland cement"
            },
            {
                "@_fa": "true",
                "$": "Blast-furnace slag"
            },
            {
                "@_fa": "true",
                "$": "Fly ash"
            },
            {
                "@_fa": "true",
                "$": "Thermodynamic modeling"
            },
            {
                "@_fa": "true",
                "$": "Limestone"
            },
            {
                "@_fa": "true",
                "$": "Hydrates"
            }
        ],
        "openaccessArticle": "false",
        "prism:publicationName": "Cement and Concrete Composites",
        "openaccessSponsorType": null,
        "prism:pageRange": "374-382",
        "prism:endingPage": "382",
        "pubType": "fla",
        "prism:coverDisplayDate": "January 2015",
        "prism:doi": "10.1016/j.cemconcomp.2014.10.001",
        "prism:startingPage": "374",
        "dc:identifier": "doi:10.1016/j.cemconcomp.2014.10.001",
        "openaccessSponsorName": null
    },
    "objects": {"object": [
        {
            "@category": "thumbnail",
            "@height": "164",
            "@width": "148",
            "@_fa": "true",
            "$": "https://api.elsevier.com/content/object/eid/1-s2.0-S0958946514001863-gr1.sml?httpAccept=%2A%2F%2A",
            "@multimediatype": "GIF image file",
            "@type": "IMAGE-THUMBNAIL",
            "@size": "7889",
            "@ref": "gr1",
            "@mimetype": "image/gif"
        },
        {
            "@category": "thumbnail",
            "@height": "164",
            "@width": "218",
            "@_fa": "true",
            "$": "https://api.elsevier.com/content/object/eid/1-s2.0-S0958946514001863-gr2.sml?httpAccept=%2A%2F%2A",
            "@multimediatype": "GIF image file",
            "@type": "IMAGE-THUMBNAIL",
            "@size": "13176",
            "@ref": "gr2",
            "@mimetype": "image/gif"
        },
        {
            "@category": "thumbnail",
            "@height": "160",
            "@width": "219",
            "@_fa": "true",
            "$": "https://api.elsevier.com/content/object/eid/1-s2.0-S0958946514001863-gr3.sml?httpAccept=%2A%2F%2A",
            "@multimediatype": "GIF image file",
            "@type": "IMAGE-THUMBNAIL",
            "@size": "12725",
            "@ref": "gr3",
            "@mimetype": "image/gif"
        },
        {
            "@category": "thumbnail",
            "@height": "164",
            "@width": "208",
            "@_fa": "true",
            "$": "https://api.elsevier.com/content/object/eid/1-s2.0-S0958946514001863-gr4.sml?httpAccept=%2A%2F%2A",
            "@multimediatype": "GIF image file",
            "@type": "IMAGE-THUMBNAIL",
            "@size": "7655",
            "@ref": "gr4",
            "@mimetype": "image/gif"
        },
        {
            "@category": "thumbnail",
            "@height": "153",
            "@width": "219",
            "@_fa": "true",
            "$": "https://api.elsevier.com/content/object/eid/1-s2.0-S0958946514001863-gr5.sml?httpAccept=%2A%2F%2A",
            "@multimediatype": "GIF image file",
            "@type": "IMAGE-THUMBNAIL",
            "@size": "7035",
            "@ref": "gr5",
            "@mimetype": "image/gif"
        },
        {
            "@category": "thumbnail",
            "@height": "158",
            "@width": "219",
            "@_fa": "true",
            "$": "https://api.elsevier.com/content/object/eid/1-s2.0-S0958946514001863-gr6.sml?httpAccept=%2A%2F%2A",
            "@multimediatype": "GIF image file",
            "@type": "IMAGE-THUMBNAIL",
            "@size": "8100",
            "@ref": "gr6",
            "@mimetype": "image/gif"
        },
        {
            "@category": "thumbnail",
            "@height": "164",
            "@width": "211",
            "@_fa": "true",
            "$": "https://api.elsevier.com/content/object/eid/1-s2.0-S0958946514001863-gr7.sml?httpAccept=%2A%2F%2A",
            "@multimediatype": "GIF image file",
            "@type": "IMAGE-THUMBNAIL",
            "@size": "6306",
            "@ref": "gr7",
            "@mimetype": "image/gif"
        },
        {
            "@category": "thumbnail",
            "@height": "164",
            "@width": "214",
            "@_fa": "true",
            "$": "https://api.elsevier.com/content/object/eid/1-s2.0-S0958946514001863-gr8.sml?httpAccept=%2A%2F%2A",
            "@multimediatype": "GIF image file",
            "@type": "IMAGE-THUMBNAIL",
            "@size": "8185",
            "@ref": "gr8",
            "@mimetype": "image/gif"
        },
        {
            "@category": "standard",
            "@height": "416",
            "@width": "376",
            "@_fa": "true",
            "$": "https://api.elsevier.com/content/object/eid/1-s2.0-S0958946514001863-gr1.jpg?httpAccept=%2A%2F%2A",
            "@multimediatype": "JPEG image file",
            "@type": "IMAGE-DOWNSAMPLED",
            "@size": "36697",
            "@ref": "gr1",
            "@mimetype": "image/jpeg"
        },
        {
            "@category": "standard",
            "@height": "355",
            "@width": "472",
            "@_fa": "true",
            "$": "https://api.elsevier.com/content/object/eid/1-s2.0-S0958946514001863-gr2.jpg?httpAccept=%2A%2F%2A",
            "@multimediatype": "JPEG image file",
            "@type": "IMAGE-DOWNSAMPLED",
            "@size": "52190",
            "@ref": "gr2",
            "@mimetype": "image/jpeg"
        },
        {
            "@category": "standard",
            "@height": "349",
            "@width": "478",
            "@_fa": "true",
            "$": "https://api.elsevier.com/content/object/eid/1-s2.0-S0958946514001863-gr3.jpg?httpAccept=%2A%2F%2A",
            "@multimediatype": "JPEG image file",
            "@type": "IMAGE-DOWNSAMPLED",
            "@size": "49660",
            "@ref": "gr3",
            "@mimetype": "image/jpeg"
        },
        {
            "@category": "standard",
            "@height": "296",
            "@width": "375",
            "@_fa": "true",
            "$": "https://api.elsevier.com/content/object/eid/1-s2.0-S0958946514001863-gr4.jpg?httpAccept=%2A%2F%2A",
            "@multimediatype": "JPEG image file",
            "@type": "IMAGE-DOWNSAMPLED",
            "@size": "25685",
            "@ref": "gr4",
            "@mimetype": "image/jpeg"
        },
        {
            "@category": "standard",
            "@height": "265",
            "@width": "378",
            "@_fa": "true",
            "$": "https://api.elsevier.com/content/object/eid/1-s2.0-S0958946514001863-gr5.jpg?httpAccept=%2A%2F%2A",
            "@multimediatype": "JPEG image file",
            "@type": "IMAGE-DOWNSAMPLED",
            "@size": "22685",
            "@ref": "gr5",
            "@mimetype": "image/jpeg"
        },
        {
            "@category": "standard",
            "@height": "362",
            "@width": "500",
            "@_fa": "true",
            "$": "https://api.elsevier.com/content/object/eid/1-s2.0-S0958946514001863-gr6.jpg?httpAccept=%2A%2F%2A",
            "@multimediatype": "JPEG image file",
            "@type": "IMAGE-DOWNSAMPLED",
            "@size": "43287",
            "@ref": "gr6",
            "@mimetype": "image/jpeg"
        },
        {
            "@category": "standard",
            "@height": "281",
            "@width": "363",
            "@_fa": "true",
            "$": "https://api.elsevier.com/content/object/eid/1-s2.0-S0958946514001863-gr7.jpg?httpAccept=%2A%2F%2A",
            "@multimediatype": "JPEG image file",
            "@type": "IMAGE-DOWNSAMPLED",
            "@size": "22000",
            "@ref": "gr7",
            "@mimetype": "image/jpeg"
        },
        {
            "@category": "standard",
            "@height": "286",
            "@width": "373",
            "@_fa": "true",
            "$": "https://api.elsevier.com/content/object/eid/1-s2.0-S0958946514001863-gr8.jpg?httpAccept=%2A%2F%2A",
            "@multimediatype": "JPEG image file",
            "@type": "IMAGE-DOWNSAMPLED",
            "@size": "26349",
            "@ref": "gr8",
            "@mimetype": "image/jpeg"
        },
        {
            "@category": "thumbnail",
            "@height": "19",
            "@width": "75",
            "@_fa": "true",
            "$": "https://api.elsevier.com/content/object/eid/1-s2.0-S0958946514001863-si1.gif?httpAccept=%2A%2F%2A",
            "@multimediatype": "GIF image file",
            "@type": "ALTIMG",
            "@size": "506",
            "@ref": "si1",
            "@mimetype": "image/gif"
        },
        {
            "@category": "thumbnail",
            "@height": "42",
            "@width": "479",
            "@_fa": "true",
            "$": "https://api.elsevier.com/content/object/eid/1-s2.0-S0958946514001863-si10.gif?httpAccept=%2A%2F%2A",
            "@multimediatype": "GIF image file",
            "@type": "ALTIMG",
            "@size": "3010",
            "@ref": "si10",
            "@mimetype": "image/gif"
        },
        {
            "@category": "thumbnail",
            "@height": "14",
            "@width": "55",
            "@_fa": "true",
            "$": "https://api.elsevier.com/content/object/eid/1-s2.0-S0958946514001863-si11.gif?httpAccept=%2A%2F%2A",
            "@multimediatype": "GIF image file",
            "@type": "ALTIMG",
            "@size": "365",
            "@ref": "si11",
            "@mimetype": "image/gif"
        },
        {
            "@category": "thumbnail",
            "@height": "19",
            "@width": "399",
            "@_fa": "true",
            "$": "https://api.elsevier.com/content/object/eid/1-s2.0-S0958946514001863-si12.gif?httpAccept=%2A%2F%2A",
            "@multimediatype": "GIF image file",
            "@type": "ALTIMG",
            "@size": "1664",
            "@ref": "si12",
            "@mimetype": "image/gif"
        },
        {
            "@category": "thumbnail",
            "@height": "73",
            "@width": "464",
            "@_fa": "true",
            "$": "https://api.elsevier.com/content/object/eid/1-s2.0-S0958946514001863-si13.gif?httpAccept=%2A%2F%2A",
            "@multimediatype": "GIF image file",
            "@type": "ALTIMG",
            "@size": "3842",
            "@ref": "si13",
            "@mimetype": "image/gif"
        },
        {
            "@category": "thumbnail",
            "@height": "47",
            "@width": "538",
            "@_fa": "true",
            "$": "https://api.elsevier.com/content/object/eid/1-s2.0-S0958946514001863-si14.gif?httpAccept=%2A%2F%2A",
            "@multimediatype": "GIF image file",
            "@type": "ALTIMG",
            "@size": "4014",
            "@ref": "si14",
            "@mimetype": "image/gif"
        },
        {
            "@category": "thumbnail",
            "@height": "17",
            "@width": "69",
            "@_fa": "true",
            "$": "https://api.elsevier.com/content/object/eid/1-s2.0-S0958946514001863-si2.gif?httpAccept=%2A%2F%2A",
            "@multimediatype": "GIF image file",
            "@type": "ALTIMG",
            "@size": "501",
            "@ref": "si2",
            "@mimetype": "image/gif"
        },
        {
            "@category": "thumbnail",
            "@height": "19",
            "@width": "74",
            "@_fa": "true",
            "$": "https://api.elsevier.com/content/object/eid/1-s2.0-S0958946514001863-si3.gif?httpAccept=%2A%2F%2A",
            "@multimediatype": "GIF image file",
            "@type": "ALTIMG",
            "@size": "530",
            "@ref": "si3",
            "@mimetype": "image/gif"
        },
        {
            "@category": "thumbnail",
            "@height": "19",
            "@width": "32",
            "@_fa": "true",
            "$": "https://api.elsevier.com/content/object/eid/1-s2.0-S0958946514001863-si4.gif?httpAccept=%2A%2F%2A",
            "@multimediatype": "GIF image file",
            "@type": "ALTIMG",
            "@size": "323",
            "@ref": "si4",
            "@mimetype": "image/gif"
        },
        {
            "@category": "thumbnail",
            "@height": "18",
            "@width": "368",
            "@_fa": "true",
            "$": "https://api.elsevier.com/content/object/eid/1-s2.0-S0958946514001863-si5.gif?httpAccept=%2A%2F%2A",
            "@multimediatype": "GIF image file",
            "@type": "ALTIMG",
            "@size": "5781",
            "@ref": "si5",
            "@mimetype": "image/gif"
        },
        {
            "@category": "thumbnail",
            "@height": "18",
            "@width": "62",
            "@_fa": "true",
            "$": "https://api.elsevier.com/content/object/eid/1-s2.0-S0958946514001863-si6.gif?httpAccept=%2A%2F%2A",
            "@multimediatype": "GIF image file",
            "@type": "ALTIMG",
            "@size": "375",
            "@ref": "si6",
            "@mimetype": "image/gif"
        },
        {
            "@category": "thumbnail",
            "@height": "18",
            "@width": "63",
            "@_fa": "true",
            "$": "https://api.elsevier.com/content/object/eid/1-s2.0-S0958946514001863-si7.gif?httpAccept=%2A%2F%2A",
            "@multimediatype": "GIF image file",
            "@type": "ALTIMG",
            "@size": "383",
            "@ref": "si7",
            "@mimetype": "image/gif"
        },
        {
            "@category": "thumbnail",
            "@height": "48",
            "@width": "187",
            "@_fa": "true",
            "$": "https://api.elsevier.com/content/object/eid/1-s2.0-S0958946514001863-si8.gif?httpAccept=%2A%2F%2A",
            "@multimediatype": "GIF image file",
            "@type": "ALTIMG",
            "@size": "1239",
            "@ref": "si8",
            "@mimetype": "image/gif"
        },
        {
            "@category": "thumbnail",
            "@height": "39",
            "@width": "250",
            "@_fa": "true",
            "$": "https://api.elsevier.com/content/object/eid/1-s2.0-S0958946514001863-si9.gif?httpAccept=%2A%2F%2A",
            "@multimediatype": "GIF image file",
            "@type": "ALTIMG",
            "@size": "1459",
            "@ref": "si9",
            "@mimetype": "image/gif"
        }
    ]},
    "link": {
        "@rel": "abstract",
        "@href": "https://api.elsevier.com/content/abstract/scopus_id/84909643196"
    }
}}